{"id": "tt0079826", "cast": [{"character": "Mary Rose Foster", "name": "Bette Midler"}, {"character": "Rudge Campbell", "name": "Alan Bates"}, {"character": "Huston Dyer", "name": "Frederic Forrest"}, {"character": "Billy Ray", "name": "Harry Dean Stanton"}, {"character": "Pfc. Mal", "name": "David Keith"}, {"character": "Mrs. Foster", "name": "Doris Roberts"}], "crew": [{"job": "Director", "name": "Mark Rydell"}, {"job": "Screenplay", "name": "Bo Goldman"}, {"job": "Screenplay", "name": "Bill Kerby"}, {"job": "Screenplay", "name": "Michael Cimino"}, {"job": "Producer", "name": "Aaron Russo"}, {"job": "Producer", "name": "Marvin Worth"}], "title": "The Rose", "genres": ["Drama", "Music", "Romance"], "keywords": ["drugs", "rock band", "roses"], "original_language": "English", "rating": "R", "release_date": "1979-11-07", "revenue": 29174648.0, "runtime": 125, "summary": "Bette Midler plays The Rose, a female rock star strikingly similar to Janis Joplin. The film follows Rose's career during her last tour, as she's determined to return to her Florida hometown. Although a success, she's exhausted and lonely but continued working by her gruff and greedy manager. Though loud and brassy, Rose is an insecure alcoholic and former drug user who seems to crave approval in her life. She begins a romance with a limousine driver, who's actually an AWOL sergeant from the United States Army. Her rock and roll lifestyle of Drugs, Sex, and Rock and Roll and constant touring lead her to an inevitable breakdown.", "tokens": ["bett", "midler", "plai", "the", "rose", "femal", "rock", "star", "strikingli", "similar", "jani", "joplin", "the", "film", "follow", "rose", "career", "last", "tour", "determin", "return", "florida", "hometown", "although", "success", "exhaust", "lone", "continu", "work", "gruff", "greedi", "manag", "though", "loud", "brassi", "rose", "insecur", "alcohol", "former", "drug", "user", "seem", "crave", "approv", "life", "she", "begin", "romanc", "limousin", "driver", "actual", "awol", "sergeant", "unit", "state", "armi", "her", "rock", "roll", "lifestyl", "drug", "sex", "rock", "roll", "constant", "tour", "lead", "inevit", "breakdown"], "tmdb_score_value": 7.0, "tmdb_score_count": 33, "imdb_score_value": 7.0, "imdb_score_count": 6842, "meta_score_value": 67.0, "meta_score_count": 9}