{"id": "tt0092549", "cast": [{"character": "Mark", "name": "Y.K. Kim"}, {"character": "John", "name": "Vincent Hirsch"}, {"character": "Jack", "name": "Joseph Diamand"}, {"character": "Jim", "name": "Maurice Smith"}, {"character": "Tom", "name": "Angelo Janotti"}, {"character": "Jane", "name": "Kathy Collier"}, {"character": "Jeff (as William Ergle)", "name": "William Eagle"}, {"character": "Yashito", "name": "Si Y Jo"}, {"character": "Uncle Song (as Richard Park)", "name": "Woo-sang Park"}, {"character": "Music Store Owner", "name": "William Whitacre"}], "crew": [{"job": "Director", "name": "Y.K. Kim"}, {"job": "Director", "name": "Woo-sang Park"}, {"job": "Screenplay", "name": "Joseph Diamand"}], "title": "Miami Connection", "genres": ["Action", "Crime"], "keywords": ["ninja", "blood", "computer class"], "original_language": "English", "rating": "R", "release_date": "1987-08-18", "revenue": 0.0, "runtime": 86, "summary": "The year is 1987. Motorcycle ninjas tighten their grip on Florida's narcotics trade, viciously annihilating anyone who dares move in on their turf. Multi-national martial arts rock band Dragon Sound have had enough, and embark on a roundhouse wreck-wave of crime-crushing justice. When not chasing beach bunnies or performing their hit song \"Against the Ninja,\" Mark (taekwondo master/inspirational speaker Y.K. Kim) and the boys are kicking and chopping at the drug world's smelliest underbelly. It'll take every ounce of their blood and courage, but Dragon Sound can't stop until they've completely destroyed the dealers, the drunk bikers, the kill-crazy ninjas, the middle-aged thugs, the \"stupid cocaine\"...and the entire MIAMI CONNECTION!!!", "tokens": ["the", "year", "1987", "motorcycl", "ninja", "tighten", "grip", "florida", "narcot", "trade", "vicious", "annihil", "anyon", "dare", "move", "turf", "multi", "nation", "martial", "art", "rock", "band", "dragon", "sound", "enough", "embark", "roundhous", "wreck", "wave", "crime", "crush", "justic", "when", "chase", "beach", "bunni", "perform", "hit", "song", "against", "ninja", "mark", "taekwondo", "master/inspir", "speaker", "y", "k", "kim", "boi", "kick", "chop", "drug", "world", "smelliest", "underbelli", "it", "take", "everi", "ounc", "blood", "courag", "dragon", "sound", "stop", "complet", "destroi", "dealer", "drunk", "biker", "kill", "crazi", "ninja", "middl", "ag", "thug", "stupid", "cocain", "entir", "miami", "connect"], "tmdb_score_value": 6.2, "tmdb_score_count": 37, "imdb_score_value": 5.9, "imdb_score_count": 3359, "meta_score_value": 56.0, "meta_score_count": 4}