{"id": "tt0096257", "cast": [{"character": "Himself", "name": "Randall Adams"}, {"character": "Himself", "name": "David Harris"}, {"character": "Himself (Homicide Detective in Dallas)", "name": "Gus Rose"}, {"character": "Herself (Homicide Detective in Dallas)", "name": "Jackie Johnson"}], "crew": [{"job": "Director", "name": "Errol Morris"}, {"job": "Writer", "name": "Errol Morris"}], "title": "The Thin Blue Line", "genres": ["Crime", "Documentary", "Mystery"], "keywords": ["death penalty", "investigation", "murder", "police officer", "court trial"], "original_language": "English", "rating": "NOT RATED", "release_date": "1988-08-28", "revenue": 1209846.0, "runtime": 103, "summary": "Errol Morris's unique documentary dramatically re-enacts the crime scene and investigation of a police officer's murder in Dallas, Texas. Briefly, a drifter (Randall Adams) ran out of gas and was picked up by a 16-year-old runaway (David Harris). Later that night, they drank some beer, smoked some marijuana, and went to the movies. Then, their stories diverged. Adams claimed that he left for his motel, where he was staying with his brother, and went to sleep. Harris, however, said that they were stopped by police late that night, and Adams suddenly shot the officer approaching their car. The film shows the audience the evidence gathered by the police, who were under extreme pressure to clear the case. It strongly makes a point that the circumstantial evidence was very flimsy. In fact, it becomes apparent that Harris was a much more likely suspect and was in the middle of a crime spree, eventually ending up on Death Row himself for the later commission of other crimes. Morris implies ...", "tokens": ["errol", "morri", "uniqu", "documentari", "dramat", "enact", "crime", "scene", "investig", "polic", "offic", "murder", "dalla", "texa", "briefli", "drifter", "randal", "adam", "ran", "ga", "pick", "16", "year", "old", "runawai", "david", "harri", "later", "night", "drank", "beer", "smoke", "marijuana", "went", "movi", "then", "stori", "diverg", "adam", "claim", "left", "motel", "stai", "brother", "went", "sleep", "harri", "howev", "said", "stop", "polic", "late", "night", "adam", "suddenli", "shot", "offic", "approach", "car", "the", "film", "show", "audienc", "evid", "gather", "polic", "extrem", "pressur", "clear", "case", "it", "strongli", "make", "point", "circumstanti", "evid", "flimsi", "in", "fact", "becom", "appar", "harri", "much", "like", "suspect", "middl", "crime", "spree", "eventu", "end", "death", "row", "later", "commiss", "crime", "morri", "impli"], "tmdb_score_value": 7.9, "tmdb_score_count": 149, "imdb_score_value": 8.1, "imdb_score_count": 18447, "meta_score_value": 79.0, "meta_score_count": 12}