{"id": "tt0061177", "cast": [{"character": "Phil Moscowitz", "name": "Tatsuya Mihashi"}, {"character": "Suki Yaki", "name": "Akiko Wakabayashi"}, {"character": "Teri Yaki", "name": "Mie Hama"}, {"character": "Himself", "name": "John Sebastian"}, {"character": "Shepherd Wong", "name": "Tadao Nakamaru"}, {"character": "Wing Fat", "name": "Susumu Kurobe"}, {"character": "Hoodlum", "name": "Sachio Sakai"}, {"character": "Cobra Man", "name": "Hideyo Amamoto"}, {"character": "Foreign Minister", "name": "Tetsu Nakamura"}, {"character": "Gambler", "name": "Osman Yusuf"}, {"character": "Himself / Dub Voice / Projectionist", "name": "Woody Allen"}, {"character": "Vocal Assist (voice)", "name": "Louise Lasser"}], "crew": [{"job": "Director", "name": "Woody Allen"}, {"job": "Director", "name": "Senkichi Taniguchi"}], "title": "What's Up, Tiger Lily?", "genres": ["Action", "Comedy"], "keywords": ["spoof"], "original_language": "English", "rating": "PG", "release_date": "1966-11-02", "revenue": 0.0, "runtime": 80, "summary": "Writer/director Woody Allen explains that when he was asked to supervise the making of the definitive spy thriller, what he decided to do was acquire the rights to a B-grade Japanese spy caper  (1965)) filmed with Japanese actors in Japanese, delete the existing soundtrack, and redub into English and reorder select scenes to create an entirely new movie, a comedy, having nothing to do with the original story-line. The result... International spy Phil Moscowitz, working out of the Asia bureau, is a self-professed lovable rogue with sex always on his mind. He inadvertently gets involved in a mission, the client the Grand Exalted High Majah of Raspur. The success of the mission will determine if Raspur, a non-existent country that nonetheless sounds real, will indeed become real. Moscowitz is to retrieve something stolen from the Majah by criminal Shepherd Wong: the best ever egg salad recipe. Phil is to be assisted by two of the Majah's own agents,...", "tokens": ["writer/director", "woodi", "allen", "explain", "ask", "supervis", "make", "definit", "spy", "thriller", "decid", "acquir", "right", "b", "grade", "japanes", "spy", "caper", "1965", "film", "japanes", "actor", "japanes", "delet", "exist", "soundtrack", "redub", "english", "reorder", "select", "scene", "creat", "entir", "new", "movi", "comedi", "noth", "origin", "stori", "line", "the", "result", "intern", "spy", "phil", "moscowitz", "work", "asia", "bureau", "self", "profess", "lovabl", "rogu", "sex", "alwai", "mind", "he", "inadvert", "get", "involv", "mission", "client", "grand", "exalt", "high", "majah", "raspur", "the", "success", "mission", "determin", "raspur", "non", "exist", "countri", "nonetheless", "sound", "real", "inde", "becom", "real", "moscowitz", "retriev", "someth", "stolen", "majah", "crimin", "shepherd", "wong", "best", "ever", "egg", "salad", "recip", "phil", "assist", "two", "majah", "agent"], "tmdb_score_value": 5.6, "tmdb_score_count": 61, "imdb_score_value": 6.0, "imdb_score_count": 8317, "meta_score_value": 63.0, "meta_score_count": 11}