{"id": "tt0174336", "cast": [{"character": "Mia", "name": "Amanda Peet"}, {"character": "Brad", "name": "Brian Van Holt"}, {"character": "Jonathan", "name": "Jonathan Abrahams"}, {"character": "Zeke", "name": "Zorie Barber"}, {"character": "Eric", "name": "Judah Domke"}, {"character": "Liz", "name": "Callie Thorne"}, {"character": "Marie", "name": "Bridget Moynahan"}, {"character": "Bristol", "name": "Taryn Reif"}, {"character": "'Plan' Girl", "name": "Neriah Davis"}, {"character": "Bar Girl", "name": "Beth Ostrosky Stern"}, {"character": "Bar Girl", "name": "Jamie Donahue"}, {"character": "Bar Girl", "name": "Elaina Erika Davis"}, {"character": "Bar Girl", "name": "Kristin Di Spaltro"}], "crew": [{"job": "Director", "name": "Peter M. Cohen"}, {"job": "Writer", "name": "Peter M. Cohen"}], "title": "Whipped", "genres": ["Comedy", "Romance"], "keywords": ["independent film", "diner", "dating", "masturbation"], "original_language": "English", "rating": "R", "release_date": "2000-09-01", "revenue": 0.0, "runtime": 82, "summary": "Set in New York, 'Whipped' is about a group of three single men, buddies from college, whom meet every Sunday at their local diner hangout to discuss their favorite sport: scoring with women. Their conversations (always revealing, sometimes revolting, and occasionally riotous) revolve around the weekend past and the girls that these three egotistical and narcissistic swingers were able or unable to \"scam.\" However, when all three single guys unknowingly go after the same \"perfect\" woman, Mia (Amanda Peet), they begin to question their skirt-chasing ways. Squabbling breaks out amongst the group as they compete for her attention and suddenly, the fate of their ritual and their friendships, becomes uncertain. Who will win the morning round table bragging rights? You'll be surprised.", "tokens": ["set", "new", "york", "whip", "group", "three", "singl", "men", "buddi", "colleg", "meet", "everi", "sundai", "local", "diner", "hangout", "discuss", "favorit", "sport", "score", "women", "their", "convers", "alwai", "reveal", "sometim", "revolt", "occasion", "riotou", "revolv", "around", "weekend", "past", "girl", "three", "egotist", "narcissist", "swinger", "abl", "unabl", "scam", "howev", "three", "singl", "gui", "unknowingli", "go", "perfect", "woman", "mia", "amanda", "peet", "begin", "question", "skirt", "chase", "wai", "squabbl", "break", "amongst", "group", "compet", "attent", "suddenli", "fate", "ritual", "friendship", "becom", "uncertain", "who", "win", "morn", "round", "tabl", "brag", "right", "you", "surpris"], "tmdb_score_value": 3.4, "tmdb_score_count": 15, "imdb_score_value": 4.4, "imdb_score_count": 3742, "meta_score_value": 10.0, "meta_score_count": 26}