{"id": "tt0173772", "cast": [{"character": "Host", "name": "Martin Scorsese"}], "crew": [{"job": "Director", "name": "Martin Scorsese"}, {"job": "Producer", "name": "Barbara De Fina"}, {"job": "Writer", "name": "Martin Scorsese"}, {"job": "Writer", "name": "Suso Cecchi d'Amico"}, {"job": "Screenplay", "name": "Raffaele Donato"}, {"job": "Screenplay", "name": "Kent Jones"}], "title": "My Voyage to Italy", "genres": ["Documentary"], "keywords": ["italy", "italian", "cinema", "cult director", "sicilian", "neorealism", "movies", "20th century"], "original_language": "Italian", "rating": "PG-13", "release_date": "1999-09-11", "revenue": 0.0, "runtime": 246, "summary": "\"I saw these movies. They had a powerful effect on me. You should see them.\" That's Martin Scorsese's message for this documentary. We meet his family on Elizabeth Street in New York; he's a third generation Italian with Sicilian roots. Starting in 1949, they watched movies on TV as well as in theaters, lots of Italian imports. Scorsese, with his narration giving a personal as well as a public context, shows extended clips of these movies. Films of Rossellini and De Sica fill part one; those of Visconti, Fellini, and Antonioni comprise part two. Scorsese takes time with emotion, style, staging, technique, political context, and cinematic influence. It's his movie family.", "tokens": ["i", "saw", "movi", "thei", "power", "effect", "you", "see", "that", "martin", "scorses", "messag", "documentari", "we", "meet", "famili", "elizabeth", "street", "new", "york", "third", "gener", "italian", "sicilian", "root", "start", "1949", "watch", "movi", "tv", "well", "theater", "lot", "italian", "import", "scorses", "narrat", "give", "person", "well", "public", "context", "show", "extend", "clip", "movi", "film", "rossellini", "de", "sica", "fill", "part", "on", "visconti", "fellini", "antonioni", "compris", "part", "two", "scorses", "take", "time", "emot", "style", "stage", "techniqu", "polit", "context", "cinemat", "influenc", "it", "movi", "famili"], "tmdb_score_value": 7.4, "tmdb_score_count": 19, "imdb_score_value": 8.3, "imdb_score_count": 2600, "meta_score_value": 90.0, "meta_score_count": 8}