{"id": "tt0116745", "cast": [{"character": "Blondie O'Hara", "name": "Jennifer Jason Leigh"}, {"character": "Carolyn Stilton", "name": "Miranda Richardson"}, {"character": "Seldom Seen", "name": "Harry Belafonte"}, {"character": "Henry Stilton", "name": "Michael Murphy"}, {"character": "Johnny O'Hara", "name": "Dermot Mulroney"}, {"character": "Johnny Flynn", "name": "Steve Buscemi"}, {"character": "Babe Flynn", "name": "Brooke Smith"}, {"character": "Nettie Bolt", "name": "Jane Adams"}], "crew": [{"job": "Director", "name": "Robert Altman"}, {"job": "Writer", "name": "Robert Altman"}, {"job": "Writer", "name": "Frank Barhydt"}], "title": "Kansas City", "genres": ["Thriller", "Drama", "Music", "Crime"], "keywords": ["politician", "kansas city", "election", "jazz music"], "original_language": "English", "rating": "R", "release_date": "1996-08-16", "revenue": 0.0, "runtime": 116, "summary": "Robert Altman's jazz-scored film explores themes of love, crime, race, and politics in 1930s Kansas City. When Blondie O'Hara's husband, a petty thief, is captured by Seldom Seen and held at the Hey Hey Club, she launches a desperate plan to release him. She kidnaps the wife of a powerful local politician in an attempt to blackmail him into using his connections to free Johnny. Despite this being election time, he risks exposure by putting the political machine into action to free Johnny and thereby save his wife. Mrs. Stilton, meanwhile, has befriended Blondie and is impressed by her love and devotion to Johnny, especially in contrast to her own loveless marriage.", "tokens": ["robert", "altman", "jazz", "score", "film", "explor", "theme", "love", "crime", "race", "polit", "1930", "kansa", "citi", "when", "blondi", "o", "hara", "husband", "petti", "thief", "captur", "seldom", "seen", "held", "hei", "hei", "club", "launch", "desper", "plan", "releas", "she", "kidnap", "wife", "power", "local", "politician", "attempt", "blackmail", "us", "connect", "free", "johnni", "despit", "elect", "time", "risk", "exposur", "put", "polit", "machin", "action", "free", "johnni", "therebi", "save", "wife", "mr", "stilton", "meanwhil", "befriend", "blondi", "impress", "love", "devot", "johnni", "especi", "contrast", "loveless", "marriag"], "tmdb_score_value": 6.2, "tmdb_score_count": 17, "imdb_score_value": 6.3, "imdb_score_count": 3797, "meta_score_value": 57.0, "meta_score_count": 23}