{"id": "tt0227277", "cast": [{"character": "El Nene", "name": "Leonardo Sbaraglia"}, {"character": "\u00c1ngel", "name": "Eduardo Noriega"}, {"character": "El Cuervo", "name": "Pablo Echarri"}, {"character": "Giselle", "name": "Leticia Br\u00e9dice"}, {"character": "Fontana", "name": "Ricardo Bartis"}, {"character": "Vivi", "name": "Dolores Fonzi"}], "crew": [{"job": "Director", "name": "Marcelo Pi\u00f1eyro"}, {"job": "Writer", "name": "Marcelo Figueras"}, {"job": "Producer", "name": "Diana Frey"}, {"job": "Producer", "name": "\u00d3scar Kramer"}], "title": "Burnt Money", "genres": ["Romance", "Crime"], "keywords": ["jealousy", "psychological stress", "gay relationship", "argentina", "bank robbery", "lgbt", "1960s"], "original_language": "Spanish", "rating": "R", "release_date": "2000-05-11", "revenue": 0.0, "runtime": 125, "summary": "Burnt Money, is set in Argentina in 1965. This true story follows the tumultuous relationship between two men who became lovers and ultimately ruthless bank robbers in a notoriously famous footnote in the annals of Argentinian crime history. Nene, Angel and Cuervo are bank robbers who flee from Argentina across the border to Uruguay after a large-scale hold-up that turns bloody. Angel is hurt and the three must lay low until Angel recovers. Nene and Angel are known to everyone they know as \"the twins\" because of their resemblance, but the two are not brothers at all - they are involved in a steamy homosexual relationship. To get back to Argentina, the group must first wait for Fontana, the brains behind the robbery, to arrange for passports. Anxious from hiding, Cuervo decides to break curfew and go party. After Nene and Angel also decide to take off, Nene meets a prostitute named Giselle and Angel ends up getting in a fight. The group is forced to abandon their refuge and Angel and ...", "tokens": ["burnt", "monei", "set", "argentina", "1965", "thi", "true", "stori", "follow", "tumultu", "relationship", "two", "men", "becam", "lover", "ultim", "ruthless", "bank", "robber", "notori", "famou", "footnot", "annal", "argentinian", "crime", "histori", "nene", "angel", "cuervo", "bank", "robber", "flee", "argentina", "across", "border", "uruguai", "larg", "scale", "hold", "turn", "bloodi", "angel", "hurt", "three", "must", "lai", "low", "angel", "recov", "nene", "angel", "known", "everyon", "know", "twin", "resembl", "two", "brother", "involv", "steami", "homosexu", "relationship", "to", "get", "back", "argentina", "group", "must", "first", "wait", "fontana", "brain", "behind", "robberi", "arrang", "passport", "anxiou", "hide", "cuervo", "decid", "break", "curfew", "go", "parti", "after", "nene", "angel", "also", "decid", "take", "nene", "meet", "prostitut", "name", "gisel", "angel", "end", "get", "fight", "the", "group", "forc", "abandon", "refug", "angel"], "tmdb_score_value": 6.6, "tmdb_score_count": 24, "imdb_score_value": 7.2, "imdb_score_count": 5556, "meta_score_value": 68.0, "meta_score_count": 13}