{"id": "tt0280438", "cast": [{"character": "Francis Sullivan", "name": "Edward Burns"}, {"character": "Cousin Mike Moran", "name": "Brian Burns"}, {"character": "Vinny Boombata", "name": "Vincent Rubino"}, {"character": "J.C.", "name": "Jimmy Cummings"}, {"character": "Sean Sullivan", "name": "Elijah Wood"}, {"character": "Grace Quinonez", "name": "Rosario Dawson"}, {"character": "Moran", "name": "Oliver Platt"}, {"character": "John Coleman", "name": "Dara Coleman"}], "crew": [{"job": "Director", "name": "Edward Burns"}, {"job": "Writer", "name": "Edward Burns"}, {"job": "Producer", "name": "Edward Burns"}, {"job": "Producer", "name": "Margot Bridger"}], "title": "Ash Wednesday", "genres": ["Drama", "Action", "Crime"], "keywords": ["bar", "gun", "hitman", "irish mob", "priest", "tears", "church", "drink", "vendetta", "deli"], "original_language": "English", "rating": "R", "release_date": "2002-10-11", "revenue": 0.0, "runtime": 99, "summary": "Hell's Kitchen on Ash Wednesday, 1983. Rumors are flying that Francis Sullivan's younger brother Sean, dead for three years, has reappeared. If he wasn't killed by rivals, then old scores still need settling, putting Fran and Sean in danger. An upstart is pressuring the local mob boss, who's Fran's protector; Sean's wife, who thinks she's a widow, has gotten on with her life, but Sean has come back for her. The parish priest, part of the initial deception, is frightened. Bad guys with guns are closing in. Can Fran get Sean and his wife out of the city, avoid a war between rival factions, and hold onto new-found morality? Will the cross of ashes on his forehead protect him?", "tokens": ["hell", "kitchen", "ash", "wednesdai", "1983", "rumor", "fly", "franci", "sullivan", "younger", "brother", "sean", "dead", "three", "year", "reappear", "if", "kill", "rival", "old", "score", "still", "need", "settl", "put", "fran", "sean", "danger", "an", "upstart", "pressur", "local", "mob", "boss", "fran", "protector", "sean", "wife", "think", "widow", "gotten", "life", "sean", "come", "back", "the", "parish", "priest", "part", "initi", "decept", "frighten", "bad", "gui", "gun", "close", "can", "fran", "get", "sean", "wife", "citi", "avoid", "war", "rival", "faction", "hold", "onto", "new", "found", "moral", "will", "cross", "ash", "forehead", "protect"], "tmdb_score_value": 5.6, "tmdb_score_count": 17, "imdb_score_value": 5.9, "imdb_score_count": 2775, "meta_score_value": 40.0, "meta_score_count": 7}