{"id": "tt0218581", "cast": [{"character": "Anna Battista", "name": "Asia Argento"}, {"character": "Kirk Vaines", "name": "Jean Shepard"}, {"character": "Aaron Ulrich", "name": "Herbert Fritsch"}, {"character": "Dr. Pascuccia", "name": "Gianluca Arcopinto"}, {"character": "Veronica Lanza", "name": "Vera Gemma"}, {"character": "Anna's Mother", "name": "Daria Nicolodi"}, {"character": "Margherita", "name": "Francesca d'Aloja"}, {"character": "Mr. Paar", "name": "Joe Coleman"}, {"character": "Dr. Vessi", "name": "Leo Gullotta"}, {"character": "Hash-Man", "name": "Schooly-D"}, {"character": "Quelou", "name": "Selen"}], "crew": [{"job": "Director", "name": "Asia Argento"}, {"job": "Writer", "name": "Asia Argento"}, {"job": "Producer", "name": "Claudio Argento"}, {"job": "Producer", "name": "Dario Argento"}, {"job": "Producer", "name": "Stefano Curti"}, {"job": "Original Music Composer", "name": "John Hughes"}], "title": "Scarlet Diva", "genres": ["Drama"], "keywords": ["sex", "nudity", "surrealism", "lesbian", "unsimulated sex", "los angeles", "relationship", "woman director"], "original_language": "Italian", "rating": "R", "release_date": "2000-05-26", "revenue": 0.0, "runtime": 91, "summary": "Anna Battista is a young, popular, 24-year-old Italian-born International film actress who engages herself on a hectic and self-destructive spree which takes her across Europe and to America to shed her \"boy-toy\" image to become an \"artist\" in order to write and direct herself in a semi-biography movie of herself titled \"Scarlet Diva.\" After working in Rome, and winning a presigious film award in Milan, Anna travels to Paris to save her best friend from an abusive relationship, then avoids sleazy film producers in Los Angeles, meets and falls in love with a rock star who abandons her, finds out later that she's pregnant, and begins using drugs to numb her pain at this predictament she's gotten herself into.", "tokens": ["anna", "battista", "young", "popular", "24", "year", "old", "italian", "born", "intern", "film", "actress", "engag", "hectic", "self", "destruct", "spree", "take", "across", "europ", "america", "shed", "boi", "toi", "imag", "becom", "artist", "order", "write", "direct", "semi", "biographi", "movi", "titl", "scarlet", "diva", "after", "work", "rome", "win", "presigi", "film", "award", "milan", "anna", "travel", "pari", "save", "best", "friend", "abus", "relationship", "avoid", "sleazi", "film", "produc", "lo", "angel", "meet", "fall", "love", "rock", "star", "abandon", "find", "later", "pregnant", "begin", "us", "drug", "numb", "pain", "predicta", "gotten"], "tmdb_score_value": 5.1, "tmdb_score_count": 14, "imdb_score_value": 5.2, "imdb_score_count": 1967, "meta_score_value": 48.0, "meta_score_count": 12}