{"id": "tt0244094", "cast": [{"character": "Christopher", "name": "Jeffrey Tambor"}, {"character": "Grace", "name": "Jill Clayburgh"}, {"character": "Elaine", "name": "Caroline Aaron"}, {"character": "Earl", "name": "Bill Duke"}, {"character": "Natasha", "name": "Sandy Duncan"}, {"character": "Alex The Transvestite", "name": "Michael McKean"}, {"character": "Mr. Speedy", "name": "Bill Weeden"}, {"character": "Male College Go-Go Boy", "name": "Eric Axen"}, {"character": "Chad", "name": "David Bailey"}, {"character": "Waiter", "name": "Tom Cappadona"}, {"character": "Tess", "name": "Lily Rabe"}, {"character": "Harry Appleton", "name": "Peter Dinklage"}, {"character": "Nurse", "name": "India Cooper"}], "crew": [{"job": "Director", "name": "Eric Schaeffer"}, {"job": "Writer", "name": "Eric Schaeffer"}, {"job": "Producer", "name": "Robert Kravitz"}, {"job": "Producer", "name": "Terence Michael"}, {"job": "Producer", "name": "Eric Schaeffer"}, {"job": "Producer", "name": "Dawn Wolfrom"}, {"job": "Original Music Composer", "name": "Amanda Kravat"}], "title": "Never Again", "genres": ["Comedy", "Romance"], "keywords": ["romantic comedy"], "original_language": "English", "rating": "R", "release_date": "2002-07-12", "revenue": 0.0, "runtime": 98, "summary": "Never Again is a romantic comedy about falling in love despite your better judgment. An exterminator and jazz pianist in the noble model of Gary Cooper and other '40's screen legends, Christopher is having a sexual identity crisis. He hasn't been able to perform with the young women he's been dating, and is looking for sexual inspiration. Grace, an administrator for Mentors of New York, sends her final child off to college and then realizes that she hasn't tended to her own needs in a very long time. When Christopher meets Grace at a gay bar, her best friends admonish her that it's not a good idea to start a heterosexual relationship with a man you meet in a gay bar. Through human insecurities and foibles, and the refreshing reminder that the Boomer generation is still very much sexually viable, Christopher and Grace defy the odds of it never happening again. In a real, meaningful and adult fashion, they fall in love.", "tokens": ["never", "again", "romant", "comedi", "fall", "love", "despit", "better", "judgment", "an", "extermin", "jazz", "pianist", "nobl", "model", "gari", "cooper", "40", "screen", "legend", "christoph", "sexual", "ident", "crisi", "he", "abl", "perform", "young", "women", "date", "look", "sexual", "inspir", "grace", "administr", "mentor", "new", "york", "send", "final", "child", "colleg", "realiz", "tend", "need", "long", "time", "when", "christoph", "meet", "grace", "gai", "bar", "best", "friend", "admonish", "good", "idea", "start", "heterosexu", "relationship", "man", "meet", "gai", "bar", "through", "human", "insecur", "foibl", "refresh", "remind", "boomer", "gener", "still", "much", "sexual", "viabl", "christoph", "grace", "defi", "odd", "never", "happen", "in", "real", "meaning", "adult", "fashion", "fall", "love"], "tmdb_score_value": 4.0, "tmdb_score_count": 3, "imdb_score_value": 6.1, "imdb_score_count": 738, "meta_score_value": 30.0, "meta_score_count": 22}