{"id": "tt0218043", "cast": [{"character": "Himself", "name": "Mick Foley"}, {"character": "Himself", "name": "Terry Funk"}, {"character": "Himself", "name": "Vince McMahon"}, {"character": "Himself", "name": "Jake Roberts"}, {"character": "Himself", "name": "Jesse Ventura"}, {"character": "Herself (uncredited)", "name": "Noelle Foley"}, {"character": "Narrator", "name": "Barry W. Blaustein"}, {"character": "Stevie Richards", "name": "Michael Manna"}, {"character": "Raven", "name": "Scott Anthony Levy"}, {"character": "The Undertaker", "name": "Mark Calaway"}, {"character": "Himself", "name": "Tony Jones"}, {"character": "Himself", "name": "Michael Modest"}, {"character": "Droz", "name": "Darren Drozdov"}, {"character": "D'Lo Brown", "name": "Accie Julius Connor"}, {"character": "The Rock", "name": "Dwayne Johnson"}, {"character": "Himself", "name": "Paul Heyman"}, {"character": "Himself", "name": "Dennis Stamp"}], "crew": [{"job": "Director", "name": "Barry W. Blaustein"}, {"job": "Producer", "name": "Barry W. Blaustein"}, {"job": "Writer", "name": "Barry W. Blaustein"}, {"job": "Producer", "name": "Ron Howard"}, {"job": "Producer", "name": "Brian Grazer"}], "title": "Beyond the Mat", "genres": ["Documentary"], "keywords": ["wrestling", "sport", "controversial", "ecw", "wwe"], "original_language": "English", "rating": "R", "release_date": "1999-10-22", "revenue": 500000.0, "runtime": 102, "summary": "This documentary focuses on the lives of professional wrestlers Terry Funk, Mick Foley (Mankind), Jake Roberts (Jake the Snake) and Darren Drozdov (Droz). As the film progresses, the story of their lives unfolds, as we also learn how the wrestling industry is not the plastic-weapons fake-slap sideshow that many have perceived it as. We are shown how moves, although not actually injuring anyone, are not fake, and extreme training is required to be able to perform the stunts without being harmed. We are also treated to interviews with the family of Mick Foley and what it is like for them to know their father literally puts his life on the line every week and how it feels to have other children call their father a \"fake\". Vince McMahon, owner of World Wrestling Entertainment, also makes a few appearances, responding to criticism on various wrestling situations, including, once again, his real athletes, very real organization being called fake by sources such as USA Today and various news...", "tokens": ["thi", "documentari", "focus", "live", "profession", "wrestler", "terri", "funk", "mick", "folei", "mankind", "jake", "robert", "jake", "snake", "darren", "drozdov", "droz", "as", "film", "progress", "stori", "live", "unfold", "also", "learn", "wrestl", "industri", "plastic", "weapon", "fake", "slap", "sideshow", "mani", "perceiv", "we", "shown", "move", "although", "actual", "injur", "anyon", "fake", "extrem", "train", "requir", "abl", "perform", "stunt", "without", "harm", "we", "also", "treat", "interview", "famili", "mick", "folei", "like", "know", "father", "liter", "put", "life", "line", "everi", "week", "feel", "children", "call", "father", "fake", "vinc", "mcmahon", "owner", "world", "wrestl", "entertain", "also", "make", "appear", "respond", "critic", "variou", "wrestl", "situat", "includ", "real", "athlet", "real", "organ", "call", "fake", "sourc", "usa", "todai", "variou", "new"], "tmdb_score_value": 7.8, "tmdb_score_count": 22, "imdb_score_value": 7.6, "imdb_score_count": 7281, "meta_score_value": 73.0, "meta_score_count": 23}