{"id": "tt0290498", "cast": [{"character": "Shy", "name": "Silas Howard"}, {"character": "Valentine", "name": "Harry Dodge"}, {"character": "Billie", "name": "Stanya Kahn"}, {"character": "Isabelle", "name": "Carina Gia"}, {"character": "News Interviewee", "name": "Joan Jett"}], "crew": [{"job": "Director", "name": "Harry Dodge"}, {"job": "Director", "name": "Silas Howard"}, {"job": "Writer", "name": "Harry Dodge"}, {"job": "Writer", "name": "Silas Howard"}, {"job": "Original Music Composer", "name": "Carla Bozulich"}], "title": "By Hook or by Crook", "genres": ["Crime", "Drama", "Romance"], "keywords": ["lgbt", "trans director"], "original_language": "English", "rating": "NOT RATED", "release_date": "2001-06-17", "revenue": 0.0, "runtime": 98, "summary": "By Hook or by Crook chronicles the tale of two unlikely friends who commit petty crimes as they search for a path to understanding themselves and the outside world. Silas Howard plays Shy (a transgender man), who leaves his small town after the death of his father, and heads to the big city to live a life of crime. Along the way, he encounters Valentine, a quirky adoptee, in search of his birth mother. An immediate kinship is sparked between these men and they become partners in crime. Suffering money troubles, emotional problems, and physical confrontations, the duo face their issues head on and learn to trust each other and support each other in pursuit of their goals.", "tokens": ["by", "hook", "crook", "chronicl", "tale", "two", "unlik", "friend", "commit", "petti", "crime", "search", "path", "understand", "outsid", "world", "sila", "howard", "plai", "shy", "transgend", "man", "leav", "small", "town", "death", "father", "head", "big", "citi", "live", "life", "crime", "along", "wai", "encount", "valentin", "quirki", "adopte", "search", "birth", "mother", "an", "immedi", "kinship", "spark", "men", "becom", "partner", "crime", "suffer", "monei", "troubl", "emot", "problem", "physic", "confront", "duo", "face", "issu", "head", "learn", "trust", "support", "pursuit", "goal"], "tmdb_score_value": 6.5, "tmdb_score_count": 2, "imdb_score_value": 5.8, "imdb_score_count": 241, "meta_score_value": 47.0, "meta_score_count": 8}