{"id": "tt0397620", "cast": [{"character": "Himself", "name": "Luis Vargas"}], "crew": [{"job": "Director", "name": "Alex Wolfe"}, {"job": "Producer", "name": "Alex Wolfe"}], "title": "Santo Domingo Blues", "genres": ["Music", "Documentary"], "keywords": [], "original_language": "Spanish", "rating": "NOT RATED", "release_date": "2004-06-01", "revenue": 0.0, "runtime": 75, "summary": "Santo Domingo Blues is the fascinating tale of how Bachata, a music genre once vilified by the Latin upper class as the bawdy ghetto soundtrack of brothels and vulgar cabarets, came to rival meringue and salsa as the preferred music of the Latin world. Through performances, first-person interviews and telling verite scenes with guitarist and guitarist and singer/songwriter Luis Vargas - and his fellow bachateros, viewers are treated to not only a bittersweet success story on one immigrant artist, but an understanding of this once-maligned music style. Following Vargas' poignant journey from New York City back to his hometown of Santa Maria in the Dominican Republic, award-winning director and producer Alex Wolfe tells the story of Bachata's transformation from a \"song of bitterness\" to an emblem of Dominican national pride.", "tokens": ["santo", "domingo", "blue", "fascin", "tale", "bachata", "music", "genr", "vilifi", "latin", "upper", "class", "bawdi", "ghetto", "soundtrack", "brothel", "vulgar", "cabaret", "came", "rival", "meringu", "salsa", "prefer", "music", "latin", "world", "through", "perform", "first", "person", "interview", "tell", "verit", "scene", "guitarist", "guitarist", "singer/songwrit", "lui", "varga", "fellow", "bachatero", "viewer", "treat", "bittersweet", "success", "stori", "on", "immigr", "artist", "understand", "malign", "music", "style", "follow", "varga", "poignant", "journei", "new", "york", "citi", "back", "hometown", "santa", "maria", "dominican", "republ", "award", "win", "director", "produc", "alex", "wolf", "tell", "stori", "bachata", "transform", "song", "bitter", "emblem", "dominican", "nation", "pride"], "tmdb_score_value": 0.0, "tmdb_score_count": 0, "imdb_score_value": 6.6, "imdb_score_count": 16, "meta_score_value": 71.0, "meta_score_count": 4}