{"id": "tt0325761", "cast": [{"character": "Jackson", "name": "Justin Herwick"}, {"character": "Sam", "name": "Shane Powers"}, {"character": "Jed", "name": "B. Wyatt"}, {"character": "Sandra", "name": "Susannah Melvoin"}, {"character": "Billy", "name": "Susannah Melvoin"}, {"character": "Derek", "name": "Sean Thibodeau"}, {"character": "Sonny Spike", "name": "Willie Garson"}, {"character": "Alyssa", "name": "Pamela Gidley"}], "crew": [{"job": "Director", "name": "Everett Lewis"}], "title": "Luster", "genres": ["Drama", "Comedy"], "keywords": [], "original_language": "English", "rating": "UNRATED", "release_date": "2002-03-17", "revenue": 0.0, "runtime": 90, "summary": "Luster is a refreshingly funny and sexy look at unrequited love. Jackson, a cute, lanky, blue-haired poet who works in a record store, is at the center of Everett Lewis' twisted black LA comedy. He's got a crush on the sexy young blonde, Billy, who he met at an orgy the other night. But Billy's not into him, he's in love with Sonny, a musician into S&amp;M. Even though Billy doesn't want Jackson, two other guys do: Derek, a clean-cut record store customer, and Sam, the supposedly straight record store owner. Into this mix is thrown Jed, Jackson's hunky cousin, which leads Jackson to seriously contemplate the technicalities of incest. Before he can do anything about it, though, Jed is seduced by Jackson's lesbian artist friend. What's a boy to do?", "tokens": ["luster", "refreshingli", "funni", "sexi", "look", "unrequit", "love", "jackson", "cute", "lanki", "blue", "hair", "poet", "work", "record", "store", "center", "everett", "lewi", "twist", "black", "la", "comedi", "he", "got", "crush", "sexi", "young", "blond", "billi", "met", "orgi", "night", "but", "billi", "love", "sonni", "musician", "s&amp", "m", "even", "though", "billi", "want", "jackson", "two", "gui", "derek", "clean", "cut", "record", "store", "custom", "sam", "supposedli", "straight", "record", "store", "owner", "into", "mix", "thrown", "jed", "jackson", "hunki", "cousin", "lead", "jackson", "serious", "contempl", "technic", "incest", "befor", "anyth", "though", "jed", "seduc", "jackson", "lesbian", "artist", "friend", "what", "boi"], "tmdb_score_value": 4.7, "tmdb_score_count": 6, "imdb_score_value": 5.4, "imdb_score_count": 1055, "meta_score_value": 40.0, "meta_score_count": 6}