{"id": "tt0337930", "cast": [{"character": "Lolo", "name": "Diego Luna"}, {"character": "Nene", "name": "Lucas Crespi"}, {"character": "Sv\u00f3boda", "name": "Norman Sotolongo"}, {"character": "Tomson", "name": "Jes\u00fas Ochoa"}, {"character": "Eulogia", "name": "Martha Tenorio"}], "crew": [{"job": "Director", "name": "Hugo Rodr\u00edguez"}, {"job": "Screenplay", "name": "Mart\u00edn Salinas"}, {"job": "Producer", "name": "Laura Imperiale"}, {"job": "Producer", "name": "Martha Sosa Elizondo"}, {"job": "Original Music Composer", "name": "Fernando Corona"}], "title": "Nicotina", "genres": ["Drama", "Action", "Comedy", "Thriller"], "keywords": ["mexico", "hacker", "russian mafia", "hoodlum", "voyeurism"], "original_language": "Spanish", "rating": "R", "release_date": "2003-09-08", "revenue": 0.0, "runtime": 93, "summary": "\"Nicotina,\" is a crime caper set in Mexico City about a simple exchange that goes awry, causing the lives of nine unsuspecting characters to explode in one tumultuous night over a fortune in diamonds. Diego Luna stars as computer hacker Lolo, who is infatuated with his neighbor Andrea and catalogs her every move via high-tech peeping devices. Lolo teams with amateur criminals Tomson and his younger counterpart Nene in a deal with a Russian mobster that involves the exchange of diamonds for computer access to Swiss bank accounts. But the deal goes terribly wrong after Lolo's attempts to spoil Andrea's romantic trysts spiral out of control. Down the street, the irritable pharmacist Beto and his fed-up wife Clara get inadvertently entangled in the exchange, along with the humble barber Goyo and his domineering other half Carmen. Infected with diamond lust, these characters become obsessed with the intoxicating possibility of an easy life and their greed quickly transforms into fiery ...", "tokens": ["nicotina", "crime", "caper", "set", "mexico", "citi", "simpl", "exchang", "goe", "awri", "caus", "live", "nine", "unsuspect", "charact", "explod", "on", "tumultu", "night", "fortun", "diamond", "diego", "luna", "star", "comput", "hacker", "lolo", "infatu", "neighbor", "andrea", "catalog", "everi", "move", "via", "high", "tech", "peep", "devic", "lolo", "team", "amateur", "crimin", "tomson", "younger", "counterpart", "nene", "deal", "russian", "mobster", "involv", "exchang", "diamond", "comput", "access", "swiss", "bank", "account", "but", "deal", "goe", "terribl", "wrong", "lolo", "attempt", "spoil", "andrea", "romant", "tryst", "spiral", "control", "down", "street", "irrit", "pharmacist", "beto", "fed", "wife", "clara", "get", "inadvert", "entangl", "exchang", "along", "humbl", "barber", "goyo", "domin", "half", "carmen", "infect", "diamond", "lust", "charact", "becom", "obsess", "intox", "possibl", "easi", "life", "greed", "quickli", "transform", "fieri"], "tmdb_score_value": 6.4, "tmdb_score_count": 22, "imdb_score_value": 6.7, "imdb_score_count": 3204, "meta_score_value": 49.0, "meta_score_count": 17}