{"id": "tt0366522", "cast": [{"character": "Himself", "name": "Woody Harrelson"}, {"character": "Himself", "name": "Ken Kesey"}, {"character": "Himself", "name": "Tom Ballanco"}, {"character": "Herself", "name": "Jessica Chung"}, {"character": "Herself", "name": "Sonia Farrell"}, {"character": "Himself", "name": "Michael Franti"}, {"character": "Himself", "name": "Rob Heydon"}, {"character": "Himself", "name": "Joe Hickey"}, {"character": "Himself", "name": "Anthony Kiedis"}, {"character": "Herself", "name": "Renee Loux Underkoffler"}, {"character": "Himself", "name": "Billy Martin"}, {"character": "Himself", "name": "Dave Matthews"}, {"character": "Himself", "name": "John Medeski"}, {"character": "Herself", "name": "Natalie Merchant"}, {"character": "Himself", "name": "Bob Weir"}, {"character": "Himself", "name": "Chris Wood"}], "crew": [{"job": "Director", "name": "Ron Mann"}], "title": "Go Further", "genres": ["Documentary"], "keywords": ["bus ride", "environmental", "environmentalist", "environmentalism", "cycling"], "original_language": "English", "rating": "UNRATED", "release_date": "2003-03-07", "revenue": 0.0, "runtime": 80, "summary": "\"Go Further\", the new film by award-winning documentary filmmaker Ron Mann, explores the idea that the single individual is the key to large-scale transformational change. The film follows actor Woody Harrelson as he takes a small group of friends on a bio-fuelled bus-ride down the Pacific Coast Highway. Their goal? To show the people they encounter that there are viable alternatives to our habitual, environmentally-destructive behaviors. The travellers include a yoga-teacher, a raw food chef, a hemp-activist, a junk-food addict, and a college student who suspends her life to impulsively hop aboard. We see the hostility these pilgrims encounter, and watch as their ideas are challenged from within and without. We meet an entrepreneur who runs a paper company that does not harm trees; an organic farmer who believes Nature is his partner; a man who teaches environmental activists to use humor as a strategic weapon. And throughout, we see Harrelson test his belief that the transformation ...", "tokens": ["go", "further", "new", "film", "award", "win", "documentari", "filmmak", "ron", "mann", "explor", "idea", "singl", "individu", "kei", "larg", "scale", "transform", "chang", "the", "film", "follow", "actor", "woodi", "harrelson", "take", "small", "group", "friend", "bio", "fuell", "bu", "ride", "pacif", "coast", "highwai", "their", "goal", "to", "show", "peopl", "encount", "viabl", "altern", "habitu", "environment", "destruct", "behavior", "the", "travel", "includ", "yoga", "teacher", "raw", "food", "chef", "hemp", "activist", "junk", "food", "addict", "colleg", "student", "suspend", "life", "impuls", "hop", "aboard", "we", "see", "hostil", "pilgrim", "encount", "watch", "idea", "challeng", "within", "without", "we", "meet", "entrepreneur", "run", "paper", "compani", "harm", "tree", "organ", "farmer", "believ", "natur", "partner", "man", "teach", "environment", "activist", "us", "humor", "strateg", "weapon", "and", "throughout", "see", "harrelson", "test", "belief", "transform"], "tmdb_score_value": 6.4, "tmdb_score_count": 5, "imdb_score_value": 6.6, "imdb_score_count": 325, "meta_score_value": 58.0, "meta_score_count": 16}