{"id": "tt0407236", "cast": [{"character": "Marquis", "name": "Jan T\u0159\u00edska"}], "crew": [{"job": "Director", "name": "Jan \u0160vankmajer"}, {"job": "Screenplay", "name": "Jan \u0160vankmajer"}], "title": "Lunacy", "genres": ["Comedy", "Horror"], "keywords": ["asylum", "insane asylum", "edgar allan poe", "black mass", "marquis de sade", "blasphemy"], "original_language": "Czech", "rating": "NOT RATED", "release_date": "2005-11-17", "revenue": 0.0, "runtime": 118, "summary": "A horror movie testing two approaches to running an insane asylum - absolute freedom versus control and punishment - within the context of a world that combines the worst of both. Jean Berlot, a young man subject to a nightmare of being forced into a straitjacket by two orderlies, is befriended by a marquis. At the marquis's estate, Jean witnesses a black Mass, buries someone alive, and is invited to try preventive therapy. He's willing to enter a sanatorium because he believes he can rescue a young woman from there who has told him that the real director and staff of the clinic are locked in the basement. Jean conspires with her to set them free: the horrors have only begun.", "tokens": ["a", "horror", "movi", "test", "two", "approach", "run", "insan", "asylum", "absolut", "freedom", "versu", "control", "punish", "within", "context", "world", "combin", "worst", "jean", "berlot", "young", "man", "subject", "nightmar", "forc", "straitjacket", "two", "orderli", "befriend", "marqui", "at", "marqui", "estat", "jean", "wit", "black", "mass", "buri", "someon", "aliv", "invit", "try", "prevent", "therapi", "he", "will", "enter", "sanatorium", "believ", "rescu", "young", "woman", "told", "real", "director", "staff", "clinic", "lock", "basement", "jean", "conspir", "set", "free", "horror", "begun"], "tmdb_score_value": 6.9, "tmdb_score_count": 21, "imdb_score_value": 7.3, "imdb_score_count": 3049, "meta_score_value": 63.0, "meta_score_count": 16}