{"id": "tt0425598", "cast": [{"character": "Himself", "name": "Dave Chappelle"}, {"character": "Herself", "name": "Erykah Badu"}, {"character": "Common", "name": "Common"}, {"character": "Mos Def", "name": "Yasiin Bey"}, {"character": "Bilal", "name": "Bilal"}, {"character": "Lil' Cease", "name": "Lil' Cease"}, {"character": "Cody Chestnutt", "name": "Cody ChestnuTT"}, {"character": "James 'Kamal' Gray", "name": "James 'Kamal' Gray"}, {"character": "Lauryn Hill", "name": "Lauryn Hill"}, {"character": "Leonard 'Hub' Hubbard", "name": "Leonard 'Hub' Hubbard"}, {"character": "Wyclef Jean", "name": "Wyclef Jean"}, {"character": "Tiffany Limos", "name": "Tiffany Limos"}, {"character": "Ahmir '?uestlove' Thompson", "name": "Ahmir-Khalib Thompson"}, {"character": "Kanye West", "name": "Kanye West"}, {"character": "Jill Scott", "name": "Jill Scott"}], "crew": [{"job": "Producer", "name": "Dave Chappelle"}, {"job": "Producer", "name": "Mustafa Abuelhija"}, {"job": "Director", "name": "Michel Gondry"}, {"job": "Producer", "name": "Julie Fong"}, {"job": "Producer", "name": "Michel Gondry"}, {"job": "Producer", "name": "Bob Yari"}, {"job": "Original Music Composer", "name": "Cory Smith"}], "title": "Dave Chappelle's Block Party", "genres": ["Comedy", "Documentary", "Music"], "keywords": ["black people", "hip-hop", "block party", "megaphone", "classroom", "brass band", "stage"], "original_language": "English", "rating": "R", "release_date": "2005-09-12", "revenue": 11718595.0, "runtime": 100, "summary": "Dave Chappelle presents a Brooklyn neighborhood with its very own once-in-a-lifetime free block party. In addition to Chappelle, the roster of artists includes Kanye West, Mos Def, Talib Kweli, Common, Dead Prez, Erykah Badu, Jill Scott, the Roots, Cody ChesnuTT, Big Daddy Kane, and - reunited for their first performance in over seven years - the Fugees. Includes private rehearsals footage and Chappelle in the small Ohio town he calls home, where he wanders through town handing out golden tickets to invite several dozen citizens to join the party, providing transportation and lodging for their visit to Brooklyn. Ohio's Central State University marching band makes the trip and kicks off the festivities at the intersection of Quincy and Downing Streets. A diverse crowd and Chappelle's freestyle wit guides them (and us) through a celebration of music and comedy, history and community.", "tokens": ["dave", "chappel", "present", "brooklyn", "neighborhood", "lifetim", "free", "block", "parti", "in", "addit", "chappel", "roster", "artist", "includ", "kany", "west", "mo", "def", "talib", "kweli", "common", "dead", "prez", "erykah", "badu", "jill", "scott", "root", "codi", "chesnutt", "big", "daddi", "kane", "reunit", "first", "perform", "seven", "year", "fuge", "includ", "privat", "rehears", "footag", "chappel", "small", "ohio", "town", "call", "home", "wander", "town", "hand", "golden", "ticket", "invit", "sever", "dozen", "citizen", "join", "parti", "provid", "transport", "lodg", "visit", "brooklyn", "ohio", "central", "state", "univers", "march", "band", "make", "trip", "kick", "festiv", "intersect", "quinci", "down", "street", "a", "divers", "crowd", "chappel", "freestyl", "wit", "guid", "us", "celebr", "music", "comedi", "histori", "commun"], "tmdb_score_value": 6.6, "tmdb_score_count": 38, "imdb_score_value": 7.2, "imdb_score_count": 8231, "meta_score_value": 84.0, "meta_score_count": 30}