{"id": "tt0426596", "cast": [{"character": "Herself - Worker", "name": "Matilde Adorno"}], "crew": [{"job": "Director", "name": "Avi Lewis"}, {"job": "Writer", "name": "Naomi Klein"}], "title": "The Take", "genres": ["Documentary"], "keywords": ["globalization", "worker", "politics", "president", "economics", "take", "democracy", "system", "manifesto", "radical", "opposition"], "original_language": "English", "rating": "UNRATED", "release_date": "2004-09-03", "revenue": 0.0, "runtime": 87, "summary": "In suburban Buenos Aires, thirty unemployed auto-parts workers walk into their idle factory, roll out sleeping mats and refuse to leave. All they want is to re-start the silent machines. But this simple act - the take - has the power to turn the globalization debate on its head. Armed only with slingshots and an abiding faith in shop-floor democracy, the workers face off against the bosses, bankers and a whole system that sees their beloved factories as nothing more than scrap metal for sale. With The Take, director Avi Lewis, one of Canada's most outspoken journalists, and writer Naomi Klein, author of the international bestseller No Logo, champion a radical economic manifesto for the 21st century", "tokens": ["in", "suburban", "bueno", "air", "thirti", "unemploi", "auto", "part", "worker", "walk", "idl", "factori", "roll", "sleep", "mat", "refus", "leav", "all", "want", "start", "silent", "machin", "but", "simpl", "act", "take", "power", "turn", "global", "debat", "head", "arm", "slingshot", "abid", "faith", "shop", "floor", "democraci", "worker", "face", "boss", "banker", "whole", "system", "see", "belov", "factori", "noth", "scrap", "metal", "sale", "with", "the", "take", "director", "avi", "lewi", "on", "canada", "outspoken", "journalist", "writer", "naomi", "klein", "author", "intern", "bestsel", "no", "logo", "champion", "radic", "econom", "manifesto", "21st", "centuri"], "tmdb_score_value": 7.2, "tmdb_score_count": 8, "imdb_score_value": 7.8, "imdb_score_count": 1108, "meta_score_value": 66.0, "meta_score_count": 18}