{"id": "tt0847050", "cast": [{"character": "Niwemang", "name": "Golshifteh Farahani"}, {"character": "Mamo", "name": "Ismail Ghaffari"}, {"character": "Hesho (as Hedieh Tehrani)", "name": "Hediyeh Tehrani"}], "crew": [{"job": "Director", "name": "Bahman Ghobadi"}, {"job": "Writer", "name": "Bahman Ghobadi"}, {"job": "Original Music Composer", "name": "Hossein Alizadeh"}, {"job": "Producer", "name": "Bahman Ghobadi"}], "title": "Half Moon", "genres": ["Music", "Drama", "Comedy"], "keywords": [], "original_language": "Kurdish", "rating": "NOT RATED", "release_date": "2006-09-01", "revenue": 0.0, "runtime": 107, "summary": "Mamo, an old and legendary Kurdish musician living in Iran, plans to give one final concert in Iraqi Kurdistan. After seven months of trying to get a permit and rounding up his ten sons, he sets out for the long and troublesome journey in a derelict bus, denying a recurring vision of his own death at half moon. Halfway the party halts at a small village to pick up female singer Hesho, which will only add to the difficulty of the undertaking, as it is forbidden for Iranian women to sing in public, let alone in the company of men. But Mamo is determined to carry through, if not for the gullible antics of the bus driver.", "tokens": ["mamo", "old", "legendari", "kurdish", "musician", "live", "iran", "plan", "give", "on", "final", "concert", "iraqi", "kurdistan", "after", "seven", "month", "try", "get", "permit", "round", "ten", "son", "set", "long", "troublesom", "journei", "derelict", "bu", "deni", "recur", "vision", "death", "half", "moon", "halfwai", "parti", "halt", "small", "villag", "pick", "femal", "singer", "hesho", "add", "difficulti", "undertak", "forbidden", "iranian", "women", "sing", "public", "let", "alon", "compani", "men", "but", "mamo", "determin", "carri", "gullibl", "antic", "bu", "driver"], "tmdb_score_value": 6.8, "tmdb_score_count": 6, "imdb_score_value": 7.3, "imdb_score_count": 2164, "meta_score_value": 72.0, "meta_score_count": 9}