{"id": "tt0845046", "cast": [{"character": "Joshua", "name": "Neil Dudgeon"}, {"character": "Brethren Boy", "name": "Asa Butterfield"}, {"character": "Will Proudfoot", "name": "Bill Milner"}, {"character": "Mary Proudfoot", "name": "Jessica Hynes"}, {"character": "Grandma", "name": "Anna Wing"}, {"character": "Lee Carter", "name": "Will Poulter"}, {"character": "Jess Proudfoot", "name": "Tallulah Evans"}, {"character": "French Teacher", "name": "Emilie Chesnais"}, {"character": "Geography Teacher", "name": "Paul Ritter"}, {"character": "Didier Revol", "name": "Jules Sitruk"}, {"character": "Science Teacher", "name": "Adam Buxton"}, {"character": "Lawrence Carter", "name": "Ed Westwick"}, {"character": "Lawrence's Henchman", "name": "Adam Paul Harvey"}], "crew": [{"job": "Director", "name": "Garth Jennings"}, {"job": "Screenplay", "name": "Garth Jennings"}], "title": "Son of Rambow", "genres": ["Comedy"], "keywords": ["film in film", "independent film", "single mother", "exchange student"], "original_language": "English", "rating": "PG-13", "release_date": "2007-01-22", "revenue": 6870249.0, "runtime": 96, "summary": "SON OF RAMBOW is the name of the home movie made by two little boys with a big video camera and even bigger ambitions. Set on a long English summer in the early '80s, SON OF RAMBOW is a comedy about friendship, faith and the tough business of growing up. We see the story through the eyes of Will, the eldest son of a fatherless Plymouth Brethren family. The Brethren regard themselves as God's 'chosen ones' and their strict moral code means that Will has never been allowed to mix with the other 'worldlies,' listen to music or watch TV, until he finds himself caught up in the extraordinary world of Lee Carter, the school terror and maker of bizarre home movies. Carter exposes Will to a pirate copy of Rambo: First Blood and from that moment Will's mind is blown wide open and he's easily convinced to be the stuntman in Lee Carters' diabolical home movie. Will's imaginative little brain is not only given chance to flourish in the world of film making, but is also very handy when it comes to...", "tokens": ["son", "of", "rambow", "name", "home", "movi", "made", "two", "littl", "boi", "big", "video", "camera", "even", "bigger", "ambit", "set", "long", "english", "summer", "earli", "80", "son", "of", "rambow", "comedi", "friendship", "faith", "tough", "busi", "grow", "we", "see", "stori", "ey", "will", "eldest", "son", "fatherless", "plymouth", "brethren", "famili", "the", "brethren", "regard", "god", "chosen", "on", "strict", "moral", "code", "mean", "will", "never", "allow", "mix", "worldli", "listen", "music", "watch", "tv", "find", "caught", "extraordinari", "world", "lee", "carter", "school", "terror", "maker", "bizarr", "home", "movi", "carter", "expos", "will", "pirat", "copi", "rambo", "first", "blood", "moment", "will", "mind", "blown", "wide", "open", "easili", "convinc", "stuntman", "lee", "carter", "diabol", "home", "movi", "will", "imagin", "littl", "brain", "given", "chanc", "flourish", "world", "film", "make", "also", "handi", "come"], "tmdb_score_value": 6.7, "tmdb_score_count": 178, "imdb_score_value": 7.0, "imdb_score_count": 28728, "meta_score_value": 66.0, "meta_score_count": 29}