{"id": "tt0965375", "cast": [{"character": "Steven Luisi", "name": "Tom Berenger"}, {"character": "Al Bowen", "name": "Busta Rhymes"}, {"character": "Marty Berlin", "name": "Armand Assante"}, {"character": "Richard Allen", "name": "Kirk Jones"}, {"character": "Celia Hernandez", "name": "Musetta Vander"}, {"character": "Richter Green", "name": "Frankie Faison"}, {"character": "Byron Young", "name": "Curtiss Cook"}, {"character": "Kevin", "name": "Devin Ratray"}, {"character": "Tanya", "name": "Quisha Saunders"}, {"character": "Frank Donelly", "name": "Robert LuPone"}, {"character": "Gregory Fixx", "name": "Dyron Holmes"}, {"character": "Det. Howard", "name": "Robert Capelli Jr."}, {"character": "Buster Biggs (als muMs da Schemer)", "name": "Craig muMs Grant"}, {"character": "Detective Flynn (als Jim 'Whisper' Staszkiel)", "name": "James Staszkiel"}, {"character": "Vater", "name": "David Martyn Conley"}, {"character": "Young Steven", "name": "Miles Kath"}], "crew": [{"job": "Director", "name": "Jeff Celentano"}, {"job": "Writer", "name": "Vincent Campanella"}], "title": "Breaking Point", "genres": ["Action", "Adventure", "Drama", "Thriller"], "keywords": [], "original_language": "English", "rating": "R", "release_date": "2009-12-04", "revenue": 0.0, "runtime": 93, "summary": "\"Breaking Point\" is a dramatic tale of corruption and self-realization, in which one man has to overcome a deep seeded conspiracy and his own lingering past in order to gain the redemption he desires. Steven Luisi (Tom Berenger), a once prominent criminal defense attorney is attempting to come back to the profession after a struggle with drug addiction and a family tragedy. Steven stumbles into a complex, high profile murder case. Against his better judgment, he takes on the case that will eventually lead him down a path that brings him face to face with his own demons. While trying to solve the case Steven teams up with an ex-athlete turned gang member, Richard \"Beanz\" Allen. The two develop a fast friendship. Together they seek to reveal the truth and bring about justice in the court and on the street. Steven and Allen go head to head with the murderous Bowen (Busta Rhymes), a vicious Gang leader and Steven's old drug dealer. With Allen's help, Steven discovers that there are deep ...", "tokens": ["break", "point", "dramat", "tale", "corrupt", "self", "realiz", "on", "man", "overcom", "deep", "seed", "conspiraci", "linger", "past", "order", "gain", "redempt", "desir", "steven", "luisi", "tom", "bereng", "promin", "crimin", "defens", "attornei", "attempt", "come", "back", "profess", "struggl", "drug", "addict", "famili", "tragedi", "steven", "stumbl", "complex", "high", "profil", "murder", "case", "against", "better", "judgment", "take", "case", "eventu", "lead", "path", "bring", "face", "face", "demon", "while", "try", "solv", "case", "steven", "team", "ex", "athlet", "turn", "gang", "member", "richard", "beanz", "allen", "the", "two", "develop", "fast", "friendship", "togeth", "seek", "reveal", "truth", "bring", "justic", "court", "street", "steven", "allen", "go", "head", "head", "murder", "bowen", "busta", "rhyme", "viciou", "gang", "leader", "steven", "old", "drug", "dealer", "with", "allen", "help", "steven", "discov", "deep"], "tmdb_score_value": 4.9, "tmdb_score_count": 7, "imdb_score_value": 5.0, "imdb_score_count": 601, "meta_score_value": 24.0, "meta_score_count": 9}