{"id": "tt1042424", "cast": [{"character": "Johnny Mad Dog", "name": "Christopher Minie"}, {"character": "Laokole", "name": "Daisy Victoria Vandy"}, {"character": "No Good Advice", "name": "Dagbeh Tweh"}, {"character": "Small Devil", "name": "Barry Chernoh"}], "crew": [{"job": "Director", "name": "Jean-St\u00e9phane Sauvaire"}, {"job": "Producer", "name": "Mathieu Kassovitz"}, {"job": "Producer", "name": "Beno\u00eet Jaubert"}], "title": "Johnny Mad Dog", "genres": ["Drama", "History", "War"], "keywords": ["civil war", "africa", "underage soldier", "independent film", "child soldier", "child", "children in wartime"], "original_language": "English", "rating": "NOT RATED", "release_date": "2008-05-20", "revenue": 0.0, "runtime": 97, "summary": "Johnny Mad Dog, maybe 15, leads a band of boy soldiers in a civil war in an unnamed African country. \"Don't want to die? Don't be born\" is one of their shouted mottoes. We follow Mad Dog and his crew - No Good Advice, Butterfly, Chicken Hair, and others - as they kill, pillage rape, interrogate, and terrorize on their march to the capital. They take a TV station and lead an assault on the President's residence. We also follow Laokole, about Johnny age, as she tries to hold together her family of brother and disabled father. Is there more than chaos and inhumanity here? At war since age 10, has Johnny anything inside?", "tokens": ["johnni", "mad", "dog", "mayb", "15", "lead", "band", "boi", "soldier", "civil", "war", "unnam", "african", "countri", "don", "want", "die", "don", "born", "on", "shout", "motto", "we", "follow", "mad", "dog", "crew", "no", "good", "advic", "butterfli", "chicken", "hair", "other", "kill", "pillag", "rape", "interrog", "terror", "march", "capit", "thei", "take", "tv", "station", "lead", "assault", "presid", "resid", "we", "also", "follow", "laokol", "johnni", "ag", "tri", "hold", "togeth", "famili", "brother", "disabl", "father", "is", "chao", "inhuman", "at", "war", "sinc", "ag", "10", "johnni", "anyth", "insid"], "tmdb_score_value": 6.7, "tmdb_score_count": 26, "imdb_score_value": 6.8, "imdb_score_count": 2961, "meta_score_value": 45.0, "meta_score_count": 6}