{"id": "tt1112115", "cast": [{"character": "Himself", "name": "Ian Cheney"}, {"character": "Himself", "name": "Curtis Ellis"}, {"character": "Himself", "name": "Earl L. Butz"}, {"character": "Himself", "name": "Michael Pollan"}], "crew": [{"job": "Director", "name": "Aaron Woolf"}, {"job": "Writer", "name": "Ian Cheney"}, {"job": "Writer", "name": "Curtis Ellis"}, {"job": "Writer", "name": "Jeffrey K. Miller"}, {"job": "Writer", "name": "Aaron Woolf"}, {"job": "Producer", "name": "Ian Cheney"}, {"job": "Producer", "name": "Curtis Ellis"}, {"job": "Producer", "name": "Aaron Woolf"}], "title": "King Corn", "genres": ["Documentary"], "keywords": ["iowa", "agriculture", "documentary", "food industry", "corn", "farming"], "original_language": "English", "rating": "UNRATED", "release_date": "2007-10-12", "revenue": 81368.0, "runtime": 88, "summary": "King Corn is a feature documentary about two friends, one acre of corn, and the subsidized crop that drives our fast-food nation. In King Corn, Ian Cheney and Curt Ellis, best friends from college on the east coast, move to the heartland to learn where their food comes from. With the help of friendly neighbors, genetically modified seeds, and powerful herbicides, they plant and grow a bumper crop of America's most-productive, most-subsidized grain on one acre of Iowa soil. But when they try to follow their pile of corn into the food system, what they find raises troubling questions about how we eat-and how we farm", "tokens": ["king", "corn", "featur", "documentari", "two", "friend", "on", "acr", "corn", "subsid", "crop", "drive", "fast", "food", "nation", "in", "king", "corn", "ian", "chenei", "curt", "elli", "best", "friend", "colleg", "east", "coast", "move", "heartland", "learn", "food", "come", "with", "help", "friendli", "neighbor", "genet", "modifi", "seed", "power", "herbicid", "plant", "grow", "bumper", "crop", "america", "product", "subsid", "grain", "on", "acr", "iowa", "soil", "but", "try", "follow", "pile", "corn", "food", "system", "find", "rais", "troubl", "question", "eat", "farm"], "tmdb_score_value": 6.9, "tmdb_score_count": 15, "imdb_score_value": 7.1, "imdb_score_count": 1824, "meta_score_value": 70.0, "meta_score_count": 15}