{"id": "tt1172957", "cast": [{"character": "Himself", "name": "Ray Kurzweil"}, {"character": "Himself", "name": "Aubrey de Grey"}, {"character": "Himself", "name": "Ray Bradbury"}, {"character": "Herself", "name": "Suzanne Somers"}, {"character": "Herself", "name": "Phyllis Diller"}, {"character": "Herself", "name": "Marianne Williamson"}], "crew": [{"job": "Director", "name": "Mark Wexler"}], "title": "How to Live Forever", "genres": ["Documentary"], "keywords": ["health", "humor", "aging", "life extension", "multiculturalism", "forever", "centenarian"], "original_language": "English", "rating": "NOT RATED", "release_date": "2011-05-13", "revenue": 40836.0, "runtime": 92, "summary": "Director Mark Wexler embarks on a worldwide trek to investigate just what it means to grow old and what it could mean to really live forever. But whose advice should he take? Does a chain-smoking, beer-drinking centenarian marathoner have all the answers? What about an elder porn star? Wexler contrasts these unusual characters with the insights of health, fitness and life-extension experts in his engaging new documentary, which challenges our notions of youth and aging with comic poignancy. Begun as a study in life-extension, HOW TO LIVE FOREVER evolves into a thought-provoking examination of what truly gives life meaning.", "tokens": ["director", "mark", "wexler", "embark", "worldwid", "trek", "investig", "mean", "grow", "old", "could", "mean", "realli", "live", "forev", "but", "whose", "advic", "take", "doe", "chain", "smoke", "beer", "drink", "centenarian", "marathon", "answer", "what", "elder", "porn", "star", "wexler", "contrast", "unusu", "charact", "insight", "health", "fit", "life", "extens", "expert", "engag", "new", "documentari", "challeng", "notion", "youth", "ag", "comic", "poignanc", "begun", "studi", "life", "extens", "how", "to", "live", "forev", "evolv", "thought", "provok", "examin", "truli", "give", "life", "mean"], "tmdb_score_value": 5.5, "tmdb_score_count": 2, "imdb_score_value": 6.3, "imdb_score_count": 219, "meta_score_value": 57.0, "meta_score_count": 13}