{"id": "tt1277736", "cast": [{"character": "Himself (archive footage)", "name": "James Brown"}, {"character": "Himself (archive footage)", "name": "Bill Withers"}, {"character": "Himself (archive footage)", "name": "B.B. King"}, {"character": "Himself (archive footage)", "name": "Muhammad Ali"}, {"character": "Himself (archive footage)", "name": "Don King"}, {"character": "Himself", "name": "Manu Dibango"}, {"character": "Herself", "name": "Lola Love"}, {"character": "Himself", "name": "Franco Luombo"}], "crew": [{"job": "Director", "name": "Jeffrey Kusama-Hinte"}, {"job": "Producer", "name": "Leon Gast"}, {"job": "Producer", "name": "David Sonenberg"}, {"job": "Producer", "name": "Jeffrey Kusama-Hinte"}], "title": "Soul Power", "genres": ["Documentary", "Music"], "keywords": ["transporter", "soul", "music festival", "zaire"], "original_language": "English", "rating": "PG-13", "release_date": "2008-09-04", "revenue": 0.0, "runtime": 93, "summary": "In 1974, music producers, Hugh Masekela and Stewart Levine worked with the boxing promoter, Don King, to create a music festival in Africa to run concurrently with his championship boxing match he arranged with Muhammad Ali and George Foreman, aka \"The Rumble in the Jungle,\" in Kinshasa, Zaire. However, due to an unforeseen delay due to Foreman injuring himself in training, it was decided that the music festival must still go on as scheduled. This film covers the preparation of that festival with both stage construction and the arrival of the participating musicians. When all is ready, the people of Zaire got to experience a musical event that Africa had never seen before with great African-American and local artists performing with verve and purpose, with the Godfather of Soul, James Brown, just the biggest star of this musical extravaganza.", "tokens": ["in", "1974", "music", "produc", "hugh", "masekela", "stewart", "levin", "work", "box", "promot", "don", "king", "creat", "music", "festiv", "africa", "run", "concurr", "championship", "box", "match", "arrang", "muhammad", "ali", "georg", "foreman", "aka", "the", "rumbl", "jungl", "kinshasa", "zair", "howev", "due", "unforeseen", "delai", "due", "foreman", "injur", "train", "decid", "music", "festiv", "must", "still", "go", "schedul", "thi", "film", "cover", "prepar", "festiv", "stage", "construct", "arriv", "particip", "musician", "when", "readi", "peopl", "zair", "got", "experi", "music", "event", "africa", "never", "seen", "great", "african", "american", "local", "artist", "perform", "verv", "purpos", "godfath", "soul", "jame", "brown", "biggest", "star", "music", "extravaganza"], "tmdb_score_value": 5.9, "tmdb_score_count": 7, "imdb_score_value": 7.1, "imdb_score_count": 702, "meta_score_value": 76.0, "meta_score_count": 22}