{"id": "tt1325743", "cast": [{"character": "Jake Gibson", "name": "Cam Gigandet"}, {"character": "Sarah Reynolds", "name": "Jena Malone"}, {"character": "Vanessa", "name": "Julianna Guill"}, {"character": "Homeless Prophet", "name": "Mark Boone Junior"}, {"character": "Jim the Plumber", "name": "Richard Riehle"}, {"character": "Professor Birchbaum", "name": "Nick Chinlund"}, {"character": "Samuel Kim", "name": "Will Yun Lee"}, {"character": "Darren", "name": "Tad Hilgenbrink"}, {"character": "Patty the Waitress", "name": "Patricia Belcher"}, {"character": "Yvette Montgomery", "name": "Brooklyn Sudano"}], "crew": [{"job": "Director", "name": "Danny Buday"}, {"job": "Screenplay", "name": "Danny Buday"}, {"job": "Producer", "name": "Danny Buday"}, {"job": "Producer", "name": "Aim\u00e9e Flaherty"}, {"job": "Producer", "name": "Joel Mendoza"}, {"job": "Producer", "name": "Mike Robertson"}], "title": "Five Star Day", "genres": ["Drama", "Romance"], "keywords": ["horoscope"], "original_language": "English", "rating": "NOT RATED", "release_date": "2010-04-22", "revenue": 0.0, "runtime": 97, "summary": "Four People. One Horoscope. Infinite Possibilities. Jake Gibson's (Cam Gigandet) horoscope forecasts a perfect FIVE STAR DAY the morning of his birthday, but what's foretold as a flawless day unfolds to be far less than stellar. Jake's world turns upside down when all that could go wrong ... does. Determined that Astrology has no legitimacy, Jake embarks on a journey to test the theory of Astrology by finding the three people born the same time and place as himself - Sarah Reynolds (Jena Malone), Yvette Montgomery (Brooklyn Sudano) and Wesley Henderson (Max Hartman). The journey quickly uproots Jake from the small college town of Berkeley, California, to downtown Chicago where he sets out to find and interview Sarah, Yvette and Wesley to see if their birthdays proved to be as deplorable as his own. Jake's pursuit in finding his three Astrological matches (or Zodiac twins) will not only test his convictions, but validate how life's unexpected twists of fate can deliver much more than ...", "tokens": ["four", "peopl", "on", "horoscop", "infinit", "possibl", "jake", "gibson", "cam", "gigandet", "horoscop", "forecast", "perfect", "five", "star", "dai", "morn", "birthdai", "foretold", "flawless", "dai", "unfold", "far", "less", "stellar", "jake", "world", "turn", "upsid", "could", "go", "wrong", "determin", "astrolog", "legitimaci", "jake", "embark", "journei", "test", "theori", "astrolog", "find", "three", "peopl", "born", "time", "place", "sarah", "reynold", "jena", "malon", "yvett", "montgomeri", "brooklyn", "sudano", "weslei", "henderson", "max", "hartman", "the", "journei", "quickli", "uproot", "jake", "small", "colleg", "town", "berkelei", "california", "downtown", "chicago", "set", "find", "interview", "sarah", "yvett", "weslei", "see", "birthdai", "prove", "deplor", "jake", "pursuit", "find", "three", "astrolog", "match", "zodiac", "twin", "test", "convict", "valid", "life", "unexpect", "twist", "fate", "deliv", "much"], "tmdb_score_value": 4.5, "tmdb_score_count": 8, "imdb_score_value": 5.8, "imdb_score_count": 677, "meta_score_value": 41.0, "meta_score_count": 9}