{"id": "tt1326283", "cast": [{"character": "herself", "name": "Angelina Jolie"}, {"character": "himself", "name": "Pierce Brosnan"}, {"character": "herself", "name": "Jane Goodall"}, {"character": "Himself", "name": "Kofi Annan"}, {"character": "Himself", "name": "Hugo Eric Louis van Lawick"}, {"character": "Himself", "name": "Hugo Van Lawick"}, {"character": "Herself", "name": "Judy Waters"}, {"character": "Himself", "name": "Merlin van Lawick"}, {"character": "himself", "name": "Angel van Lawick"}], "crew": [{"job": "Director", "name": "Lorenz Knauer"}, {"job": "Writer", "name": "Lorenz Knauer"}, {"job": "Producer", "name": "Wiebke Esser"}, {"job": "Producer", "name": "Michael Halberstadt"}, {"job": "Producer", "name": "Philipp Schall"}, {"job": "Producer", "name": "Philipp Wundt"}], "title": "Jane's Journey", "genres": ["Documentary"], "keywords": ["biography", "ape", "chimpanzee", "primatologist"], "original_language": "English", "rating": "TV-G", "release_date": "2011-09-06", "revenue": 0.0, "runtime": 107, "summary": "More than 20 years ago, Dr. Jane Goodall, now 75, decided to give up her career as a primatologist, as well as her private life, in order to devote all her energy to saving our endangered planet. Since then she's been spending 300 days a year scouring the globe on her mission to spread hope for future generations. She has taken on the responsibilities of a UN Messenger of Peace, and has been honored with countless awards. In Jane's Journey, we accompany her on her travels across several continents, and receive unprecedented access to her intense and exciting past. From her childhood home in Bournemouth, England, we embark to Gombe National Park on the shores of Lake Tanganyika, in Tanzania, her second home. It's where she began her groundbreaking research nearly half a century ago, and she still returns every year to enjoy the company of the chimpanzees that made her the internationally recognized activist so loved and deeply respected.This documentary offers an intimate portrait of ...", "tokens": ["more", "20", "year", "ago", "dr", "jane", "goodal", "75", "decid", "give", "career", "primatologist", "well", "privat", "life", "order", "devot", "energi", "save", "endang", "planet", "sinc", "spend", "300", "dai", "year", "scour", "globe", "mission", "spread", "hope", "futur", "gener", "she", "taken", "respons", "un", "messeng", "peac", "honor", "countless", "award", "in", "jane", "journei", "accompani", "travel", "across", "sever", "contin", "receiv", "unpreced", "access", "intens", "excit", "past", "from", "childhood", "home", "bournemouth", "england", "embark", "gomb", "nation", "park", "shore", "lake", "tanganyika", "tanzania", "second", "home", "it", "began", "groundbreak", "research", "nearli", "half", "centuri", "ago", "still", "return", "everi", "year", "enjoi", "compani", "chimpanze", "made", "internation", "recogn", "activist", "love", "deepli", "respect", "thi", "documentari", "offer", "intim", "portrait"], "tmdb_score_value": 4.6, "tmdb_score_count": 4, "imdb_score_value": 7.3, "imdb_score_count": 255, "meta_score_value": 49.0, "meta_score_count": 8}