{"id": "tt1322362", "cast": [{"character": "Himself", "name": "Vito Acconci"}, {"character": "Himself", "name": "Fred Armisen"}, {"character": "Himself", "name": "Rico Bell"}, {"character": "Himself", "name": "Hugo Burnham"}, {"character": "Herself", "name": "Sarah Corina"}, {"character": "Himself", "name": "Craig Finn"}, {"character": "Himself", "name": "Jonathan Franzen"}, {"character": "Himself", "name": "Steve Goulding"}, {"character": "Himself", "name": "Tom Greenhalgh"}, {"character": "Herself", "name": "Susie Honeyman"}, {"character": "Himself", "name": "Greg Kot"}, {"character": "Himself", "name": "Jon Langford"}, {"character": "Himself", "name": "Greil Marcus"}, {"character": "Himself", "name": "Will Oldham"}, {"character": "Herself", "name": "Sally Timms"}], "crew": [{"job": "Director", "name": "Joe Angio"}], "title": "Revenge of the Mekons", "genres": ["Music", "Documentary"], "keywords": ["punk rock"], "original_language": "English", "rating": "NOT RATED", "release_date": "2013-11-14", "revenue": 0.0, "runtime": 95, "summary": "REVENGE OF THE MEKONS charts the unlikely career of the genre-defying collective notorious for being--as rock critic Greil Marcus notes--\"the band that took punk ideology most seriously.\" Born out of the 1977 British punk scene, the Mekons progressed from a group of socialist art students with no musical skills to the prolific, raucous progeny of Hank Williams. Joe Angio's exuberant documentary follows their improbable history - a surprising and influential embrace of folk and country music, forays into the art world and consistent bad luck with major record labels. Featuring interviews with celebrated fans, from author Jonathan Franzen to film director Mary Harron to comedian/musician Fred Armisen, REVENGE OF THE MEKONS reveals how, four decades into an ever-evolving career, punk's reigning contrarians continue to make bold, unpredictable music while staying true to the punk ethos.", "tokens": ["reveng", "of", "the", "mekon", "chart", "unlik", "career", "genr", "defi", "collect", "notori", "rock", "critic", "greil", "marcu", "note", "band", "took", "punk", "ideolog", "serious", "born", "1977", "british", "punk", "scene", "mekon", "progress", "group", "socialist", "art", "student", "music", "skill", "prolif", "raucou", "progeni", "hank", "william", "joe", "angio", "exuber", "documentari", "follow", "improb", "histori", "surpris", "influenti", "embrac", "folk", "countri", "music", "forai", "art", "world", "consist", "bad", "luck", "major", "record", "label", "featur", "interview", "celebr", "fan", "author", "jonathan", "franzen", "film", "director", "mari", "harron", "comedian/musician", "fred", "armisen", "reveng", "of", "the", "mekon", "reveal", "four", "decad", "ever", "evolv", "career", "punk", "reign", "contrarian", "continu", "make", "bold", "unpredict", "music", "stai", "true", "punk", "etho"], "tmdb_score_value": 7.5, "tmdb_score_count": 4, "imdb_score_value": 7.3, "imdb_score_count": 75, "meta_score_value": 77.0, "meta_score_count": 13}