{"id": "tt1328634", "cast": [{"character": "Sameer", "name": "John Abraham"}, {"character": "Maya", "name": "Katrina Kaif"}, {"character": "Omar", "name": "Neil Nitin Mukesh"}, {"character": "Roshan", "name": "Irrfan Khan"}, {"character": "Danyal", "name": "Aidan Wagner"}, {"character": "Zilgai", "name": "Nawazuddin Siddiqui"}], "crew": [{"job": "Director", "name": "Kabir Khan"}, {"job": "Producer", "name": "Aditya Chopra"}, {"job": "Screenplay", "name": "Sandeep Srivastava"}], "title": "New York", "genres": ["Romance", "Crime", "Drama"], "keywords": ["new york", "war on terror", "drama", "bollywood"], "original_language": "Hindi", "rating": "NOT RATED", "release_date": "2009-06-26", "revenue": 0.0, "runtime": 153, "summary": "NEW YORK is a contemporary story of friendship set against the larger than life backdrop of a city often described as the centre of the world. Omar (Neil Nitin Mukesh) has gone abroad for the first time in his life and soon enough he begins to see and love America through the eyes of his American friends - Sam (John Abraham) and Maya (Katrina Kaif). It is the story of these three friends discovering a new world together. But one day the world around them changed - For most of us, larger events in the world are just headlines in the newspapers but these events can change our lives - forever. New York is one such story of 3 young friends whose beautiful lives are turned upside down by the larger event of 9/11 beyond their control. At this point enters Agent Roshan (Irrfan), an FBI undercover agent who sets the ball rolling for a series of tumultuous events that turn the lives of these friends into a dangerous and thrilling roller coaster ride. Innocence is lost forever.", "tokens": ["new", "york", "contemporari", "stori", "friendship", "set", "larger", "life", "backdrop", "citi", "often", "describ", "centr", "world", "omar", "neil", "nitin", "mukesh", "gone", "abroad", "first", "time", "life", "soon", "enough", "begin", "see", "love", "america", "ey", "american", "friend", "sam", "john", "abraham", "maya", "katrina", "kaif", "it", "stori", "three", "friend", "discov", "new", "world", "togeth", "but", "on", "dai", "world", "around", "chang", "for", "us", "larger", "event", "world", "headlin", "newspap", "event", "chang", "live", "forev", "new", "york", "on", "stori", "3", "young", "friend", "whose", "beauti", "live", "turn", "upsid", "larger", "event", "9/11", "beyond", "control", "at", "point", "enter", "agent", "roshan", "irrfan", "fbi", "undercov", "agent", "set", "ball", "roll", "seri", "tumultu", "event", "turn", "live", "friend", "danger", "thrill", "roller", "coaster", "ride", "innoc", "lost", "forev"], "tmdb_score_value": 6.3, "tmdb_score_count": 40, "imdb_score_value": 6.8, "imdb_score_count": 9087, "meta_score_value": 35.0, "meta_score_count": 4}