{"id": "tt1480285", "cast": [{"character": "Julia", "name": "Jessica Lowndes"}, {"character": "Grady", "name": "Joe Anderson"}, {"character": "Allie", "name": "Lin Shaye"}, {"character": "Jebediah Crone", "name": "Dayton Callie"}, {"character": "Richard Renshaw", "name": "Michael Par\u00e9"}, {"character": "Chester", "name": "Bryan Batt"}, {"character": "Charlie", "name": "Aiden Flowers"}, {"character": "Sheriff McDermott", "name": "John McConnell"}, {"character": "Kyle", "name": "J. Larose"}], "crew": [{"job": "Director", "name": "Darren Lynn Bousman"}, {"job": "Writer", "name": "Christopher Monfette"}, {"job": "Producer", "name": "Brent C. Johnson"}, {"job": "Original Music Composer", "name": "Mark Sayfritz"}, {"job": "Producer", "name": "Jesse Berger"}], "title": "Abattoir", "genres": ["Horror", "Thriller"], "keywords": ["home", "haunted house", "based on comic", "serial killer", "crime scene", "hooded figure", "evangelist"], "original_language": "English", "rating": "R", "release_date": "2016-12-08", "revenue": 0.0, "runtime": 98, "summary": "An investigative reporter works to solve the mystery behind a mysterious man who has been buying houses where tragedies have occurred. Set in a world where it always feels like night, even in daylight hours, real estate reporter Julia Talben's life is turned upside down when her family is brutally murdered. It is believed to be an open and close case, but Julia quickly realizes there is much more to this story when she returns to the crime scene to find the murder room deconstructed and physically removed from her sister's home. This ignites an investigative pursuit that eventually leads her and ex-lover Detective Declan Grady to the town of New English where they find the enigmatic Jebediah Crone and the Abattoir - a monstrous house stitched together with unending rooms of death and the damned. Julia comes to realize that her sister's soul is trapped inside, but the Abattoir isn't just a house - it's a door to something more evil than anyone could have ever imagined. Julia and Grady ...", "tokens": ["an", "investig", "report", "work", "solv", "mysteri", "behind", "mysteri", "man", "bui", "hous", "tragedi", "occur", "set", "world", "alwai", "feel", "like", "night", "even", "daylight", "hour", "real", "estat", "report", "julia", "talben", "life", "turn", "upsid", "famili", "brutal", "murder", "it", "believ", "open", "close", "case", "julia", "quickli", "realiz", "much", "stori", "return", "crime", "scene", "find", "murder", "room", "deconstruct", "physic", "remov", "sister", "home", "thi", "ignit", "investig", "pursuit", "eventu", "lead", "ex", "lover", "detect", "declan", "gradi", "town", "new", "english", "find", "enigmat", "jebediah", "crone", "abattoir", "monstrou", "hous", "stitch", "togeth", "unend", "room", "death", "damn", "julia", "come", "realiz", "sister", "soul", "trap", "insid", "abattoir", "hous", "door", "someth", "evil", "anyon", "could", "ever", "imagin", "julia", "gradi"], "tmdb_score_value": 4.5, "tmdb_score_count": 73, "imdb_score_value": 4.4, "imdb_score_count": 3061, "meta_score_value": 40.0, "meta_score_count": 9}