{"id": "tt1482980", "cast": [{"character": "Himself", "name": "Joel Salatin"}], "crew": [{"job": "Director", "name": "Graham Meriwether"}, {"job": "Screenplay", "name": "Graham Meriwether"}, {"job": "Screenplay", "name": "Memo Salazar"}], "title": "American Meat", "genres": ["Documentary"], "keywords": ["cattle", "organic food", "farmer"], "original_language": "English", "rating": "NOT RATED", "release_date": "2013-04-12", "revenue": 0.0, "runtime": 85, "summary": "American Meat is a solutions-oriented documentary chronicling the current state of the U.S. meat industry. Featuring Joel Salatin, Chuck Wirtz, Fred Kirschenmann, Steve Ells, Paul Willis, and farmers across America, it takes an even-handed look at animal husbandry. First explaining how America arrived at our current industrial system, the story shifts to the present day, showing the feedlots and confinement houses, not through hidden cameras but through the eyes of the farmers who live and work there. From there, the documentary introduces the revolution taking root in animal husbandry, led by the charismatic and passionate Joel Salatin. Stories are shared of farmers across the country who have changed their life to start grass-based farms, and everyday solutions highlight actions people can make to support America's agriculture.", "tokens": ["american", "meat", "solut", "orient", "documentari", "chronicl", "current", "state", "u", "s", "meat", "industri", "the", "film", "explor", "question", "can", "sustain", "meat", "farm", "feed", "america", "featur", "joel", "salatin", "chuck", "wirtz", "fred", "kirschenmann", "steve", "ell", "paul", "willi", "farmer", "across", "america", "american", "meat", "take", "even", "hand", "look", "anim", "husbandri", "first", "film", "explain", "america", "arriv", "current", "industri", "system", "show", "nation", "feedlot", "confin", "hous", "hidden", "camera", "ey", "farmer", "live", "work", "from", "film", "introduc", "revolut", "take", "root", "anim", "husbandri", "led", "charismat", "passion", "joel", "salatin", "viewer", "meet", "farmer", "across", "countri", "chang", "life", "start", "grass", "base", "farm", "film", "highlight", "everi", "dai", "solut", "peopl", "us", "impact", "meat", "product", "america"], "tmdb_score_value": 0.0, "tmdb_score_count": 0, "imdb_score_value": 8.0, "imdb_score_count": 23, "meta_score_value": 40.0, "meta_score_count": 5}