{"id": "tt1445683", "cast": [{"character": "Himself", "name": "Bernardo Bertolucci"}, {"character": "Herself", "name": "Catherine Breillat"}, {"character": "Herself", "name": "Liliana Cavani"}, {"character": "Himself", "name": "Stephen Frears"}, {"character": "Himself", "name": "Todd Haynes"}, {"character": "Himself", "name": "Richard Linklater"}, {"character": "Himself", "name": "Ken Loach"}, {"character": "Himself", "name": "David Lynch"}, {"character": "Himself", "name": "John Sayles"}, {"character": "Herself", "name": "Agn\u00e8s Varda"}, {"character": "Herself", "name": "Angela Ismailos"}], "crew": [{"job": "Director", "name": "Angela Ismailos"}], "title": "Great Directors", "genres": ["Documentary"], "keywords": ["filmmaker", "woman director"], "original_language": "English", "rating": "NOT RATED", "release_date": "2010-07-02", "revenue": 0.0, "runtime": 90, "summary": "Great Directors, directed by Angela Ismailos, features conversations with ten of the world's greatest living directors: Bernardo Bertolucci, David Lynch, Liliana Cavani, Stephen Frears, Agnes Varda, Ken Loach, Todd Haynes, Catherine Breillat, Richard Linklater and John Sayles. The film documents Ismailos' voyage of discovering the creative personalities behind the camera. She explores the filmmakers' artistic evolution and personal identity, the role of politics and history on their work, and the agony and dilemmas in the creative process. It also examines the challenges of being an artist in an age of commercialism and globalization. The film traces the influence of cinematic movements and iconic directors on these directors' work-from the role of Neo-Realism in Bertolucci's evolution to the influence of Federico Fellini on David Lynch, Ingmar Bergman on Catherine Breillat and Rainer Werner Fassbinder on Todd Haynes.", "tokens": ["great", "director", "direct", "angela", "ismailo", "featur", "convers", "ten", "world", "greatest", "live", "director", "bernardo", "bertolucci", "david", "lynch", "liliana", "cavani", "stephen", "frear", "agn", "varda", "ken", "loach", "todd", "hayn", "catherin", "breillat", "richard", "linklat", "john", "sayl", "the", "film", "document", "ismailo", "voyag", "discov", "creativ", "person", "behind", "camera", "she", "explor", "filmmak", "artist", "evolut", "person", "ident", "role", "polit", "histori", "work", "agoni", "dilemma", "creativ", "process", "it", "also", "examin", "challeng", "artist", "ag", "commerci", "global", "the", "film", "trace", "influenc", "cinemat", "movement", "icon", "director", "director", "work", "role", "neo", "realism", "bertolucci", "evolut", "influenc", "federico", "fellini", "david", "lynch", "ingmar", "bergman", "catherin", "breillat", "rainer", "werner", "fassbind", "todd", "hayn"], "tmdb_score_value": 6.2, "tmdb_score_count": 6, "imdb_score_value": 6.4, "imdb_score_count": 417, "meta_score_value": 49.0, "meta_score_count": 15}