{"id": "tt1409772", "cast": [{"character": "Himself", "name": "Ozwald Boateng"}, {"character": "Himself", "name": "Giorgio Armani"}, {"character": "Himself", "name": "Michael Bay"}, {"character": "Himself", "name": "Paul Bettany"}, {"character": "Himself", "name": "Richard Branson"}, {"character": "Himself", "name": "Gabriel Byrne"}, {"character": "Himself", "name": "Don Cheadle"}, {"character": "Himself", "name": "Daniel Day-Lewis"}, {"character": "Himself", "name": "Laurence Fishburne"}, {"character": "Himself", "name": "Jamie Foxx"}, {"character": "Himself", "name": "Jesse Jackson"}, {"character": "Himself", "name": "Spike Lee"}, {"character": "Himself", "name": "Brian McKnight"}, {"character": "Himself", "name": "Prince Charles"}, {"character": "Himself", "name": "Wolfgang Puck"}, {"character": "Himself", "name": "Keanu Reeves"}, {"character": "Himself", "name": "Gavin Rossdale"}, {"character": "Himself", "name": "Ryan Seacrest"}, {"character": "Himself", "name": "Benjamin Silverman"}, {"character": "Himself", "name": "Will Smith"}], "crew": [{"job": "Director", "name": "Varon Bonicos"}, {"job": "Producer", "name": "Alastair Clark"}, {"job": "Producer", "name": "Mark Foligno"}, {"job": "Producer", "name": "Steve Milne"}, {"job": "Producer", "name": "Rachel Robey"}], "title": "A Man's Story", "genres": ["Documentary"], "keywords": ["fashion designer", "fashion"], "original_language": "English", "rating": "NOT RATED", "release_date": "2011-10-08", "revenue": 0.0, "runtime": 98, "summary": "Tailor to Hollywood's A-list, and a superstar in his own right, Ozwald Boateng is a dynamic force of energy, passion and colour. 1998: already celebrated as one of the most talented menswear designers in the world, Ozwald Boateng is about to go bankrupt and divorce his first wife. Through luck and circumstance director Varon Bonicos is able to switch on a camera. It continues to roll for the next twelve years. What emerges is a groundbreaking film that takes us on an exhilarating behind-the-scenes ride into the world of high fashion with one of one of the most influential menswear designers of his generation. Ending in 2010 when Boateng closes London Fashion Week with the biggest menswear show in history, Bonicos is able to get behind the headlines and chart Boateng's singular dream to succeed. Instinctive, flawed and generous, A Man's Story goes to the very heart of what Boateng has spent an entire career trying to distil: \"what it is to be a man.\"", "tokens": ["tailor", "hollywood", "a", "list", "superstar", "right", "ozwald", "boateng", "dynam", "forc", "energi", "passion", "colour", "1998", "alreadi", "celebr", "on", "talent", "menswear", "design", "world", "ozwald", "boateng", "go", "bankrupt", "divorc", "first", "wife", "through", "luck", "circumst", "director", "varon", "bonico", "abl", "switch", "camera", "it", "continu", "roll", "next", "twelv", "year", "what", "emerg", "groundbreak", "film", "take", "us", "exhilar", "behind", "scene", "ride", "world", "high", "fashion", "on", "on", "influenti", "menswear", "design", "gener", "end", "2010", "boateng", "close", "london", "fashion", "week", "biggest", "menswear", "show", "histori", "bonico", "abl", "get", "behind", "headlin", "chart", "boateng", "singular", "dream", "succe", "instinct", "flaw", "gener", "a", "man", "stori", "goe", "heart", "boateng", "spent", "entir", "career", "try", "distil", "man"], "tmdb_score_value": 8.3, "tmdb_score_count": 3, "imdb_score_value": 6.2, "imdb_score_count": 126, "meta_score_value": 49.0, "meta_score_count": 10}