{"id": "tt1562847", "cast": [{"character": "Col. Hardacre", "name": "Chris Cooper"}, {"character": "Zeke", "name": "DJ Qualls"}, {"character": "Lt. Compton", "name": "Garret Dillahunt"}, {"character": "Padre Hidalgo", "name": "Yul Vazquez"}, {"character": "Shanker", "name": "Lucas Neff"}, {"character": "Gil", "name": "Dane DeHaan"}, {"character": "Rafael", "name": "Joel Torre"}, {"character": "Dutch", "name": "Bill Tangradi"}, {"character": "Nenong", "name": "John Arcilla"}], "crew": [{"job": "Director", "name": "John Sayles"}, {"job": "Writer", "name": "John Sayles"}], "title": "Amigo", "genres": ["Drama", "History", "War"], "keywords": ["ambush", "rebel", "rain", "village", "arrest", "friendship", "philippines", "gun battle", "soldier", "american", "early 1900s"], "original_language": "English", "rating": "R", "release_date": "2010-07-14", "revenue": 0.0, "runtime": 128, "summary": "AMIGO, the 17th feature film from Academy Award-nominated writer-director John Sayles, stars legendary Filipino actor Joel Torre as Rafael, a village mayor caught in the murderous crossfire of the Philippine-American War. When U.S. troops occupy his village, Rafael comes under pressure from a tough-as-nails officer (Chris Cooper) to help the Americans in their hunt for Filipino guerilla fighters. But Rafael's brother (Ronnie Lazaro) is the head of the local guerillas, and considers anyone who cooperates with the Americans to be a traitor. Rafael quickly finds himself forced to make the impossible, potentially deadly decisions faced by ordinary civilians in an occupied country. A powerful drama of friendship, betrayal, romance and heartbreaking violence, AMIGO is a page torn from the untold history of the Philippines, and a mirror of today's unresolvable conflicts.", "tokens": ["amigo", "17th", "featur", "film", "academi", "award", "nomin", "writer", "director", "john", "sayl", "star", "legendari", "filipino", "actor", "joel", "torr", "rafael", "villag", "mayor", "caught", "murder", "crossfir", "philippin", "american", "war", "when", "u", "s", "troop", "occupi", "villag", "rafael", "come", "pressur", "tough", "nail", "offic", "chri", "cooper", "help", "american", "hunt", "filipino", "guerilla", "fighter", "but", "rafael", "brother", "ronni", "lazaro", "head", "local", "guerilla", "consid", "anyon", "cooper", "american", "traitor", "rafael", "quickli", "find", "forc", "make", "imposs", "potenti", "deadli", "decis", "face", "ordinari", "civilian", "occupi", "countri", "a", "power", "drama", "friendship", "betray", "romanc", "heartbreak", "violenc", "amigo", "page", "torn", "untold", "histori", "philippin", "mirror", "todai", "unresolv", "conflict"], "tmdb_score_value": 5.7, "tmdb_score_count": 3, "imdb_score_value": 5.9, "imdb_score_count": 502, "meta_score_value": 63.0, "meta_score_count": 22}