{"id": "tt1520367", "cast": [{"character": "herself", "name": "Jeanne Balibar"}, {"character": "himself", "name": "Rodolphe Burger"}, {"character": "himself", "name": "Herv\u00e9 Loos"}, {"character": "himself", "name": "Arnaud Dieterlen"}, {"character": "himself", "name": "Jo\u00ebl Theux"}, {"character": "himself", "name": "Fran\u00e7ois Loriquet"}, {"character": "himself", "name": "Fred Cacheux"}], "crew": [{"job": "Director", "name": "Pedro Costa"}, {"job": "Producer", "name": "S\u00e9bastien de Fonseca"}, {"job": "Producer", "name": "Abel Ribeiro Chaves"}, {"job": "Producer", "name": "C\u00e9dric Walter"}], "title": "Change Nothing", "genres": ["Documentary", "Music"], "keywords": [], "original_language": "French", "rating": "NOT RATED", "release_date": "2009-05-15", "revenue": 0.0, "runtime": 100, "summary": "In Ne change rien, we see the French actress/singer Jeanne Balibar rehearsing, recording, performing and practicing with a singing coach for an opera bouffe by Jacques Offenbach. The Portuguese director Pedro Costa, a friend of Balibar's who did the camera work himself, filmed her in long, static shots in which all attention is focused on her performance. This film, shot digitally, shows how versatile Balibar is. Costa also manages to portray the creative process, for instance in a scene in which Balibar and her guitarist Rodolphe Burger try out several variations of a song. Costa's intimate portrait of the singer is filmed in black-and-white. Costa, who is celebrating his 50th birthday this year and who made his debut in 1989 with the feature O sangue, has seen many of his films screened in Rotterdam over the years.", "tokens": ["in", "ne", "chang", "rien", "see", "french", "actress/sing", "jeann", "balibar", "rehears", "record", "perform", "practic", "sing", "coach", "opera", "bouff", "jacqu", "offenbach", "the", "portugues", "director", "pedro", "costa", "friend", "balibar", "camera", "work", "film", "long", "static", "shot", "attent", "focus", "perform", "thi", "film", "shot", "digit", "show", "versatil", "balibar", "costa", "also", "manag", "portrai", "creativ", "process", "instanc", "scene", "balibar", "guitarist", "rodolph", "burger", "try", "sever", "variat", "song", "costa", "intim", "portrait", "singer", "film", "black", "white", "costa", "celebr", "50th", "birthdai", "year", "made", "debut", "1989", "featur", "o", "sangu", "seen", "mani", "film", "screen", "rotterdam", "year"], "tmdb_score_value": 8.5, "tmdb_score_count": 2, "imdb_score_value": 7.2, "imdb_score_count": 244, "meta_score_value": 82.0, "meta_score_count": 4}