{"id": "tt1532945", "cast": [{"character": "Herself", "name": "Cl\u00e1udia Raia"}, {"character": "Himself", "name": "Miguel Falabella"}, {"character": "Herself", "name": "Liza Minnelli"}, {"character": "Himself", "name": "Gilberto Gil"}, {"character": "Herself", "name": "Mar\u00edlia P\u00eara"}, {"character": "Herself", "name": "Norma Bengell"}, {"character": "Himself", "name": "C\u00e9sar Camargo Mariano"}, {"character": "Herself", "name": "Maria Zilda Bethlem"}], "crew": [{"job": "Director", "name": "Raphael Alvarez"}, {"job": "Director", "name": "Tatiana Issa"}], "title": "Dzi Croquettes", "genres": ["Drama", "Documentary"], "keywords": ["brazil"], "original_language": "English", "rating": "NOT RATED", "release_date": "2009-10-04", "revenue": 0.0, "runtime": 110, "summary": "The Dzi Croquettes - A Brazilian theater group that through talent, irony and humor confronted the Brazilian government and its violent dictatorship. They were banned and censored by the military regime and yet revolutionized the gay movement worldwide changing Theater and Dance language to an entire generation. Their history embraces Brazilian pop culture of the 1970's and 1980's, the violent years of dictatorship in Brazil, the sexual revolution, the beginning of the AIDS era and, above all, the enormous legacy that would remain unforgettable to every single person that had the opportunity to see their work. They were loved and admired by luminaries such as Mick Jagger, Jeanne Moreau, Omar Sharif, Maurice B\u00e9jart, Josephine Baker and Liza Minnelli, who became a personal friend and played a major role in bringing them to Paris and subsequently to fame. The director's father (Am\u00e9rico Issa) worked with the group from 1970 to 1978, giving Tatiana the magical opportunity of growing up ...", "tokens": ["the", "dzi", "croquett", "a", "brazilian", "theater", "group", "talent", "ironi", "humor", "confront", "brazilian", "govern", "violent", "dictatorship", "thei", "ban", "censor", "militari", "regim", "yet", "revolution", "gai", "movement", "worldwid", "chang", "theater", "danc", "languag", "entir", "gener", "their", "histori", "embrac", "brazilian", "pop", "cultur", "1970", "1980", "violent", "year", "dictatorship", "brazil", "sexual", "revolut", "begin", "aid", "era", "enorm", "legaci", "would", "remain", "unforgett", "everi", "singl", "person", "opportun", "see", "work", "thei", "love", "admir", "luminari", "mick", "jagger", "jeann", "moreau", "omar", "sharif", "mauric", "b\u00e9jart", "josephin", "baker", "liza", "minnelli", "becam", "person", "friend", "plai", "major", "role", "bring", "pari", "subsequ", "fame", "the", "director", "father", "am\u00e9rico", "issa", "work", "group", "1970", "1978", "give", "tatiana", "magic", "opportun", "grow"], "tmdb_score_value": 7.8, "tmdb_score_count": 4, "imdb_score_value": 8.0, "imdb_score_count": 298, "meta_score_value": 65.0, "meta_score_count": 7}