{"id": "tt1640680", "cast": [{"character": "himself (Platoon Commander)", "name": "Rasmus"}, {"character": "himself", "name": "Mads 'Mini'"}, {"character": "himself", "name": "Daniel 'Olby'"}, {"character": "himself", "name": "Kim 'Birkerod'"}], "crew": [{"job": "Director", "name": "Janus Metz Pedersen"}, {"job": "Writer", "name": "Kasper Torsting"}], "title": "Armadillo", "genres": ["Documentary", "War"], "keywords": ["denmark", "patrol", "taliban", "parody", "soldier", "bullet wound", "combat", "danish soldier"], "original_language": "Danish", "rating": "NOT RATED", "release_date": "2010-05-27", "revenue": 0.0, "runtime": 105, "summary": "In February of 2009, a group of Danish soldiers accompanied by documentarian Janus Metz arrived at Armadillo, an army base in the southern Afghan province of Helmand. Metz and cinematographer Lars Skree spent six months following the lives of young soldiers situated less than a kilometre from Taliban positions. The result of their work is a gripping and highly authentic war drama that was justly awarded the Grand Prix de la Semaine de la Critique at the 2010 Cannes film festival. But it also provoked furious debate in Denmark concerning the controversial behavior of certain Danish soldiers during a shoot-out with Taliban fighters. The film-makers repeatedly risked their lives shooting this tense, brilliantly edited, and visually sophisticated probe into the psychology of young men in the midst of a senseless war whose victims are primarily local villagers. Yet more disturbing than scenes in which Taliban bullets whiz past their cameras is the footage of the young soldiers as each ...", "tokens": ["in", "februari", "2009", "group", "danish", "soldier", "accompani", "documentarian", "janu", "metz", "arriv", "armadillo", "armi", "base", "southern", "afghan", "provinc", "helmand", "metz", "cinematograph", "lar", "skree", "spent", "six", "month", "follow", "live", "young", "soldier", "situat", "less", "kilometr", "taliban", "posit", "the", "result", "work", "grip", "highli", "authent", "war", "drama", "justli", "award", "grand", "prix", "de", "la", "semain", "de", "la", "critiqu", "2010", "cann", "film", "festiv", "but", "also", "provok", "furiou", "debat", "denmark", "concern", "controversi", "behavior", "certain", "danish", "soldier", "shoot", "taliban", "fighter", "the", "film", "maker", "repeatedli", "risk", "live", "shoot", "tens", "brilliantli", "edit", "visual", "sophist", "probe", "psycholog", "young", "men", "midst", "senseless", "war", "whose", "victim", "primarili", "local", "villag", "yet", "disturb", "scene", "taliban", "bullet", "whiz", "past", "camera", "footag", "young", "soldier"], "tmdb_score_value": 7.0, "tmdb_score_count": 56, "imdb_score_value": 7.6, "imdb_score_count": 8650, "meta_score_value": 72.0, "meta_score_count": 14}