{"id": "tt1645852", "cast": [{"character": "Self", "name": "Michael Pollan"}, {"character": "Self", "name": "Gunther Hauk"}, {"character": "Self", "name": "Vandana Shiva"}, {"character": "Author", "name": "Raj Patel"}], "crew": [{"job": "Director", "name": "Taggart Siegel"}, {"job": "Producer", "name": "Taggart Siegel"}], "title": "Queen of the Sun", "genres": ["Documentary"], "keywords": ["beehive", "nature", "pesticide", "bee", "pollination", "organic agriculture", "anthroposophy", "monoculture", "rudolf steiner"], "original_language": "English", "rating": "NOT RATED", "release_date": "2010-04-01", "revenue": 0.0, "runtime": 83, "summary": "QUEEN OF THE SUN: What Are the Bees Telling Us? is a profound, alternative look at the global bee crisis from Taggart Siegel, director of THE REAL DIRT ON FARMER JOHN. Taking us on a journey through the catastrophic disappearance of bees and the mysterious world of the beehive, this engaging and ultimately uplifting film weaves an unusual and dramatic story of the heartfelt struggles of beekeepers, scientists and philosophers from around the world including Michael Pollan, Gunther Hauk and Vandana Shiva. Together they reveal both the problems and the solutions in renewing a culture in balance with nature.", "tokens": ["queen", "of", "the", "sun", "what", "ar", "bee", "tell", "us", "profound", "altern", "look", "global", "bee", "crisi", "taggart", "siegel", "director", "the", "real", "dirt", "on", "farmer", "john", "take", "us", "journei", "catastroph", "disappear", "bee", "mysteri", "world", "beehiv", "engag", "ultim", "uplift", "film", "weav", "unusu", "dramat", "stori", "heartfelt", "struggl", "beekeep", "scientist", "philosoph", "around", "world", "includ", "michael", "pollan", "gunther", "hauk", "vandana", "shiva", "togeth", "reveal", "problem", "solut", "renew", "cultur", "balanc", "natur"], "tmdb_score_value": 6.5, "tmdb_score_count": 4, "imdb_score_value": 7.2, "imdb_score_count": 300, "meta_score_value": 67.0, "meta_score_count": 16}