{"id": "tt1603489", "cast": [{"character": "Blowfly", "name": "Clarence Reid"}, {"character": "Himself", "name": "Greg Bell"}, {"character": "Himself", "name": "Jello Biafra"}, {"character": "Himself", "name": "Chuck D."}, {"character": "Himself", "name": "Norwood Fisher"}, {"character": "Himself", "name": "Ice-T"}], "crew": [{"job": "Director", "name": "Jonathan Furmanski"}], "title": "The Weird World of Blowfly", "genres": ["Documentary", "Music"], "keywords": ["independent film"], "original_language": "English", "rating": "NOT RATED", "release_date": "2010-10-20", "revenue": 0.0, "runtime": 89, "summary": "Clarence Reid is a musician who wrote and produced romantic and spiritual songs for some of the greatest Southern soul and R&amp;B acts of the 1960s and '70s. He is also the gonzo performer Blowfly, Clarence's freaky alter ego and the original X-rated rapper. \"The Weird World of Blowfly\" explores both sides of this hilarious and controversial artist, providing a rare, inside peek at the infamous linguist's daily life. Now 69-years-old, with a gold-spangled superhero costume and a catalog of the world's raunchiest tunes, Blowfly tours the world, still struggling for success and recognition after 50 years of making music. The film highlights both Clarence's and Blowfly's unique contributions to music history, including Top-10 R&amp;B hits and what might be the world's first rap song, recorded in 1965. Shot over the course of two years, the film follows Clarence at home and around the world, featuring dozens of classic Blowfly songs as well as new hits. A revealing portrait of an unheralded man,...", "tokens": ["clarenc", "reid", "musician", "wrote", "produc", "romant", "spiritu", "song", "greatest", "southern", "soul", "r&amp", "b", "act", "1960", "70", "he", "also", "gonzo", "perform", "blowfli", "clarenc", "freaki", "alter", "ego", "origin", "x", "rate", "rapper", "the", "weird", "world", "blowfli", "explor", "side", "hilari", "controversi", "artist", "provid", "rare", "insid", "peek", "infam", "linguist", "daili", "life", "now", "69", "year", "old", "gold", "spangl", "superhero", "costum", "catalog", "world", "raunchiest", "tune", "blowfli", "tour", "world", "still", "struggl", "success", "recognit", "50", "year", "make", "music", "the", "film", "highlight", "clarenc", "blowfli", "uniqu", "contribut", "music", "histori", "includ", "top", "10", "r&amp", "b", "hit", "might", "world", "first", "rap", "song", "record", "1965", "shot", "cours", "two", "year", "film", "follow", "clarenc", "home", "around", "world", "featur", "dozen", "classic", "blowfli", "song", "well", "new", "hit", "a", "reveal", "portrait", "unherald", "man"], "tmdb_score_value": 8.5, "tmdb_score_count": 1, "imdb_score_value": 6.3, "imdb_score_count": 108, "meta_score_value": 52.0, "meta_score_count": 6}