{"id": "tt1719068", "cast": [{"character": "Betsy", "name": "Melanie Griffith"}, {"character": "Jim", "name": "Michael Cudlitz"}, {"character": "Carl Marznap", "name": "Pruitt Taylor Vince"}, {"character": "Iris", "name": "Suzanne Quast"}, {"character": "Manny", "name": "Brad Bufanda"}, {"character": "Osvaldo", "name": "Eddie J. Fernandez"}, {"character": "Office Worker", "name": "Waymond Lee"}, {"character": "Donna", "name": "Samantha Lester"}, {"character": "Janita", "name": "Nayo Wallace"}, {"character": "Young Jim", "name": "Joseph John Schirle"}], "crew": [{"job": "Director", "name": "Suri Krishnamma"}, {"job": "Writer", "name": "Frank John Hughes"}, {"job": "Producer", "name": "Zachery Ty Bryan"}, {"job": "Producer", "name": "Michael Cudlitz"}, {"job": "Producer", "name": "Suzanne DeLaurentiis"}, {"job": "Producer", "name": "Frank John Hughes"}, {"job": "Producer", "name": "Adam Targum"}], "title": "The Grief Tourist", "genres": ["Thriller", "Drama"], "keywords": ["prostitute", "serial killer", "transsexual"], "original_language": "English", "rating": "R", "release_date": "2013-08-23", "revenue": 0.0, "runtime": 84, "summary": "A psychological-thriller in the haunting tradition of films like Taxi Driver and Monster, The Grief Tourist takes us into the chilling labyrinth of a man's dark hobby and his even darker mind. JIM TAHANA doesn't leave much of an impression when he passes you by. But look closer and you'll sense his hunger - the deep hunger of an insatiable American soul - always scanning to devour something - anything that might fill the searing, unexplained void within him. Jim obsesses over the hobby that has been part of his DNA since he was a young boy: grief tourism - the act of traveling with the intent to visit places of tragedy or disaster. Every year his week-long vacations from work are spent going to grief tourist locations in the lives of different serial killers he is fascinated with. This years obsession is Carl Marznap, a mass murderer from New Orleans, Louisiana. But this trip is no ordinary vacation as Jim's rancid sexual impulses and weakening grip on reality deteriorate into a ...", "tokens": ["a", "psycholog", "thriller", "haunt", "tradit", "film", "like", "taxi", "driver", "monster", "the", "grief", "tourist", "take", "us", "chill", "labyrinth", "man", "dark", "hobbi", "even", "darker", "mind", "jim", "tahana", "leav", "much", "impress", "pass", "but", "look", "closer", "sens", "hunger", "deep", "hunger", "insati", "american", "soul", "alwai", "scan", "devour", "someth", "anyth", "might", "fill", "sear", "unexplain", "void", "within", "jim", "obsess", "hobbi", "part", "dna", "sinc", "young", "boi", "grief", "tourism", "act", "travel", "intent", "visit", "place", "tragedi", "disast", "everi", "year", "week", "long", "vacat", "work", "spent", "go", "grief", "tourist", "locat", "live", "differ", "serial", "killer", "fascin", "thi", "year", "obsess", "carl", "marznap", "mass", "murder", "new", "orlean", "louisiana", "but", "trip", "ordinari", "vacat", "jim", "rancid", "sexual", "impuls", "weaken", "grip", "realiti", "deterior"], "tmdb_score_value": 5.5, "tmdb_score_count": 12, "imdb_score_value": 5.0, "imdb_score_count": 902, "meta_score_value": 40.0, "meta_score_count": 6}