{"id": "tt1766085", "cast": [{"character": "Himself", "name": "Ivan Brunetti"}, {"character": "Himself", "name": "Daniel Clowes"}, {"character": "Mitch D", "name": "Mitch Deprey"}, {"character": "Pete", "name": "Peter Haskett"}, {"character": "Ray", "name": "Raymond Huffman"}, {"character": "Himself", "name": "Mike Mitchell"}, {"character": "Himself", "name": "Henry S. Rosenthal"}, {"character": "Himself", "name": "Eddie Lee Sausage"}], "crew": [{"job": "Director", "name": "Matthew Bate"}, {"job": "Writer", "name": "Matthew Bate"}], "title": "Shut Up Little Man! An Audio Misadventure", "genres": ["Comedy", "Documentary"], "keywords": ["neighbor", "noisy neighbor", "audio recording", "homophobe", "tape recording \u00a0"], "original_language": "English", "rating": "UNRATED", "release_date": "2011-08-26", "revenue": 0.0, "runtime": 90, "summary": "In 1987 San Francisco, Eddie Lee Sausage and Mitch Deprey began recording the squabbles of their stranger than fiction neighbors, the bigoted Raymond Huffman and the out and proud Peter Haskett. The recital of the pair's outrageous reality quickly took on a life of its own. This darkly funny documentary chronicles the history of Raymond and Peter, as well as what happened to former slackers Eddie and Mitch, who paint a picture of not only their outrageous neighbors, but also of San Francisco's Lower Haight neighborhood in the late 1980s. Interviews with others who were influenced by the recordings document their broad influence on a variety of artists, near and far.", "tokens": ["in", "1987", "san", "francisco", "eddi", "lee", "sausag", "mitch", "deprei", "began", "record", "squabbl", "stranger", "fiction", "neighbor", "bigot", "raymond", "huffman", "proud", "peter", "haskett", "the", "recit", "pair", "outrag", "realiti", "quickli", "took", "life", "thi", "darkli", "funni", "documentari", "chronicl", "histori", "raymond", "peter", "well", "happen", "former", "slacker", "eddi", "mitch", "paint", "pictur", "outrag", "neighbor", "also", "san", "francisco", "lower", "haight", "neighborhood", "late", "1980", "interview", "other", "influenc", "record", "document", "broad", "influenc", "varieti", "artist", "near", "far"], "tmdb_score_value": 5.5, "tmdb_score_count": 15, "imdb_score_value": 6.7, "imdb_score_count": 1022, "meta_score_value": 57.0, "meta_score_count": 14}