{"id": "tt1727373", "cast": [{"character": "Lt. Samuel Drake", "name": "Chadwick Boseman"}, {"character": "Sgt. Devon Carter", "name": "Tory Kittles"}, {"character": "Marshall", "name": "Billy Zane"}, {"character": "Peter Krebbs", "name": "Peter Greene"}, {"character": "Clean Cut Vet", "name": "Brian Siefkes"}, {"character": "Hull", "name": "Dennis Adkins"}, {"character": "James", "name": "Ted Rooney"}, {"character": "Carol", "name": "Victoria Blake"}, {"character": "Middle Aged Woman", "name": "Shannon Day"}, {"character": "Trashy Woman", "name": "Haley Talbot"}, {"character": "Business Man", "name": "Casey McFeron"}, {"character": "Boss", "name": "Thomas Gleicher"}, {"character": "Older Goon", "name": "Jerry L. Buxbaum"}, {"character": "Waitress #1", "name": "Susan Funk"}, {"character": "Iraqi Man", "name": "Raj Patel"}, {"character": "Support Group Veteran", "name": "Jerry Bell Jr."}], "crew": [{"job": "Director", "name": "Mischa Webley"}, {"job": "Producer", "name": "Jonny Gillette"}, {"job": "Producer", "name": "Zach Hagen"}, {"job": "Writer", "name": "Mischa Webley"}], "title": "The Kill Hole", "genres": ["Action"], "keywords": [], "original_language": "English", "rating": "PG-13", "release_date": "2012-08-28", "revenue": 0.0, "runtime": 91, "summary": "Lt. Samuel Drake (Chadwick Boseman) is a troubled vet plagued by his actions while deployed in Iraq. Recently discharged, he is trying to piece his life back together while he works as a cab driver and lives in a rundown motel room. He also attends counseling sessions led by Marshall (Billy Zane) to help cope with the horrors of his past. While on this path to a fresh start, Drake's fragile new life is shattered when two executives (Peter Greene and Ted Rooney), who represent a private military contractor, present a new mission, one with no option to refuse; track down and kill Sgt. Devin Carter (Tory Kittles), an AWOL Marine Corps. sniper who knows the truth about Drake's past and who himself is on a mission to target and kill members of the mercenary firm. A gripping, lyrical meditation on war and the scars it leaves on those who fight, The Kill Hole is a story of one man who is forced to face his violent past, and the uneasy bond he forms with the mysterious assassin he must ...", "tokens": ["lt", "samuel", "drake", "chadwick", "boseman", "troubl", "vet", "plagu", "action", "deploi", "iraq", "recent", "discharg", "try", "piec", "life", "back", "togeth", "work", "cab", "driver", "live", "rundown", "motel", "room", "he", "also", "attend", "counsel", "session", "led", "marshal", "billi", "zane", "help", "cope", "horror", "past", "while", "path", "fresh", "start", "drake", "fragil", "new", "life", "shatter", "two", "execut", "peter", "green", "ted", "roonei", "repres", "privat", "militari", "contractor", "present", "new", "mission", "on", "option", "refus", "track", "kill", "sgt", "devin", "carter", "tori", "kittl", "awol", "marin", "corp", "sniper", "know", "truth", "drake", "past", "mission", "target", "kill", "member", "mercenari", "firm", "a", "grip", "lyric", "medit", "war", "scar", "leav", "fight", "the", "kill", "hole", "stori", "on", "man", "forc", "face", "violent", "past", "uneasi", "bond", "form", "mysteri", "assassin", "must"], "tmdb_score_value": 4.9, "tmdb_score_count": 4, "imdb_score_value": 4.0, "imdb_score_count": 298, "meta_score_value": 39.0, "meta_score_count": 4}