{"id": "tt1836987", "cast": [{"character": "Trishna", "name": "Freida Pinto"}, {"character": "Jay", "name": "Riz Ahmed"}, {"character": "Jay's Father", "name": "Roshan Seth"}, {"character": "Herself", "name": "Kalki Koechlin"}, {"character": "Himself", "name": "Anurag Kashyap"}], "crew": [{"job": "Director", "name": "Michael Winterbottom"}, {"job": "Original Music Composer", "name": "Umebayashi Shigeru"}, {"job": "Screenplay", "name": "Michael Winterbottom"}], "title": "Trishna", "genres": ["Drama"], "keywords": ["india", "abuse"], "original_language": "English", "rating": "R", "release_date": "2011-09-08", "revenue": 0.0, "runtime": 117, "summary": "Based on Thomas Hardy's classic novel Tess of the D'Urbervilles, 'Trishna' tells the story of one woman whose life is destroyed by a combination of love and circumstances. Set in contemporary Rajasthan, Trishna (Freida Pinto) meets a wealthy young British businessman Jay Singh (Riz Ahmed) who has come to India to work in his father's hotel business. After an accident destroys her father's Jeep, Trishna goes to work for Jay, and they fall in love. But despite their feelings for each other, they cannot escape the conflicting pressures of a rural society which is changing rapidly through industrialisation, urbanisation and, above all, education. Trishna's tragedy is that she is torn between the traditions of her family life and the dreams and ambitions that her education has given her.", "tokens": ["base", "thoma", "hardi", "classic", "novel", "tess", "d", "urbervil", "trishna", "tell", "stori", "on", "woman", "whose", "life", "destroi", "combin", "love", "circumst", "set", "contemporari", "rajasthan", "trishna", "freida", "pinto", "meet", "wealthi", "young", "british", "businessman", "jai", "singh", "riz", "ahm", "come", "india", "work", "father", "hotel", "busi", "after", "accid", "destroi", "father", "jeep", "trishna", "goe", "work", "jai", "fall", "love", "but", "despit", "feel", "cannot", "escap", "conflict", "pressur", "rural", "societi", "chang", "rapidli", "industrialis", "urbanis", "educ", "trishna", "tragedi", "torn", "tradit", "famili", "life", "dream", "ambit", "educ", "given"], "tmdb_score_value": 5.8, "tmdb_score_count": 26, "imdb_score_value": 6.0, "imdb_score_count": 2714, "meta_score_value": 57.0, "meta_score_count": 22}