{"id": "tt1847746", "cast": [{"character": "Josef Mengele", "name": "\u00c0lex Brendem\u00fchl"}, {"character": "Eva", "name": "Natalia Oreiro"}, {"character": "Enzo", "name": "Diego Peretti"}, {"character": "Nora Eldoc", "name": "Elena Roger"}, {"character": "Tom\u00e1s", "name": "Alan Daicz"}, {"character": "Lilith", "name": "Florencia Bado"}, {"character": "Ailin", "name": "Abril Braunstein"}, {"character": "Otto", "name": "Juan I Martinez"}, {"character": "Klaus", "name": "Guillermo Pfening"}, {"character": "Nurse", "name": "Ana Pauls"}, {"character": "Factory owner", "name": "Carlos Kaspar"}], "crew": [{"job": "Director", "name": "Luc\u00eda Puenzo"}, {"job": "Writer", "name": "Luc\u00eda Puenzo"}, {"job": "Producer", "name": "Luc\u00eda Puenzo"}, {"job": "Producer", "name": "Gudny Hummelvoll"}, {"job": "Producer", "name": "Nicol\u00e1s Batlle"}, {"job": "Producer", "name": "Axel Kuschevatzky"}, {"job": "Producer", "name": "Jos\u00e9 Mar\u00eda Morales"}, {"job": "Producer", "name": "Fabienne Vonier"}], "title": "The German Doctor", "genres": ["Drama", "Thriller"], "keywords": ["german", "nazi", "mengele", "doctor", "woman director"], "original_language": "Spanish", "rating": "PG-13", "release_date": "2013-05-19", "revenue": 0.0, "runtime": 90, "summary": "Patagonia, 1960. A German doctor (Alex Brendem\u00fchl) meets an Argentinean family and follows them on a long desert road to a small town where the family will be starting a new life. Eva (Natalia Oreiro), Enzo and their three children welcome the doctor into their home and entrust their young daughter, Lilith (Florencia Bado), to his care, not knowing that they are harboring one of the most dangerous criminals in the world. At the same time, Israeli agents are desperately looking to bring THE GERMAN DOCTOR to justice. Based on filmmaker Luc\u00eda Puenzo's (XXY) fifth novel, the story follows Josef Mengele, the \"Angel of Death,\" a German SS officer and a physician at the Auschwitz concentration camp, in the years he spent \"hiding\", along with many other Nazi's, in South America following his escape from Germany. Mengele was considered to be one of WWII's most heinous Nazi war criminals.", "tokens": ["patagonia", "1960", "a", "german", "doctor", "alex", "brendem\u00fchl", "meet", "argentinean", "famili", "follow", "long", "desert", "road", "small", "town", "famili", "start", "new", "life", "eva", "natalia", "oreiro", "enzo", "three", "children", "welcom", "doctor", "home", "entrust", "young", "daughter", "lilith", "florencia", "bado", "care", "know", "harbor", "on", "danger", "crimin", "world", "at", "time", "isra", "agent", "desper", "look", "bring", "the", "german", "doctor", "justic", "base", "filmmak", "luc\u00eda", "puenzo", "xxy", "fifth", "novel", "stori", "follow", "josef", "mengel", "angel", "death", "german", "ss", "offic", "physician", "auschwitz", "concentr", "camp", "year", "spent", "hide", "along", "mani", "nazi", "south", "america", "follow", "escap", "germani", "mengel", "consid", "on", "wwii", "heinou", "nazi", "war", "crimin"], "tmdb_score_value": 6.6, "tmdb_score_count": 44, "imdb_score_value": 6.8, "imdb_score_count": 5090, "meta_score_value": 62.0, "meta_score_count": 18}