{"id": "tt1885331", "cast": [{"character": "Alice", "name": "Alice Taglioni"}, {"character": "Victor", "name": "Patrick Bruel"}, {"character": "H\u00e9l\u00e8ne", "name": "Marine Delterme"}, {"character": "Pierre", "name": "Louis-Do de Lencquesaing"}, {"character": "Le p\u00e8re", "name": "Michel Aumont"}, {"character": "Himself", "name": "Woody Allen"}], "crew": [{"job": "Director", "name": "Sophie Lellouche"}, {"job": "Screenplay", "name": "Sophie Lellouche"}], "title": "Paris-Manhattan", "genres": ["Comedy", "Romance"], "keywords": ["paris", "love triangle", "romantic comedy", "romance", "woman director"], "original_language": "French", "rating": "NOT RATED", "release_date": "2012-07-16", "revenue": 0.0, "runtime": 79, "summary": "In Paris, the pharmacist Alice has been an obsessed Woody Allen fan since she was fifteen and has seen all his movies and talks to him alone in her room. When she meets Pierre in a night-club, she finds that he loves jazz and she believes he is her prince charming. But when Pierre sees Alice's sister H\u00e9l\u00e8ne, they immediately fall in love with each other and marry each other. Years later, Alice is a spinster that administrates the pharmacy that belonged to her father and believes that movies can heal many diseases. However her father insistently tries to find a husband for her. When the alarm technician Victor meets Alice, she does not see any future relationship with him. But one day, Victor brings Alice to meet Woody Allen in Paris and the director gives an advice to Alice.", "tokens": ["in", "pari", "pharmacist", "alic", "obsess", "woodi", "allen", "fan", "sinc", "fifteen", "seen", "movi", "talk", "alon", "room", "when", "meet", "pierr", "night", "club", "find", "love", "jazz", "believ", "princ", "charm", "but", "pierr", "see", "alic", "sister", "h\u00e9l\u00e8ne", "immedi", "fall", "love", "marri", "year", "later", "alic", "spinster", "administr", "pharmaci", "belong", "father", "believ", "movi", "heal", "mani", "diseas", "howev", "father", "insist", "tri", "find", "husband", "when", "alarm", "technician", "victor", "meet", "alic", "see", "futur", "relationship", "but", "on", "dai", "victor", "bring", "alic", "meet", "woodi", "allen", "pari", "director", "give", "advic", "alic"], "tmdb_score_value": 5.3, "tmdb_score_count": 76, "imdb_score_value": 6.1, "imdb_score_count": 3266, "meta_score_value": 36.0, "meta_score_count": 10}