{"id": "tt1865503", "cast": [{"character": "Claire", "name": "Kate Lyn Sheil"}, {"character": "Ben", "name": "Ti West"}, {"character": "Charlie", "name": "Amy Seimetz"}, {"character": "Ethan", "name": "Joe Swanberg"}, {"character": "June", "name": "Jane Adams"}, {"character": "Sam", "name": "Larry Fessenden"}, {"character": "Casting Director", "name": "Amber Sealey"}], "crew": [{"job": "Director", "name": "Joe Swanberg"}, {"job": "Writer", "name": "Joe Swanberg"}, {"job": "Producer", "name": "Amy Seimetz"}, {"job": "Producer", "name": "Joe Swanberg"}], "title": "Silver Bullets", "genres": ["Horror"], "keywords": ["actress"], "original_language": "English", "rating": "NOT RATED", "release_date": "2011-10-28", "revenue": 0.0, "runtime": 70, "summary": "Ethan (Joe Swanberg) is a director who aims to make meaningful art films, but is struggling with a creative slump and disengagement with his work. His girlfriend Claire (Kate Lyn Sheil), is an actress whose career is beginning to take off. She has accepted the lead part in a werewolf movie being directed by talented young horror filmmaker Ben (Ti West). Ethan's depression leads to jealousy over both Claire's success and her increasingly close relationship with Ben. Ethan decides to retaliate against Claire by casting her best friend Charlie (Amy Seimetz) in a romantic role opposite himself in his new film. As pettiness and jealousy spiral out of control within their relationship, Claire begins to slip into a surreal fantasy world that more closely mirrors her role in the werewolf film than that of her real life. Largely improvised Silver Bullets draws inspiration from Chekhov 's The Seagull and Roman Polanski's Bitter Moon, while using David Foster Wallace as a reference point to ...", "tokens": ["ethan", "joe", "swanberg", "director", "aim", "make", "meaning", "art", "film", "struggl", "creativ", "slump", "disengag", "work", "hi", "girlfriend", "clair", "kate", "lyn", "sheil", "actress", "whose", "career", "begin", "take", "she", "accept", "lead", "part", "werewolf", "movi", "direct", "talent", "young", "horror", "filmmak", "ben", "ti", "west", "ethan", "depress", "lead", "jealousi", "clair", "success", "increasingli", "close", "relationship", "ben", "ethan", "decid", "retali", "clair", "cast", "best", "friend", "charli", "ami", "seimetz", "romant", "role", "opposit", "new", "film", "as", "petti", "jealousi", "spiral", "control", "within", "relationship", "clair", "begin", "slip", "surreal", "fantasi", "world", "close", "mirror", "role", "werewolf", "film", "real", "life", "larg", "improvis", "silver", "bullet", "draw", "inspir", "chekhov", "the", "seagul", "roman", "polanski", "bitter", "moon", "us", "david", "foster", "wallac", "refer", "point"], "tmdb_score_value": 6.0, "tmdb_score_count": 2, "imdb_score_value": 5.4, "imdb_score_count": 233, "meta_score_value": 59.0, "meta_score_count": 4}