{"id": "tt2062996", "cast": [{"character": "Himself", "name": "Ice-T"}, {"character": "Himself", "name": "Dr. Dre"}, {"character": "Himself", "name": "Ice Cube"}, {"character": "Himself", "name": "Snoop Dogg"}, {"character": "Himself", "name": "Eminem"}, {"character": "Himself", "name": "Afrika Bambaataa"}, {"character": "Himself", "name": "Grandmaster Caz"}, {"character": "Himself", "name": "Bun B"}, {"character": "Himself", "name": "Busy Bee"}, {"character": "Himself", "name": "Kool Boy"}, {"character": "Himself", "name": "Joe Budden"}, {"character": "Himself", "name": "Cashout Chris"}, {"character": "Himself", "name": "Common"}, {"character": "Himself", "name": "Anthony 'Treach' Criss"}, {"character": "Himself", "name": "Chuck D."}, {"character": "Himself", "name": "Yasiin Bey"}, {"character": "Himself", "name": "Doug E. Fresh"}, {"character": "Himself", "name": "Big Daddy Kane"}, {"character": "Himself", "name": "KRS-One"}, {"character": "Himself", "name": "DJ Premier"}], "crew": [{"job": "Director", "name": "Ice-T"}, {"job": "Director", "name": "Andy Baybutt"}], "title": "Something from Nothing: The Art of Rap", "genres": ["Documentary"], "keywords": ["rap music"], "original_language": "English", "rating": "R", "release_date": "2012-06-15", "revenue": 288312.0, "runtime": 106, "summary": "SOMETHING FROM NOTHING: THE ART OF RAP is a feature length performance documentary about the runaway juggernaut that is Rap music. At the wheel of this unstoppable beast is the film's director and interviewer Ice-T. Taking us on a deeply personal journey Ice-T uncovers how this music of the street has grown to dominate the world. Along the way Ice-T meets a whole spectrum of Hip-Hop talent, from founders, to new faces, to the global superstars like Eminem, Dr Dre, Snoop Dogg and Kanye West. He exposes the roots and history of Rap and then, through meeting many of its most famous protagonists, studies the living mechanism of the music to reveal 'The Art Of Rap'. This extraordinary film features unique performances from the entire cast, without resorting to archive material, to build a fresh and surprising take on the phenomenon that is Rap.", "tokens": ["someth", "from", "noth", "the", "art", "of", "rap", "featur", "length", "perform", "documentari", "runawai", "juggernaut", "rap", "music", "at", "wheel", "unstopp", "beast", "film", "director", "interview", "ic", "t", "take", "us", "deepli", "person", "journei", "ic", "t", "uncov", "music", "street", "grown", "domin", "world", "along", "wai", "ic", "t", "meet", "whole", "spectrum", "hip", "hop", "talent", "founder", "new", "face", "global", "superstar", "like", "eminem", "dr", "dre", "snoop", "dogg", "kany", "west", "he", "expos", "root", "histori", "rap", "meet", "mani", "famou", "protagonist", "studi", "live", "mechan", "music", "reveal", "the", "art", "of", "rap", "thi", "extraordinari", "film", "featur", "uniqu", "perform", "entir", "cast", "without", "resort", "archiv", "materi", "build", "fresh", "surpris", "take", "phenomenon", "rap"], "tmdb_score_value": 6.7, "tmdb_score_count": 31, "imdb_score_value": 7.2, "imdb_score_count": 3139, "meta_score_value": 66.0, "meta_score_count": 11}