{"id": "tt2007387", "cast": [{"character": "Kang Eun-Pyo", "name": "Shin Ha-kyun"}, {"character": "Kim Soo-hyuk", "name": "Go Soo"}, {"character": "Oh Gi-Yeong", "name": "Ryu Seung-su"}, {"character": "Hyeon Jeong-Yoon", "name": "Ryu Seung-ryong"}, {"character": "Cha Tae-Kyeong", "name": "Kim Ok-vin"}, {"character": "Hwang Seon-cheol", "name": "Park Young-seo"}, {"character": "Lee Sang-eok", "name": "Jeong In-gi"}, {"character": "Shin Il Young", "name": "Lee Je-hoon"}, {"character": "Yang Hyo-sam", "name": "Ko Chang-seok"}, {"character": "Yoo Jae-ho", "name": "Cho Jin-woong"}, {"character": "North Korean Military Officer", "name": "Choi Min"}], "crew": [{"job": "Producer", "name": "Lee Woo-jeong"}, {"job": "Director", "name": "Jang Hoon"}, {"job": "Original Music Composer", "name": "Jang Young-gyu"}, {"job": "Producer", "name": "Kim Hyeon-cheol"}, {"job": "Original Music Composer", "name": "Dalparan"}, {"job": "Screenplay", "name": "Park Sang-yeon"}], "title": "The Front Line", "genres": ["Drama", "Action", "War"], "keywords": ["korean war", "war", "battle"], "original_language": "Korean", "rating": "NOT RATED", "release_date": "2011-07-20", "revenue": 0.0, "runtime": 133, "summary": "Towards the end of the Korean War an uneasy ceasefire is ordered, but out on the Eastern front line of the Aerok Hills fierce fighting continues. A race to capture a strategic point to determine a new border between the two Koreas is the ultimate prize. A bullet is then found in the body of dead company commander of the South Korean army. The bullet that killed the company commander belongs to the South Korean army. Lieutenant of the Defense Security Command Kang Eun-Pyo is ordered to go out into the Eastern front line and investigate the murder. When Kang Eun-Pyo arrives in the Aerok Hills he is surprised to find his old friend Kim Soo-Hyeok commanding troops in the Aerok Hills. Kang Eun-Pyo believed Kim Soo-Hyeok was dead. In their younger years, Kim Soo-Hyeok was a meek student, but he eventually became the leader of Aerok company as a lieutenant. The situation in the Aerok company raises many flags in the eyes of Kang Eun-Pyo. Soldiers wear North Korean uniforms inside due to the ...", "tokens": ["toward", "end", "korean", "war", "uneasi", "ceasefir", "order", "eastern", "front", "line", "aerok", "hill", "fierc", "fight", "continu", "a", "race", "captur", "strateg", "point", "determin", "new", "border", "two", "korea", "ultim", "prize", "a", "bullet", "found", "bodi", "dead", "compani", "command", "south", "korean", "armi", "the", "bullet", "kill", "compani", "command", "belong", "south", "korean", "armi", "lieuten", "defens", "secur", "command", "kang", "eun", "pyo", "order", "go", "eastern", "front", "line", "investig", "murder", "when", "kang", "eun", "pyo", "arriv", "aerok", "hill", "surpris", "find", "old", "friend", "kim", "soo", "hyeok", "command", "troop", "aerok", "hill", "kang", "eun", "pyo", "believ", "kim", "soo", "hyeok", "dead", "in", "younger", "year", "kim", "soo", "hyeok", "meek", "student", "eventu", "becam", "leader", "aerok", "compani", "lieuten", "the", "situat", "aerok", "compani", "rais", "mani", "flag", "ey", "kang", "eun", "pyo", "soldier", "wear", "north", "korean", "uniform", "insid", "due"], "tmdb_score_value": 7.2, "tmdb_score_count": 48, "imdb_score_value": 7.4, "imdb_score_count": 4934, "meta_score_value": 59.0, "meta_score_count": 10}