{"id": "tt2017634", "cast": [{"character": "Himself", "name": "Peter Ackworth"}, {"character": "Herself", "name": "Maitresse Madeline Marlowe"}, {"character": "Himself", "name": "Chris Norris"}, {"character": "Herself", "name": "Princess Donna"}, {"character": "Himself", "name": "James Deen"}, {"character": "Herself", "name": "Remy LaCroix"}], "crew": [{"job": "Director", "name": "Christina Voros"}, {"job": "Writer", "name": "Christina Voros"}, {"job": "Writer", "name": "Ian Olds"}, {"job": "Producer", "name": "James Franco"}], "title": "Kink", "genres": ["Documentary"], "keywords": ["pornography", "sex", "bondage", "interview", "biography", "sexual fantasy", "bdsm", "woman director"], "original_language": "English", "rating": "UNRATED", "release_date": "2013-01-19", "revenue": 0.0, "runtime": 80, "summary": "Director Christina Voros and producer James Franco pull back the curtain on the fetish empire of Kink.com, the Internet's largest producer of BDSM content. In a particularly obscure corner of an industry that operates largely out of public view, Kink.com's directors and models strive for authenticity. In an enterprise often known for exploitative practices, Kink.com upholds an ironclad set of values to foster an environment that is safe, sane, and consensual. They aim to demystify the BDSM lifestyle, and to serve as an example and an educational resource for the BDSM community. In kink, we discover not only a fascinating and often misunderstood subculture, but also, in a career far from the mainstream, a group of intelligent, charismatic, and driven people who really, truly love what they do.", "tokens": ["director", "christina", "voro", "produc", "jame", "franco", "pull", "back", "curtain", "fetish", "empir", "kink", "com", "internet", "largest", "produc", "bdsm", "content", "in", "particularli", "obscur", "corner", "industri", "oper", "larg", "public", "view", "kink", "com", "director", "model", "strive", "authent", "in", "enterpris", "often", "known", "exploit", "practic", "kink", "com", "uphold", "ironclad", "set", "valu", "foster", "environ", "safe", "sane", "consensu", "thei", "aim", "demystifi", "bdsm", "lifestyl", "serv", "exampl", "educ", "resourc", "bdsm", "commun", "in", "kink", "discov", "fascin", "often", "misunderstood", "subcultur", "also", "career", "far", "mainstream", "group", "intellig", "charismat", "driven", "peopl", "realli", "truli", "love"], "tmdb_score_value": 5.5, "tmdb_score_count": 21, "imdb_score_value": 6.3, "imdb_score_count": 1025, "meta_score_value": 67.0, "meta_score_count": 8}