{"id": "tt2055765", "cast": [{"character": "Linda Sinclair", "name": "Julianne Moore"}, {"character": "Jason Sherwood", "name": "Michael Angarano"}, {"character": "Dr. Tom Sherwood", "name": "Greg Kinnear"}, {"character": "Halle Anderson", "name": "Lily Collins"}, {"character": "Narrator", "name": "Fiona Shaw"}, {"character": "Vice Principal Phil Pelaski", "name": "Norbert Leo Butz"}, {"character": "Principal Trudie Slocum", "name": "Jessica Hecht"}, {"character": "Will", "name": "Charlie Saxton"}, {"character": "Carl Kapinas", "name": "Nathan Lane"}, {"character": "Sheila Nussbaum", "name": "Nikki Blonsky"}, {"character": "Joni Gerber", "name": "Erin Wilhelmi"}, {"character": "Beefy Businessman", "name": "Remy Auberjonois"}, {"character": "Mike the Orderly", "name": "Peter Y. Kim"}], "crew": [{"job": "Director", "name": "Craig Zisk"}, {"job": "Writer", "name": "Stacy Chariton"}, {"job": "Screenplay", "name": "Dan Chariton"}, {"job": "Producer", "name": "Naomi Despres"}, {"job": "Producer", "name": "Ben LeClair"}, {"job": "Producer", "name": "Robert Salerno"}], "title": "The English Teacher", "genres": ["Comedy", "Drama"], "keywords": ["pennsylvania", "high school", "teacher student relationship", "high school teacher", "older woman younger man relationship", "theater"], "original_language": "English", "rating": "R", "release_date": "2013-05-16", "revenue": 104810.0, "runtime": 91, "summary": "Linda Sinclair (Julianne Moore) is a forty-year-old unmarried high school English teacher in the small town of Kingston, Pennsylvania. She shares a small apartment with two Siamese cats and her rich collection of great literature. She maintains no close personal relationships aside from those she has with her favorite authors and stories. Her life is far less complicated than the dramas she devours on the page, and she likes it that way. But Linda's simple life turns an unexpected page when former star pupil Jason Sherwood (Michael Angarano) returns to Kingston after trying to make it as a playwright in New York. Now in his 20s, Jason is on the verge of abandoning art, pressured by his overbearing father, Dr. Tom Sherwood (Greg Kinnear), to face reality and go to law school. Linda can't stand the thought of Jason giving up on his dreams so she decides to mount his play - a dark, angst-ridden, ambitious work - as a Kingston High School production, with flamboyant drama teacher Carl ...", "tokens": ["linda", "sinclair", "juliann", "moor", "forti", "year", "old", "unmarri", "high", "school", "english", "teacher", "small", "town", "kingston", "pennsylvania", "she", "share", "small", "apart", "two", "siames", "cat", "rich", "collect", "great", "literatur", "she", "maintain", "close", "person", "relationship", "asid", "favorit", "author", "stori", "her", "life", "far", "less", "complic", "drama", "devour", "page", "like", "wai", "but", "linda", "simpl", "life", "turn", "unexpect", "page", "former", "star", "pupil", "jason", "sherwood", "michael", "angarano", "return", "kingston", "try", "make", "playwright", "new", "york", "now", "20", "jason", "verg", "abandon", "art", "pressur", "overbear", "father", "dr", "tom", "sherwood", "greg", "kinnear", "face", "realiti", "go", "law", "school", "linda", "stand", "thought", "jason", "give", "dream", "decid", "mount", "plai", "dark", "angst", "ridden", "ambiti", "work", "kingston", "high", "school", "product", "flamboy", "drama", "teacher", "carl"], "tmdb_score_value": 5.7, "tmdb_score_count": 151, "imdb_score_value": 5.8, "imdb_score_count": 10476, "meta_score_value": 42.0, "meta_score_count": 13}