{"id": "tt2040504", "cast": [{"character": "Shirin", "name": "Nazanin Boniadi"}, {"character": "William", "name": "Riley Smith"}, {"character": "Mike", "name": "Maz Jobrani"}, {"character": "Nader", "name": "Marshall Manesh"}, {"character": "Rachel", "name": "Amy Madigan"}, {"character": "Officer Washington", "name": "George Wallace"}, {"character": "Ed", "name": "Max Amini"}, {"character": "Rick", "name": "Steven Schub"}, {"character": "Ben", "name": "Sam Golzari"}], "crew": [{"job": "Director", "name": "Ramin Niami"}, {"job": "Screenplay", "name": "Ramin Niami"}], "title": "Shirin in Love", "genres": ["Comedy", "Romance"], "keywords": [], "original_language": "English", "rating": "TV-14", "release_date": "2014-03-14", "revenue": 0.0, "runtime": 104, "summary": "Love has no borders and therein lies the premise of the charming, new Iranian-American romantic comedy \"Shirin in Love.\" Nazanin Boniadi plays Shirin, an absent-minded, young Iranian-American living in \"Tehrangeles\" (the large Iranian community in Los Angeles) with her overbearing mother and empathetic father. Despite being engaged for years to a successful Iranian plastic surgeon in Beverly Hills, Shirin finds herself breaking loyalty and tradition when she falls in love with a mysterious young man who lives in a lighthouse in northern California. As her secret unravels and cultures clash, Shirin discovers what it ultimately means to be true to herself.", "tokens": ["love", "border", "therein", "li", "premis", "charm", "new", "iranian", "american", "romant", "comedi", "shirin", "love", "nazanin", "boniadi", "plai", "shirin", "absent", "mind", "young", "iranian", "american", "live", "tehrangel", "larg", "iranian", "commun", "lo", "angel", "overbear", "mother", "empathet", "father", "despit", "engag", "year", "success", "iranian", "plastic", "surgeon", "beverli", "hill", "shirin", "find", "break", "loyalti", "tradit", "fall", "love", "mysteri", "young", "man", "live", "lighthous", "northern", "california", "as", "secret", "unravel", "cultur", "clash", "shirin", "discov", "ultim", "mean", "true"], "tmdb_score_value": 4.0, "tmdb_score_count": 2, "imdb_score_value": 5.1, "imdb_score_count": 517, "meta_score_value": 29.0, "meta_score_count": 9}