{"id": "tt2124074", "cast": [{"character": "Man", "name": "Chris Messina"}, {"character": "Woman", "name": "Marin Ireland"}], "crew": [{"job": "Director", "name": "Matt Ross"}, {"job": "Writer", "name": "Matt Ross"}], "title": "28 Hotel Rooms", "genres": ["Drama", "Romance"], "keywords": ["sex", "marital infidelity", "enduring friendship"], "original_language": "English", "rating": "NOT RATED", "release_date": "2012-01-21", "revenue": 0.0, "runtime": 82, "summary": "Spanning several years involving two persons, a young man (Chris Messina) and a young woman (Marin Ireland), who have a one night stand in a hotel room. Despite going their different paths, the man, a struggling writer, and the woman, an accountant, meet over the next several years in various different hotel rooms across the USA while they travel on business. Despite they are both involved with different people, they find their romantic tryst a getaway from their everyday lives. But as they both mature and grow apart, will they ever learn that they may be soul mates really meant for each other and their secret rendezvous for sex is something more?", "tokens": ["span", "sever", "year", "involv", "two", "person", "young", "man", "chri", "messina", "young", "woman", "marin", "ireland", "on", "night", "stand", "hotel", "room", "despit", "go", "differ", "path", "man", "struggl", "writer", "woman", "account", "meet", "next", "sever", "year", "variou", "differ", "hotel", "room", "across", "usa", "travel", "busi", "despit", "involv", "differ", "peopl", "find", "romant", "tryst", "getawai", "everydai", "live", "but", "matur", "grow", "apart", "ever", "learn", "mai", "soul", "mate", "realli", "meant", "secret", "rendezv", "sex", "someth"], "tmdb_score_value": 6.0, "tmdb_score_count": 26, "imdb_score_value": 5.8, "imdb_score_count": 2619, "meta_score_value": 50.0, "meta_score_count": 10}