{"id": "tt2287170", "cast": [{"character": "Aki", "name": "Ayako Fujitani"}, {"character": "Paul Del Moral", "name": "Pepe Serna"}, {"character": "Akira", "name": "Kazuki Kitamura"}, {"character": "Hitoshi", "name": "Hiroshi Watanabe"}, {"character": "Shinsuke", "name": "Tetsuo Kuramochi"}, {"character": "Teresa Del Moral", "name": "Elisha Skorman"}, {"character": "Tatsuji", "name": "Masami Kosaka"}, {"character": "Kageyama", "name": "Rome Kanda"}], "crew": [{"job": "Director", "name": "Dave Boyle"}, {"job": "Writer", "name": "Dave Boyle"}, {"job": "Writer", "name": "Joel Clark"}, {"job": "Writer", "name": "Michael Lerman"}, {"job": "Producer", "name": "Ko Mori"}], "title": "Man from Reno", "genres": ["Mystery", "Drama", "Crime", "Thriller"], "keywords": ["san francisco", "japanese", "extramarital affair", "neo-noir"], "original_language": "English", "rating": "NOT RATED", "release_date": "2015-03-27", "revenue": 0.0, "runtime": 111, "summary": "In a small town south of San Francisco, Sheriff Paul Del Moral (Pepe Serna) is driving home through the fog when he accidentally strikes a pedestrian, a lone Japanese man. However, before an investigation can take place the man disappears from the hospital without a trace. At the same time, Japanese mystery author Aki Akahori (Ayako Fujitani) takes a trip to San Francisco in order to escape the press tour for her latest book--a potboiler in her world famous \"Inspector Takabe\" series. Feeling lonely and vulnerable, she begins a romantic affair with a mysterious Japanese traveler from Reno (Kazuki Kitamura). Her new lover is charismatic and charming but abruptly disappears from the hotel, leaving behind his suitcase and a trail of questions...", "tokens": ["in", "small", "town", "south", "san", "francisco", "sheriff", "paul", "del", "moral", "pepe", "serna", "drive", "home", "fog", "accident", "strike", "pedestrian", "lone", "japanes", "man", "howev", "investig", "take", "place", "man", "disappear", "hospit", "without", "trace", "at", "time", "japanes", "mysteri", "author", "aki", "akahori", "ayako", "fujitani", "take", "trip", "san", "francisco", "order", "escap", "press", "tour", "latest", "book", "potboil", "world", "famou", "inspector", "takab", "seri", "feel", "lone", "vulner", "begin", "romant", "affair", "mysteri", "japanes", "travel", "reno", "kazuki", "kitamura", "her", "new", "lover", "charismat", "charm", "abruptli", "disappear", "hotel", "leav", "behind", "suitcas", "trail", "question"], "tmdb_score_value": 6.1, "tmdb_score_count": 18, "imdb_score_value": 6.8, "imdb_score_count": 1559, "meta_score_value": 69.0, "meta_score_count": 12}