{"id": "tt2373324", "cast": [{"character": "Narrator (Voice)", "name": "Fionnula Flanagan"}, {"character": "Himself", "name": "Peter Quinn"}, {"character": "Himself", "name": "Jim Rasenberger"}, {"character": "Self", "name": "Padraig O Flannabhra"}, {"character": "Himself", "name": "Ric Burns"}, {"character": "Self", "name": "Una Ni Bhroimeil"}, {"character": "Himself", "name": "Joe Woolhead"}], "crew": [{"job": "Director", "name": "Se\u00e1n \u00d3 Cual\u00e1in"}, {"job": "Producer", "name": "Eamonn \u00d3 Cual\u00e1in"}, {"job": "Screenplay", "name": "Niall Murphy"}], "title": "Men at Lunch", "genres": ["Documentary"], "keywords": ["skyscraper", "photography"], "original_language": "English", "rating": "NOT RATED", "release_date": "2013-02-01", "revenue": 0.0, "runtime": 65, "summary": "New York City, 1932. The country is in the throes of the Great Depression, the previous decade's boom of Italian, Irish, and Jewish immigrants has led to unprecedented urban expansion, and in the midst of an unseasonably warm autumn, steelworkers risk life and limb building skyscrapers high above the streets of Manhattan. In Men at Lunch, director Se\u00e1n \u00d3 Cual\u00e1in tells the story of \"Lunch atop a Skyscraper,\" the iconic photograph taken during the construction of 30 Rockefeller Plaza that depicts eleven workmen taking their lunch break while casually perched along a steel girder - boots dangling 850 feet above the sidewalk, Central Park and the misty Manhattan skyline stretching out behind them. For 80 years, the identity of the eleven men - and the photographer that Immortalized them - remained a mystery: their stories, lost in time, subsumed by the fame of the image itself. But then, at the start of the 21st century, the photograph finally began to give up some of its secrets. Part ...", "tokens": ["new", "york", "citi", "1932", "the", "countri", "throe", "great", "depress", "previou", "decad", "boom", "italian", "irish", "jewish", "immigr", "led", "unpreced", "urban", "expans", "midst", "unseason", "warm", "autumn", "steelwork", "risk", "life", "limb", "build", "skyscrap", "high", "street", "manhattan", "in", "men", "lunch", "director", "se\u00e1n", "\u00f3", "cual\u00e1in", "tell", "stori", "lunch", "atop", "skyscrap", "icon", "photograph", "taken", "construct", "30", "rockefel", "plaza", "depict", "eleven", "workmen", "take", "lunch", "break", "casual", "perch", "along", "steel", "girder", "boot", "dangl", "850", "feet", "sidewalk", "central", "park", "misti", "manhattan", "skylin", "stretch", "behind", "for", "80", "year", "ident", "eleven", "men", "photograph", "immort", "remain", "mysteri", "stori", "lost", "time", "subsum", "fame", "imag", "but", "start", "21st", "centuri", "photograph", "final", "began", "give", "secret", "part"], "tmdb_score_value": 8.0, "tmdb_score_count": 1, "imdb_score_value": 6.3, "imdb_score_count": 308, "meta_score_value": 53.0, "meta_score_count": 6}