{"id": "tt2371834", "cast": [{"character": "Melanie", "name": "Melanie Lenz"}, {"character": "Arzt", "name": "Joseph Lorenz"}, {"character": "Verena", "name": "Verena Lehbauer"}, {"character": "Sporttrainer", "name": "Michael Thomas"}, {"character": "Ern\u00e4hrungsberaterin", "name": "Vivian Bartsch"}, {"character": "Hanni", "name": "Johanna Schmid"}, {"character": "Tante Melanie", "name": "Maria Hofst\u00e4tter"}], "crew": [{"job": "Director", "name": "Ulrich Seidl"}, {"job": "Screenplay", "name": "Ulrich Seidl"}, {"job": "Screenplay", "name": "Veronika Franz"}], "title": "Paradise: Hope", "genres": ["Drama"], "keywords": ["overweight", "nightclub", "seduction", "diet", "crush", "camp", "doctor", "teenager", "trilogy", "desire", "nutrition"], "original_language": "German", "rating": "UNRATED", "release_date": "2013-02-08", "revenue": 6701.0, "runtime": 92, "summary": "The final installment in Ulrich Seidl's Paradise trilogy, 'Paradise: Hope' tells the story of overweight thirteen-year-old Melanie and her first love. While her mother travels to Kenya ('Paradise: Love') and her aunt does missionary work ('Paradise: Faith'), Melanie spends her summer vacation at a strict diet camp for overweight adolescents. Between physical education and nutrition counseling, pillow fights and her first cigarette, Melanie falls in love with the camp director, a doctor forty years her senior. As the doctor struggles with the guilty nature of his desire, Melanie had imagined her paradise differently.", "tokens": ["the", "final", "instal", "ulrich", "seidl", "paradis", "trilogi", "paradis", "hope", "tell", "stori", "overweight", "thirteen", "year", "old", "melani", "first", "love", "while", "mother", "travel", "kenya", "paradis", "love", "aunt", "missionari", "work", "paradis", "faith", "melani", "spend", "summer", "vacat", "strict", "diet", "camp", "overweight", "adolesc", "between", "physic", "educ", "nutrit", "counsel", "pillow", "fight", "first", "cigarett", "melani", "fall", "love", "camp", "director", "doctor", "forti", "year", "senior", "as", "doctor", "struggl", "guilti", "natur", "desir", "melani", "imagin", "paradis", "differ"], "tmdb_score_value": 6.1, "tmdb_score_count": 40, "imdb_score_value": 6.7, "imdb_score_count": 3485, "meta_score_value": 78.0, "meta_score_count": 16}