{"id": "tt2349460", "cast": [{"character": "Gracie Trey", "name": "AJ Michalka"}, {"character": "Johnny Trey", "name": "James Denton"}, {"character": "Frank \"Mossy\" Mostin", "name": "Kevin Pollak"}, {"character": "Michelle Trey", "name": "Shawnee Smith"}, {"character": "Quentin", "name": "Michael Welch"}, {"character": "Rachel", "name": "Jamie Grace"}, {"character": "Kendra Burroughs", "name": "Emma Catherwood"}, {"character": "Jay Grayson", "name": "Zane Holtz"}], "crew": [{"job": "Director", "name": "Brad J. Silverman"}, {"job": "Writer", "name": "Brad J. Silverman"}], "title": "Grace Unplugged", "genres": ["Drama", "Music"], "keywords": ["christian"], "original_language": "English", "rating": "PG", "release_date": "2013-10-04", "revenue": 0.0, "runtime": 102, "summary": "Grace Unplugged is an Inspirational movie starring Amanda \"AJ\" Michalka as 18 year old Christian singer/songwriter, Grace Rose Trey. Beautiful, highly talented and restless, Grace is so far undiscovered outside church. She performs there each Sunday with her gifted father Johnny, the praise music director at Freedom Community Chapel, a small town Alabama church. A former rock star, Johnny Trey charted a Billboard number one single 20 years before. When the hits stopped coming he crash landed hard, a one hit wonder. Johnny found Christ and a new life for his family, far from the Hollywood Hills. One day without warning, Grace leaves for Los Angeles. She has landed a record deal with the help of Johnny's ruthless former manager and producer Frank \"Mossy\" Mostin. Mossy sees in Grace a potential pop superstar - the next Katy Perry. Cutting off contact with her parents, Grace seems prepared to walk away from her Christian faith and music to achieve her long-suppressed fantasy of Hollywood ...", "tokens": ["grace", "unplug", "inspir", "movi", "star", "amanda", "aj", "michalka", "18", "year", "old", "christian", "singer/songwrit", "grace", "rose", "trei", "beauti", "highli", "talent", "restless", "grace", "far", "undiscov", "outsid", "church", "she", "perform", "sundai", "gift", "father", "johnni", "prais", "music", "director", "freedom", "commun", "chapel", "small", "town", "alabama", "church", "a", "former", "rock", "star", "johnni", "trei", "chart", "billboard", "number", "on", "singl", "20", "year", "when", "hit", "stop", "come", "crash", "land", "hard", "on", "hit", "wonder", "johnni", "found", "christ", "new", "life", "famili", "far", "hollywood", "hill", "on", "dai", "without", "warn", "grace", "leav", "lo", "angel", "she", "land", "record", "deal", "help", "johnni", "ruthless", "former", "manag", "produc", "frank", "mossi", "mostin", "mossi", "see", "grace", "potenti", "pop", "superstar", "next", "kati", "perri", "cut", "contact", "parent", "grace", "seem", "prepar", "walk", "awai", "christian", "faith", "music", "achiev", "long", "suppress", "fantasi", "hollywood", "superstardom", "will", "experi", "caus", "reject", "faith", "rediscov"], "tmdb_score_value": 5.9, "tmdb_score_count": 30, "imdb_score_value": 6.2, "imdb_score_count": 2824, "meta_score_value": 39.0, "meta_score_count": 5}