{"id": "tt2313398", "cast": [{"character": "Molly", "name": "Sophia Takal"}, {"character": "Sylvie", "name": "Rebecca Schull"}, {"character": "Boris", "name": "Adam LeFevre"}, {"character": "Ruby", "name": "Daisy Tahan"}], "crew": [{"job": "Director", "name": "Jeff Lipsky"}, {"job": "Writer", "name": "Jeff Lipsky"}], "title": "Molly's Theory of Relativity", "genres": ["Drama", "Family"], "keywords": ["halloween"], "original_language": "English", "rating": "NOT RATED", "release_date": "2013-03-01", "revenue": 0.0, "runtime": 102, "summary": "'Molly's Theory of Relativity' depicts a day in the life of a beautiful twenty eight year old astronomer poised to make the first reckless decision of her life. Her story takes place on Halloween. Aiding her on her day of reckoning are her husband, her father-in-law, three deceased relatives, a precocious, trick-or-treating nine year old girl, her grandfather from Minot, North Dakota, and an eight year old neighbor who may or may not be imaginary. 'Molly's Theory of Relativity' is about the economy, how we value and measure the pride we take in what we choose to do for a living, the unbreakable bonds of family, and the notion that death is merely a relative thing.", "tokens": ["molli", "theori", "rel", "depict", "dai", "life", "beauti", "twenti", "eight", "year", "old", "astronom", "pois", "make", "first", "reckless", "decis", "life", "her", "stori", "take", "place", "halloween", "aid", "dai", "reckon", "husband", "father", "law", "three", "deceas", "rel", "precoci", "trick", "treat", "nine", "year", "old", "girl", "grandfath", "minot", "north", "dakota", "eight", "year", "old", "neighbor", "mai", "mai", "imaginari", "molli", "theori", "rel", "economi", "valu", "measur", "pride", "take", "choos", "live", "unbreak", "bond", "famili", "notion", "death", "mere", "rel", "thing"], "tmdb_score_value": 0.0, "tmdb_score_count": 0, "imdb_score_value": 5.0, "imdb_score_count": 44, "meta_score_value": 40.0, "meta_score_count": 7}