{"id": "tt2343158", "cast": [{"character": "Vanetia", "name": "Maxine Peake"}, {"character": "Ted", "name": "Will Forte"}, {"character": "Conor", "name": "Edward MacLiam"}, {"character": "Tara", "name": "Sharon Horgan"}, {"character": "Lenny", "name": "Brendan Morris"}, {"character": "Noni", "name": "Ciara Gallagher"}, {"character": "Nora", "name": "Ruth McCabe"}, {"character": "Simon", "name": "Ri Galway"}, {"character": "Fergus", "name": "Kelby Guilfoyle"}, {"character": "Old Man", "name": "Joseph Kelly"}, {"character": "Coach Gary", "name": "Tim Landers"}], "crew": [{"job": "Director", "name": "Steph Green"}, {"job": "Writer", "name": "Ailbhe Keogan"}, {"job": "Original Music Composer", "name": "Sebastian Pille"}], "title": "Run & Jump", "genres": ["Drama"], "keywords": ["wife", "irish", "stroke", "woman director", "recovery"], "original_language": "English", "rating": "UNRATED", "release_date": "2014-01-24", "revenue": 0.0, "runtime": 102, "summary": "Vanetia Casey (Maxine Peake), the spirited and impossibly optimistic center of the Casey family, is working hard to get life back to normal after her 38 year-old husband, Conor (Edward MacLiam), suffers a rare stroke which changes his personality. Tweedy American doctor, Ted Fielding, (Will Forte) arrives in Ireland to stay with them for two months: his research grant providing the Caseys with essential financial aid. Vanetia's a dynamo. But with two young kids and both men in the house, she's feeling bombarded and initially treats Ted and his study of Conor with resistance. Only when she observes Ted's calming influence on the family does she begin to value his friendship, and, in return, Ted enjoys their heady, happy-go-lucky world. But Ted's continued presence in the house sets the family on course for an emotional collision. Directed by Academy Award\u00ae-nominee Steph Green and featuring Saturday Night Live star Will Forte in an impressive dramatic debut, this life-affirming film ...", "tokens": ["vanetia", "casei", "maxin", "peak", "spirit", "imposs", "optimist", "center", "casei", "famili", "work", "hard", "get", "life", "back", "normal", "38", "year", "old", "husband", "conor", "edward", "macliam", "suffer", "rare", "stroke", "chang", "person", "tweedi", "american", "doctor", "ted", "field", "will", "fort", "arriv", "ireland", "stai", "two", "month", "research", "grant", "provid", "casei", "essenti", "financi", "aid", "vanetia", "dynamo", "but", "two", "young", "kid", "men", "hous", "feel", "bombard", "initi", "treat", "ted", "studi", "conor", "resist", "onli", "observ", "ted", "calm", "influenc", "famili", "begin", "valu", "friendship", "return", "ted", "enjoi", "headi", "happi", "go", "lucki", "world", "but", "ted", "continu", "presenc", "hous", "set", "famili", "cours", "emot", "collis", "direct", "academi", "award\u00ae", "nomine", "steph", "green", "featur", "saturdai", "night", "live", "star", "will", "fort", "impress", "dramat", "debut", "life", "affirm", "film"], "tmdb_score_value": 6.7, "tmdb_score_count": 13, "imdb_score_value": 6.3, "imdb_score_count": 1166, "meta_score_value": 71.0, "meta_score_count": 16}