{"id": "tt2304426", "cast": [{"character": "Arbor", "name": "Conner Chapman"}, {"character": "Swifty", "name": "Shaun Thomas"}, {"character": "Kitten", "name": "Sean Gilder"}, {"character": "Mary", "name": "Lorraine Ashbourne"}, {"character": "Mick Brazil", "name": "Ian Burfield"}, {"character": "Price Drop Swift", "name": "Steve Evets"}, {"character": "Mrs. Swift", "name": "Siobhan Finneran"}, {"character": "Johnny Jones", "name": "Ralph Ineson"}, {"character": "Michelle 'Shelly' Fenton", "name": "Rebecca Manley"}, {"character": "Daniel", "name": "Rhys McCoy"}, {"character": "Martin Fenton", "name": "Elliott Tittensor"}], "crew": [{"job": "Director", "name": "Clio Barnard"}, {"job": "Writer", "name": "Clio Barnard"}, {"job": "Original Music Composer", "name": "Harry Escott"}, {"job": "Producer", "name": "Tracy O'Riordan"}], "title": "The Selfish Giant", "genres": ["Drama"], "keywords": ["horse", "woman director"], "original_language": "English", "rating": "NOT RATED", "release_date": "2013-05-16", "revenue": 0.0, "runtime": 91, "summary": "An official selection at the Cannes Film Festival, The Selfish Giant is a contemporary fable about 13 year old Arbor (Conner Chapman) and his best friend Swifty (Shaun Thomas). Excluded from school and outsiders in their own neighborhood, the two boys meet Kitten (Sean Gilder), a local scrap dealer. Wandering their town with just a horse and a cart, they begin collecting scrap metal for him. Swifty has a natural gift with horses while Arbor emulates Kitten - keen to impress him and make some money. However, Kitten favors Swifty, leaving Arbor feeling hurt and excluded, driving a wedge between the boys. As Arbor becomes increasingly greedy and exploitative, tensions build, leading to a tragic event that transforms them all.", "tokens": ["an", "offici", "select", "cann", "film", "festiv", "the", "selfish", "giant", "contemporari", "fabl", "13", "year", "old", "arbor", "conner", "chapman", "best", "friend", "swifti", "shaun", "thoma", "exclud", "school", "outsid", "neighborhood", "two", "boi", "meet", "kitten", "sean", "gilder", "local", "scrap", "dealer", "wander", "town", "hors", "cart", "begin", "collect", "scrap", "metal", "swifti", "natur", "gift", "hors", "arbor", "emul", "kitten", "keen", "impress", "make", "monei", "howev", "kitten", "favor", "swifti", "leav", "arbor", "feel", "hurt", "exclud", "drive", "wedg", "boi", "as", "arbor", "becom", "increasingli", "greedi", "exploit", "tension", "build", "lead", "tragic", "event", "transform"], "tmdb_score_value": 7.2, "tmdb_score_count": 98, "imdb_score_value": 7.3, "imdb_score_count": 10064, "meta_score_value": 83.0, "meta_score_count": 22}