{"id": "tt2451742", "cast": [{"character": "Herself", "name": "Mariel Hemingway"}, {"character": "Herself", "name": "Dree Hemingway"}, {"character": "Herself (archive footage)", "name": "Margaux Hemingway"}, {"character": "Herself", "name": "Langley Hemingway"}], "crew": [{"job": "Director", "name": "Barbara Kopple"}], "title": "Running from Crazy", "genres": ["Documentary"], "keywords": ["suicide", "depression", "woman director", "bipolar", "ernest hemingway", "bipolar disorder"], "original_language": "English", "rating": "NOT RATED", "release_date": "2013-01-20", "revenue": 0.0, "runtime": 105, "summary": "'Running from Crazy' is a documentary examining the personal journey of model and actress Mariel Hemingway, the great granddaughter of Ernest Hemingway, as she strives for a greater understanding of her family history of suicide and mental illness. Through stunning archival footage of the three Hemingway sisters and intimate verite moments with Mariel herself, the film examines the remarkable though often heartbreaking Hemingway legacy. As Mariel comes to terms with the tragedies of her family's past that have shaped the course of her life, deeply hidden secrets are revealed and truths emerge. Through it all, Mariel finds a way to overcome a similar fate for herself and her daughters, brings awareness to an issue she's deeply passionate about, and discovers an inner strength and peace.", "tokens": ["run", "crazi", "documentari", "examin", "person", "journei", "model", "actress", "mariel", "hemingwai", "great", "granddaught", "ernest", "hemingwai", "strive", "greater", "understand", "famili", "histori", "suicid", "mental", "ill", "through", "stun", "archiv", "footag", "three", "hemingwai", "sister", "intim", "verit", "moment", "mariel", "film", "examin", "remark", "though", "often", "heartbreak", "hemingwai", "legaci", "as", "mariel", "come", "term", "tragedi", "famili", "past", "shape", "cours", "life", "deepli", "hidden", "secret", "reveal", "truth", "emerg", "through", "mariel", "find", "wai", "overcom", "similar", "fate", "daughter", "bring", "awar", "issu", "deepli", "passion", "discov", "inner", "strength", "peac"], "tmdb_score_value": 5.4, "tmdb_score_count": 5, "imdb_score_value": 6.5, "imdb_score_count": 263, "meta_score_value": 59.0, "meta_score_count": 14}