{"id": "tt2662710", "cast": [{"character": "Gigante Bernard", "name": "Matt Bloom"}, {"character": "Himself", "name": "Blue Demon Jr."}, {"character": "Himself", "name": "Perro Aguayo Jr."}, {"character": "Jon Strongman", "name": "Jon Andersen Reel"}, {"character": "Shocker", "name": "Shocker"}, {"character": "Sexy Star", "name": "Dulce Garc\u00eda"}], "crew": [{"job": "Director", "name": "Alex Hammond"}, {"job": "Writer", "name": "Alex Hammond"}, {"job": "Director", "name": "Ian Markiewicz"}, {"job": "Writer", "name": "Ian Markiewicz"}], "title": "Lucha Mexico", "genres": ["Documentary"], "keywords": ["wrestling", "woman director"], "original_language": "English", "rating": "NOT RATED", "release_date": "2016-07-15", "revenue": 0.0, "runtime": 105, "summary": "The high-flying documentary Lucha Mexico is a journey into the vibrant world of Lucha Libre, where masked warriors fight mythological battles in the squared circle. With access to all the major Lucha promotions, directors Alex Hammond and Ian Markiewicz take you deep inside the Mexican wrestling culture, documenting its rich traditions and passionate style. At the heart of the film is second-generation luchador Shocker, the self-proclaimed \"1000% Guapo\" superstar who suffers a serious injury and faces the reality of life without wrestling. Featuring a cast of fan favorites such as legendary Blue Demon, Jr. the tragic Hijo Del Perro Aguayo and lovable mascot Kemonito, Lucha Mexico is a hard-hitting spectacle of high spots and low blows, and goes behind the mask into the heart of Mexico.", "tokens": ["the", "high", "fly", "documentari", "lucha", "mexico", "journei", "vibrant", "world", "lucha", "libr", "mask", "warrior", "fight", "mytholog", "battl", "squar", "circl", "with", "access", "major", "lucha", "promot", "director", "alex", "hammond", "ian", "markiewicz", "take", "deep", "insid", "mexican", "wrestl", "cultur", "document", "rich", "tradit", "passion", "style", "at", "heart", "film", "second", "gener", "luchador", "shocker", "self", "proclaim", "1000%", "guapo", "superstar", "suffer", "seriou", "injuri", "face", "realiti", "life", "without", "wrestl", "featur", "cast", "fan", "favorit", "legendari", "blue", "demon", "jr", "tragic", "hijo", "del", "perro", "aguayo", "lovabl", "mascot", "kemonito", "lucha", "mexico", "hard", "hit", "spectacl", "high", "spot", "low", "blow", "goe", "behind", "mask", "heart", "mexico"], "tmdb_score_value": 7.0, "tmdb_score_count": 2, "imdb_score_value": 6.9, "imdb_score_count": 164, "meta_score_value": 56.0, "meta_score_count": 7}