{"id": "tt2606924", "cast": [{"character": "Himself", "name": "Lenny Cooke"}], "crew": [{"job": "Director", "name": "Benny Safdie"}, {"job": "Director", "name": "Josh Safdie"}], "title": "Lenny Cooke", "genres": ["Documentary"], "keywords": [], "original_language": "English", "rating": "NOT RATED", "release_date": "2013-12-06", "revenue": 0.0, "runtime": 88, "summary": "Professional sports is known as a true meritocracy, a field in which the cream really does rise to the top, as there's simply too much money at stake to operate in any other fashion. In uncommon instances, however, inefficiencies can occur and gifted players may fall through the cracks. Such is the story of Lenny Cooke. In 2001, Cooke was the number-one ranked high school basketball player in America, with future NBA greats LeBron James and Carmelo Anthony listed beneath him. Yet after declaring himself eligible for the 2002 NBA draft, Cooke, shockingly, ended up going undrafted, and became a journeyman playing in little-known leagues across the world. Today he lives in southern Virginia, a should-have-been-great who simply did not quite make it. The first documentary feature from American independent film scene fixtures Josh &amp; Benny Safdie (Daddy Longlegs, The Pleasure of Being Robbed), LENNY COOKE explores the fascinating question of how, exactly, Cooke's seemingly assured future ...", "tokens": ["profession", "sport", "known", "true", "meritocraci", "field", "cream", "realli", "rise", "top", "simpli", "much", "monei", "stake", "oper", "fashion", "in", "uncommon", "instanc", "howev", "ineffici", "occur", "gift", "player", "mai", "fall", "crack", "such", "stori", "lenni", "cook", "in", "2001", "cook", "number", "on", "rank", "high", "school", "basketbal", "player", "america", "futur", "nba", "great", "lebron", "jame", "carmelo", "anthoni", "list", "beneath", "yet", "declar", "elig", "2002", "nba", "draft", "cook", "shockingli", "end", "go", "undraft", "becam", "journeyman", "plai", "littl", "known", "leagu", "across", "world", "todai", "live", "southern", "virginia", "great", "simpli", "quit", "make", "the", "first", "documentari", "featur", "american", "independ", "film", "scene", "fixtur", "josh", "&amp", "benni", "safdi", "daddi", "longleg", "the", "pleasur", "be", "rob", "lenni", "cook", "explor", "fascin", "question", "exactli", "cook", "seemingli", "assur", "futur"], "tmdb_score_value": 7.2, "tmdb_score_count": 6, "imdb_score_value": 6.5, "imdb_score_count": 313, "meta_score_value": 70.0, "meta_score_count": 14}