{"id": "tt2739338", "cast": [{"character": "David Richmond", "name": "Hans Matheson"}, {"character": "Emily Barstow", "name": "Samantha Barks"}, {"character": "Bea Haddington", "name": "Lesley Manville"}, {"character": "Edward Haddington", "name": "Sylvester McCoy"}, {"character": "Herbert Hopewell", "name": "James Cosmo"}, {"character": "Eleanor Hopewell", "name": "Susan Boyle"}, {"character": "Lady Camdon", "name": "Barbara Flynn"}, {"character": "William Barstow", "name": "John Hannah"}, {"character": "Charlie", "name": "Jude Wright"}, {"character": "Orphan Sarah", "name": "Emily Shewell"}], "crew": [{"job": "Writer", "name": "Candace Lee"}, {"job": "Writer", "name": "Eric Newman"}, {"job": "Producer", "name": "Hannah Leader"}, {"job": "Producer", "name": "Tom Newman"}, {"job": "Director", "name": "John Stephenson"}], "title": "The Christmas Candle", "genres": ["Drama", "Family"], "keywords": ["angel", "miracle", "village", "christian", "candle", "christmas"], "original_language": "English", "rating": "PG", "release_date": "2013-11-22", "revenue": 0.0, "runtime": 100, "summary": "Deep in the heart of the English countryside lies the enchanting village of Gladbury. Legend has it every twenty-five years an angel visits the village candlemaker and touches a single candle. Whoever lights this candle and prays before it receives a miracle on Christmas Eve, but in 1890, at the dawn of the electric age, this centuries old legend may come to an end. When David Richmond, a progressive young minister, arrives in Gladbury, the villagers discover a new formula for miracles: good deeds and acts of kindness. While David's quest to modernize Gladbury sets him at odds with the old world candlemaker, he finds an unlikely ally in the lovely skeptic, Emily Barstow. Now, the fiery candlemaker must fight to preserve the legacy of the Christmas Candle, but when the blessed candle goes missing, the miraculous and human collide in the most astonishing Christmas the village of Gladbury has ever seen.", "tokens": ["deep", "heart", "english", "countrysid", "li", "enchant", "villag", "gladburi", "legend", "everi", "twenti", "five", "year", "angel", "visit", "villag", "candlemak", "touch", "singl", "candl", "whoever", "light", "candl", "prai", "receiv", "miracl", "christma", "ev", "1890", "dawn", "electr", "ag", "centuri", "old", "legend", "mai", "come", "end", "when", "david", "richmond", "progress", "young", "minist", "arriv", "gladburi", "villag", "discov", "new", "formula", "miracl", "good", "deed", "act", "kind", "while", "david", "quest", "modern", "gladburi", "set", "odd", "old", "world", "candlemak", "find", "unlik", "alli", "love", "skeptic", "emili", "barstow", "now", "fieri", "candlemak", "must", "fight", "preserv", "legaci", "christma", "candl", "bless", "candl", "goe", "miss", "miracul", "human", "collid", "astonish", "christma", "villag", "gladburi", "ever", "seen"], "tmdb_score_value": 5.7, "tmdb_score_count": 13, "imdb_score_value": 6.2, "imdb_score_count": 1334, "meta_score_value": 33.0, "meta_score_count": 13}