{"id": "tt2776878", "cast": [{"character": "Adam Schumann", "name": "Miles Teller"}, {"character": "Saskia Schumann", "name": "Haley Bennett"}, {"character": "Billy Waller", "name": "Joe Cole"}, {"character": "Amanda Doster", "name": "Amy Schumer"}, {"character": "Tausolo \"Solo\" Aieti", "name": "Beulah Koale"}, {"character": "Michael Adam Emory", "name": "Scott Haze"}, {"character": "Alea", "name": "Keisha Castle-Hughes"}, {"character": "Sergeant James D. Doster", "name": "Brad Beyer"}, {"character": "Dante", "name": "Omar J. Dorsey"}, {"character": "Bell", "name": "Kate Lyn Sheil"}, {"character": "Jake Schumann", "name": "Hunter Burke"}, {"character": "Tracey", "name": "Erin Darke"}, {"character": "Linda Sanders", "name": "Allison King"}, {"character": "Jay", "name": "Dennis L.A. White"}, {"character": "Patty Walker", "name": "Deneen Tyler"}, {"character": "Receptionist at a Veterans Affairs Office", "name": "Jayson Warner Smith"}, {"character": "Private Chris Kyle Jr.", "name": "Sean P McGoldrick"}, {"character": "Will's Mom", "name": "Kerry Cahill"}], "crew": [{"job": "Director", "name": "Jason Hall"}, {"job": "Screenplay", "name": "Jason Hall"}, {"job": "Producer", "name": "Jon Kilik"}], "title": "Thank You for Your Service", "genres": ["Drama", "War"], "keywords": ["post traumatic stress  disorder", "based on novel", "biography", "soldier", "military", "ptsd", "war psychology"], "original_language": "English", "rating": "R", "release_date": "2017-10-26", "revenue": 9438370.0, "runtime": 109, "summary": "DreamWorks Pictures' Thank You for Your Service follows a group of U.S. soldiers returning from Iraq who struggle to integrate back into family and civilian life, while living with the memory of a war that threatens to destroy them long after they've left the battlefield. Starring an ensemble cast led by Miles Teller, Haley Bennett, Joe Cole, Amy Schumer, Beulah Koale, Scott Haze, Keisha Castle-Hughes, Brad Beyer, Omar J. Dorsey and Jayson Warner Smith, the drama is based on the bestselling book by Pulitzer Prize-winning reporter and author David Finkel. Jason Hall, who wrote the screenplay of American Sniper, makes his directorial debut with Thank You for Your Service and also serves as its screenwriter. Jon Kilik (The Hunger Games series, Babel) produces the film, while Ann Ruark (Biutiful) and Jane Evans (Sin City) executive produces.", "tokens": ["dreamwork", "pictur", "thank", "you", "your", "servic", "follow", "group", "u", "s", "soldier", "return", "iraq", "struggl", "integr", "back", "famili", "civilian", "life", "live", "memori", "war", "threaten", "destroi", "long", "left", "battlefield", "star", "ensembl", "cast", "led", "mile", "teller", "halei", "bennett", "joe", "cole", "ami", "schumer", "beulah", "koal", "scott", "haze", "keisha", "castl", "hugh", "brad", "beyer", "omar", "j", "dorsei", "jayson", "warner", "smith", "drama", "base", "bestsel", "book", "pulitz", "prize", "win", "report", "author", "david", "finkel", "jason", "hall", "wrote", "screenplai", "american", "sniper", "make", "directori", "debut", "thank", "you", "your", "servic", "also", "serv", "screenwrit", "jon", "kilik", "the", "hunger", "game", "seri", "babel", "produc", "film", "ann", "ruark", "biuti", "jane", "evan", "sin", "citi", "execut", "produc"], "tmdb_score_value": 6.4, "tmdb_score_count": 84, "imdb_score_value": 6.5, "imdb_score_count": 6591, "meta_score_value": 68.0, "meta_score_count": 34}