{"id": "tt3007302", "cast": [{"character": "Robbie", "name": "Michael Welch"}, {"character": "Ricky", "name": "Michelle Hendley"}, {"character": "Franchesca", "name": "Alexandra Turshen"}, {"character": "David", "name": "Michael Galante"}, {"character": "Sam", "name": "Joseph Ricci"}, {"character": "Herself", "name": "Grace Helbig"}], "crew": [{"job": "Director", "name": "Eric Schaeffer"}, {"job": "Writer", "name": "Eric Schaeffer"}, {"job": "Original Music Composer", "name": "Matthew Puckett"}], "title": "Boy Meets Girl", "genres": ["Drama", "Romance", "Comedy"], "keywords": ["transsexuality", "romance", "gay relationship", "relationship", "transsexual"], "original_language": "English", "rating": "NOT RATED", "release_date": "2015-02-06", "revenue": 0.0, "runtime": 95, "summary": "Funny and provocative, Boy Meets Girl vividly captures the giddy excitement, sexual heat, and inherent heartache of \"non-traditional\" love in a small town. Ricky (Michelle Hendley) is a 21-year-old trans girl living in Kentucky. Her only real friend, straight-laced Robby, has been her trusty, totally platonic, confidant for over 15 years. Her day job slinging lattes is merely a stepping-stone toward her goal of being a famous New York designer. She's confident, cool, and completely ready for something new - and then her world is transformed when an enchanting debutante saunters into her life. Triggering fresh feelings and experiences, this unlikely connection conjures up intense questions about identity while uncovering ghosts from Ricky's past. Indie-film veteran Eric Schaeffer (My Life's in Turnaround, If Lucy Fell) builds a compelling, compassionate world that focuses on the emotions and messy challenges of complex people navigating complicated relationships. Schaeffer creates a ...", "tokens": ["funni", "provoc", "boi", "meet", "girl", "vividli", "captur", "giddi", "excit", "sexual", "heat", "inher", "heartach", "non", "tradit", "love", "small", "town", "ricki", "michel", "hendlei", "21", "year", "old", "tran", "girl", "live", "kentucki", "her", "real", "friend", "straight", "lace", "robbi", "trusti", "total", "platon", "confid", "15", "year", "her", "dai", "job", "sling", "latt", "mere", "step", "stone", "toward", "goal", "famou", "new", "york", "design", "she", "confid", "cool", "complet", "readi", "someth", "new", "world", "transform", "enchant", "debutant", "saunter", "life", "trigger", "fresh", "feel", "experi", "unlik", "connect", "conjur", "intens", "question", "ident", "uncov", "ghost", "ricki", "past", "indi", "film", "veteran", "eric", "schaeffer", "my", "life", "turnaround", "if", "luci", "fell", "build", "compel", "compassion", "world", "focus", "emot", "messi", "challeng", "complex", "peopl", "navig", "complic", "relationship", "schaeffer", "creat"], "tmdb_score_value": 6.9, "tmdb_score_count": 47, "imdb_score_value": 7.1, "imdb_score_count": 3660, "meta_score_value": 68.0, "meta_score_count": 4}