{"id": "tt3142366", "cast": [{"character": "Ryder", "name": "Logan Miller"}, {"character": "Cindy", "name": "Robin Weigert"}, {"character": "Keith", "name": "Josh Hamilton"}, {"character": "Don", "name": "Richard Schiff"}, {"character": "Molly", "name": "Ursula Parker"}, {"character": "Ruth", "name": "Azura Skye"}, {"character": "Abbey", "name": "Ashley Gerasimovich"}, {"character": "Evelyn", "name": "Elizabeth Franz"}, {"character": "Trenton", "name": "Seth Young"}, {"character": "Terry", "name": "Amy Hostetler"}], "crew": [{"job": "Director", "name": "Matt Sobel"}, {"job": "Writer", "name": "Matt Sobel"}], "title": "Take Me to the River", "genres": ["Drama"], "keywords": ["river", "horse", "family secret", "cousin cousin relationship", "nebraska"], "original_language": "English", "rating": "NOT RATED", "release_date": "2016-03-18", "revenue": 0.0, "runtime": 90, "summary": "Ronnie Scheib of Variety says this is writer-director Matt Sobel's, first full length film. 'Take Me to the River' unfolds in an atmosphere of mystery and dread that contrasts with its surroundings' bucolic serenity. A gay Californian teenager's visit to Nebraskan relatives turns more nightmarish than he anticipated, for reasons that he never could have imagined, as clouds of displaced sexuality hover over flowing rivers, fertile fields and little girls on big horses. Told uniquely through the kid's (Ryder, played by Logan Miller) largely uncomprehending point of view, this Midwestern gothic tale maintains sufficient visual distance to suggest alternative narratives from other perspectives. This superlatively acted indie film promises more than it delivers, but chillingly evokes sufficient primal dread to intrigue all audiences. The film debuted at the Sundance festival on January 26, 2015.", "tokens": ["ronni", "scheib", "varieti", "sai", "writer", "director", "matt", "sobel", "first", "full", "length", "film", "take", "me", "river", "unfold", "atmospher", "mysteri", "dread", "contrast", "surround", "bucol", "seren", "a", "gai", "californian", "teenag", "visit", "nebraskan", "rel", "turn", "nightmarish", "anticip", "reason", "never", "could", "imagin", "cloud", "displac", "sexual", "hover", "flow", "river", "fertil", "field", "littl", "girl", "big", "hors", "told", "uniqu", "kid", "ryder", "plai", "logan", "miller", "larg", "uncomprehend", "point", "view", "midwestern", "gothic", "tale", "maintain", "suffici", "visual", "distanc", "suggest", "altern", "narr", "perspect", "thi", "superl", "act", "indi", "film", "promis", "deliv", "chillingli", "evok", "suffici", "primal", "dread", "intrigu", "audienc", "the", "film", "debut", "sundanc", "festiv", "januari", "26", "2015"], "tmdb_score_value": 6.4, "tmdb_score_count": 16, "imdb_score_value": 5.9, "imdb_score_count": 1302, "meta_score_value": 65.0, "meta_score_count": 14}