{"id": "tt3100274", "cast": [{"character": "Porter Wren", "name": "Adrien Brody"}, {"character": "Caroline Crowley", "name": "Yvonne Strahovski"}, {"character": "Simon Crowley", "name": "Campbell Scott"}, {"character": "Lisa Wren", "name": "Jennifer Beals"}, {"character": "Hobbs", "name": "Steven Berkoff"}, {"character": "Norma", "name": "Linda Lavin"}, {"character": "Ron", "name": "Kevin Breznahan"}, {"character": "Tommy", "name": "Thomas Bair"}, {"character": "Billy", "name": "Will Beinbrink"}, {"character": "Campbell", "name": "Frank Deal"}, {"character": "Haitian Woman", "name": "Chinasa Ogbuagu"}, {"character": "Cab Driver (uncredited)", "name": "Uzimann"}, {"character": "Not Caroline (uncredited)", "name": "Amelie McKendry"}], "crew": [{"job": "Director", "name": "Brian DeCubellis"}, {"job": "Screenplay", "name": "Brian DeCubellis"}], "title": "Manhattan Night", "genres": ["Drama", "Mystery", "Thriller"], "keywords": ["wife husband relationship", "blackmail", "investigation", "video camera", "incest", "death", "newspaper man", "tabloid", "temptation", "manhattan, new york city", "neo-noir", "affair"], "original_language": "English", "rating": "R", "release_date": "2016-05-20", "revenue": 0.0, "runtime": 113, "summary": "Based on Colin Harrison's acclaimed novel Manhattan Nocturne (a New York Times Notable Book of the Year), MANHATTAN NIGHT tells the story of Porter Wren (Adrien Brody), a New York City tabloid writer with an appetite for scandal. On the beat he sells murder, tragedy and anything that passes for the truth. At home he is a model family man, devoted to his loving wife (Jennifer Beals). But when a seductive stranger (Yvonne Strahovski) asks him to dig into the unsolved murder of her filmmaker husband Simon (Campbell Scott), he can't resist. In this modern version of a classic film noir, we follow Porter as he is drawn into a very nasty case of sexual obsession and blackmail - one that threatens his job, his marriage, and his life. MANHATTAN NIGHT will be released by Lionsgate Premiere in theaters and On Demand May 20, 2016. Lionsgate Premiere, Grindstone Entertainment Group and 13 Films present in association with Sparkle Roll Media Corporation and Big Indie Pictures a production of Fable...", "tokens": ["base", "colin", "harrison", "acclaim", "novel", "manhattan", "nocturn", "new", "york", "time", "notabl", "book", "year", "manhattan", "night", "tell", "stori", "porter", "wren", "adrien", "brodi", "new", "york", "citi", "tabloid", "writer", "appetit", "scandal", "on", "beat", "sell", "murder", "tragedi", "anyth", "pass", "truth", "at", "home", "model", "famili", "man", "devot", "love", "wife", "jennif", "beal", "but", "seduct", "stranger", "yvonn", "strahovski", "ask", "dig", "unsolv", "murder", "filmmak", "husband", "simon", "campbel", "scott", "resist", "in", "modern", "version", "classic", "film", "noir", "follow", "porter", "drawn", "nasti", "case", "sexual", "obsess", "blackmail", "on", "threaten", "job", "marriag", "life", "manhattan", "night", "releas", "lionsgat", "premier", "theater", "on", "demand", "mai", "20", "2016", "lionsgat", "premier", "grindston", "entertain", "group", "13", "film", "present", "associ", "sparkl", "roll", "media", "corpor", "big", "indi", "pictur", "product", "fabl"], "tmdb_score_value": 6.1, "tmdb_score_count": 143, "imdb_score_value": 6.2, "imdb_score_count": 9017, "meta_score_value": 44.0, "meta_score_count": 14}