{"id": "tt3164198", "cast": [{"character": "Himself", "name": "Justin Peck"}, {"character": "Choreographer", "name": "Vicky Kadian"}], "crew": [{"job": "Director", "name": "Jody Lee Lipes"}, {"job": "Producer", "name": "Anna Rose Holmer"}, {"job": "Producer", "name": "Ellen Bar"}], "title": "Ballet 422", "genres": ["Documentary", "Music"], "keywords": [], "original_language": "English", "rating": "PG", "release_date": "2014-04-19", "revenue": 0.0, "runtime": 72, "summary": "Ballet 422 is a record of the creative process of a young choreographer Justin Peck, just 26 years old, hired to create a new ballet for the winter season of the New York City Ballet in 2013. The New York City Ballet is considered one of the best companies in the world. Since 1990 he is led by Peter Martins, his Ballet Master in Chief. The documentary describes the intense backstage work that takes place during the process of creating and learning this new ballet: \"Paz de la Jolla\". It shows Peck working with his fellow dancers (Justin Peck is also a soloist at NYCB!), with musicians, lighting technicians, and costume designers in the composition of a new work, his third creation for the NYCB. It is the first time the New York City Ballet is exposed during the creation of a new a ballet.", "tokens": ["ballet", "422", "record", "creativ", "process", "young", "choreograph", "justin", "peck", "26", "year", "old", "hire", "creat", "new", "ballet", "winter", "season", "new", "york", "citi", "ballet", "2013", "the", "new", "york", "citi", "ballet", "consid", "on", "best", "compani", "world", "sinc", "1990", "led", "peter", "martin", "ballet", "master", "chief", "the", "documentari", "describ", "intens", "backstag", "work", "take", "place", "process", "creat", "learn", "new", "ballet", "paz", "de", "la", "jolla", "it", "show", "peck", "work", "fellow", "dancer", "justin", "peck", "also", "soloist", "nycb", "musician", "light", "technician", "costum", "design", "composit", "new", "work", "third", "creation", "nycb", "it", "first", "time", "new", "york", "citi", "ballet", "expos", "creation", "new", "ballet"], "tmdb_score_value": 6.1, "tmdb_score_count": 24, "imdb_score_value": 6.2, "imdb_score_count": 989, "meta_score_value": 74.0, "meta_score_count": 16}