{"id": "tt3397160", "cast": [{"character": "Stefan Zweig", "name": "Josef Hader"}, {"character": "Friderike Zweig", "name": "Barbara Sukowa"}, {"character": "Lotte Zweig", "name": "Aenne Schwarz"}, {"character": "Ernst Feder", "name": "Matthias Brandt"}, {"character": "Emil Ludwig", "name": "Charly H\u00fcbner"}, {"character": "Joseph Brainin", "name": "Andr\u00e9 Szymanski"}, {"character": "Leopold Stern", "name": "Nicolau Breyner"}, {"character": "Samuel Malamud", "name": "Lenn Kudrjawizki"}, {"character": "Lef\u00e8vre", "name": "T\u00f3mas Lemarquis"}, {"character": "Erna Feder", "name": "Naomi Krauss"}, {"character": "Reporter Sanchez", "name": "Oscar Ortega S\u00e1nchez"}, {"character": "Alix St\u00f6rk", "name": "Valerie Pachner"}], "crew": [{"job": "Director", "name": "Maria Schrader"}, {"job": "Writer", "name": "Maria Schrader"}, {"job": "Writer", "name": "Jan Schomburg"}, {"job": "Original Music Composer", "name": "Cornelius Renz"}, {"job": "Original Music Composer", "name": "Tobias Wagner"}], "title": "Stefan Zweig: Farewell to Europe", "genres": ["Drama", "History"], "keywords": ["literature", "biography", "writer", "third reich", "woman director"], "original_language": "German", "rating": "NOT RATED", "release_date": "2016-06-02", "revenue": 0.0, "runtime": 106, "summary": "In 1936, Stefan Zweig, the illustrious author of \" 24 Hours of a Woman's Life\" and \"Letter from an Unknown Woman\", leaves Austria for South America. Being Jewish and hating the inhumanity that prevails in Germany while threatening his native country, he has decided to escape the specter of Nazism. Brazil is his chosen country. He is immediately hailed at Rio de Janeiro's Jockey Club by the local jet set. But whereas expect him to take sides and to make a statement against Hitler and his clique, Zweig refuses to renounce his humanity and to indulge in over-simplification: he just cannot condemn Germany and its people. On the other hand, the great writer literally falls in love with Brazil and undertakes the writing of a new book about the country. Accompanied by Lotte, his second wife he explores different regions, including the most remote ones...", "tokens": ["in", "1936", "stefan", "zweig", "illustri", "author", "24", "hour", "woman", "life", "letter", "unknown", "woman", "leav", "austria", "south", "america", "be", "jewish", "hate", "inhuman", "prevail", "germani", "threaten", "nativ", "countri", "decid", "escap", "specter", "nazism", "brazil", "chosen", "countri", "he", "immedi", "hail", "rio", "de", "janeiro", "jockei", "club", "local", "jet", "set", "but", "wherea", "expect", "take", "side", "make", "statement", "hitler", "cliqu", "zweig", "refus", "renounc", "human", "indulg", "simplif", "cannot", "condemn", "germani", "peopl", "on", "hand", "great", "writer", "liter", "fall", "love", "brazil", "undertak", "write", "new", "book", "countri", "accompani", "lott", "second", "wife", "explor", "differ", "region", "includ", "remot", "on"], "tmdb_score_value": 7.0, "tmdb_score_count": 21, "imdb_score_value": 6.7, "imdb_score_count": 1319, "meta_score_value": 75.0, "meta_score_count": 8}