{"id": "tt3415992", "cast": [{"character": "Helen", "name": "Joan Collins"}, {"character": "Priscilla", "name": "Pauline Collins"}, {"character": "Alberto", "name": "Franco Nero"}, {"character": "Frank", "name": "Ronald Pickup"}, {"character": "Sarah", "name": "Sian Reeves"}, {"character": "Lucy", "name": "Joely Richardson"}, {"character": "Ileana", "name": "Allene Quincy"}, {"character": "Reg", "name": "Richard Syms"}], "crew": [{"job": "Director", "name": "Roger Goldby"}, {"job": "Writer", "name": "Roger Goldby"}, {"job": "Producer", "name": "Azim Bolkiah"}, {"job": "Producer", "name": "Sarah Sulick"}], "title": "The Time of Their Lives", "genres": ["Comedy"], "keywords": ["road trip", "elderly"], "original_language": "English", "rating": "NOT RATED", "release_date": "2017-03-10", "revenue": 0.0, "runtime": 105, "summary": "Determined to gatecrash her ex-lover's funeral on glamorous French hideaway Ile-de-Re, former Hollywood siren Helen (Joan Collins) escapes her London retirement home with the help of Priscilla (Pauline Collins), a repressed English housewife stuck in a bad marriage. Pooling their limited resources, they hit the road together by coach, ferry, car and foot in a race to get to the funeral on time, becoming entangled in a love triangle with a reclusive Italian millionaire (Franco Nero) along the way. On this unforgettable journey, they find true friendship in one another - and have the time of their lives.", "tokens": ["determin", "gatecrash", "ex", "lover", "funer", "glamor", "french", "hideawai", "il", "de", "re", "former", "hollywood", "siren", "helen", "joan", "collin", "escap", "london", "retir", "home", "help", "priscilla", "paulin", "collin", "repress", "english", "housewif", "stuck", "bad", "marriag", "pool", "limit", "resourc", "hit", "road", "togeth", "coach", "ferri", "car", "foot", "race", "get", "funer", "time", "becom", "entangl", "love", "triangl", "reclus", "italian", "millionair", "franco", "nero", "along", "wai", "on", "unforgett", "journei", "find", "true", "friendship", "on", "anoth", "time", "live"], "tmdb_score_value": 5.3, "tmdb_score_count": 9, "imdb_score_value": 5.8, "imdb_score_count": 460, "meta_score_value": 34.0, "meta_score_count": 5}