{"id": "tt3487994", "cast": [{"character": "Evan", "name": "Fran Kranz"}, {"character": "Max", "name": "Pedro Pascal"}, {"character": "Tim", "name": "Joey Kern"}, {"character": "Ted", "name": "Joel Murray"}, {"character": "Amanda", "name": "Emma Fitzpatrick"}, {"character": "Zabeth", "name": "Yvette Yates"}, {"character": "Andrew", "name": "Justin Ware"}, {"character": "Dave", "name": "David F. Park"}, {"character": "Jack the Intern", "name": "Parvesh Cheena"}, {"character": "Corporate Guest", "name": "Matthew Lillard"}, {"character": "Frank", "name": "Marshall Givens"}, {"character": "Janitor", "name": "Sean Cowhig"}, {"character": "Elaine", "name": "Zabeth Russell"}, {"character": "Sofia", "name": "Patricia Rae"}], "crew": [{"job": "Director", "name": "Brian James O'Connell"}, {"job": "Writer", "name": "Ryan Mitts"}, {"job": "Writer", "name": "Dr. God"}, {"job": "Producer", "name": "Brett Forbes"}, {"job": "Producer", "name": "Colleen Hard"}, {"job": "Producer", "name": "Patrick Rizzotti"}, {"job": "Producer", "name": "Justin Ware"}, {"job": "Original Music Composer", "name": "Anton Sanko"}, {"job": "Producer", "name": "Brandon Evans"}], "title": "Bloodsucking Bastards", "genres": ["Comedy", "Horror"], "keywords": ["vampire", "business rivalry"], "original_language": "English", "rating": "NOT RATED", "release_date": "2015-09-04", "revenue": 0.0, "runtime": 84, "summary": "An action-packed horror comedy, BLOODSUCKING BASTARDS stars Fran Kranz as Evan, a dutiful and overworked employee stuck at a soul-killing corporation with his beautiful co-worker and girlfriend Amanda (Emma Fitzpatrick) and his slacker best friend Tim (Joey Kern). Evans world begins to crumble when Amanda dumps him and his boss Ted (Joel Murray) hands his coveted promotion to his nemesis Max (Pedro Pascal). When his office mates start going through disturbing changes, Evan must find a way to stop the evil brewing amidst the cubicles, and rescue his workplace pals before his life and career go from dead-end... to just dead.", "tokens": ["an", "action", "pack", "horror", "comedi", "bloodsuck", "bastard", "star", "fran", "kranz", "evan", "duti", "overwork", "employe", "stuck", "soul", "kill", "corpor", "beauti", "co", "worker", "girlfriend", "amanda", "emma", "fitzpatrick", "slacker", "best", "friend", "tim", "joei", "kern", "evan", "world", "begin", "crumbl", "amanda", "dump", "boss", "ted", "joel", "murrai", "hand", "covet", "promot", "nemesi", "max", "pedro", "pascal", "when", "offic", "mate", "start", "go", "disturb", "chang", "evan", "must", "find", "wai", "stop", "evil", "brew", "amidst", "cubicl", "rescu", "workplac", "pal", "life", "career", "go", "dead", "end", "dead"], "tmdb_score_value": 5.5, "tmdb_score_count": 74, "imdb_score_value": 5.7, "imdb_score_count": 4325, "meta_score_value": 50.0, "meta_score_count": 7}