{"id": "tt3457734", "cast": [{"character": "Harper", "name": "Bridey Elliott"}, {"character": "Allie", "name": "Clare McNulty"}, {"character": "Cobble Hill Mom", "name": "Alysia Reiner"}, {"character": "Ebb", "name": "Neil Casey"}, {"character": "Benji", "name": "Peter Vack"}, {"character": "Sam", "name": "Griffin Newman"}, {"character": "Russ", "name": "Jeffrey Scaperrotta"}, {"character": "Reggie Watts", "name": "Reggie Watts"}], "crew": [{"job": "Director", "name": "Sarah-Violet Bliss"}, {"job": "Director", "name": "Charles Rogers"}, {"job": "Writer", "name": "Sarah-Violet Bliss"}, {"job": "Writer", "name": "Charles Rogers"}, {"job": "Producer", "name": "Mollye Asher"}, {"job": "Producer", "name": "Geoff Mansfield"}], "title": "Fort Tilden", "genres": ["Comedy"], "keywords": ["woman director"], "original_language": "English", "rating": "R", "release_date": "2014-03-08", "revenue": 0.0, "runtime": 95, "summary": "Fort Tilden: New York City's secluded seaside nirvana where, like flies to honey, Brooklyn's hip millennial set flocks on sweltering weekend afternoons for unbridled summertime indulgence. Amidst the vexing stagnation of quarter-life crises, Allie (Clare McNulty) struggles to prepare for the Peace Corps, while Harper (Bridey Elliot) awaits checks from her father to fund her artistic dreams. But the two friends quickly shun responsibilities for the day when a pair of good-looking guys invites them along for a carefree Fort Tilden afternoon. As the two young women board their fixed-gear bicycles and embark on a lengthy journey to the beach, they quickly realize that, akin to their confusing, transitioning lives, they neither know where they're going nor how they plan to get there. The debut feature film of directors Sarah-Violet Bliss and Charles Rogers - and showcasing the comedic versatility of Clare McNulty and Bridey Elliott as Allie and Harper - \"Fort Tilden\" is a hilariously ...", "tokens": ["fort", "tilden", "new", "york", "citi", "seclud", "seasid", "nirvana", "like", "fli", "honei", "brooklyn", "hip", "millenni", "set", "flock", "swelter", "weekend", "afternoon", "unbridl", "summertim", "indulg", "amidst", "vex", "stagnat", "quarter", "life", "crise", "alli", "clare", "mcnulti", "struggl", "prepar", "peac", "corp", "harper", "bridei", "elliot", "await", "check", "father", "fund", "artist", "dream", "but", "two", "friend", "quickli", "shun", "respons", "dai", "pair", "good", "look", "gui", "invit", "along", "carefre", "fort", "tilden", "afternoon", "as", "two", "young", "women", "board", "fix", "gear", "bicycl", "embark", "lengthi", "journei", "beach", "quickli", "realiz", "akin", "confus", "transit", "live", "neither", "know", "go", "plan", "get", "the", "debut", "featur", "film", "director", "sarah", "violet", "bliss", "charl", "roger", "showcas", "comed", "versatil", "clare", "mcnulti", "bridei", "elliott", "alli", "harper", "fort", "tilden", "hilari"], "tmdb_score_value": 4.9, "tmdb_score_count": 21, "imdb_score_value": 5.4, "imdb_score_count": 1146, "meta_score_value": 70.0, "meta_score_count": 16}