{"id": "tt3518012", "cast": [{"character": "Himself", "name": "Gore Vidal"}, {"character": "Himself", "name": "William F. Buckley"}, {"character": "Himself", "name": "Kelsey Grammer"}, {"character": "Himself", "name": "John Lithgow"}, {"character": "Himself", "name": "Dick Cavett"}, {"character": "Himself", "name": "Christopher Hitchens"}, {"character": "Himself", "name": "Noam Chomsky"}], "crew": [{"job": "Director", "name": "Robert Gordon"}, {"job": "Director", "name": "Morgan Neville"}, {"job": "Writer", "name": "Robert Gordon"}, {"job": "Writer", "name": "Morgan Neville"}, {"job": "Original Music Composer", "name": "Jonathan Kirkscey"}, {"job": "Producer", "name": "Robert Gordon"}, {"job": "Producer", "name": "Morgan Neville"}], "title": "Best of Enemies", "genres": ["Documentary", "History"], "keywords": ["miami", "chicago", "television", "politics", "intellectual", "author", "debate", "archival footage", "television network", "1960s"], "original_language": "English", "rating": "R", "release_date": "2015-07-31", "revenue": 0.0, "runtime": 87, "summary": "'Best of Enemies' is a documentary about the legendary series of nationally televised debates in 1968 between two great public intellectuals, the liberal Gore Vidal and the conservative William F. Buckley Jr. Intended as commentary on the issues of their day, these vitriolic and explosive encounters came to define the modern era of public discourse in the media, marking the big bang moment of our contemporary media landscape when spectacle trumped content and argument replaced substance. 'Best of Enemies' delves into the entangled biographies of these two great thinkers and luxuriates in the language and the theater of their debates, begging the question, 'What has television done to the way we discuss politics in our democracy today?'", "tokens": ["best", "enemi", "documentari", "legendari", "seri", "nation", "televis", "debat", "1968", "two", "great", "public", "intellectu", "liber", "gore", "vidal", "conserv", "william", "f", "bucklei", "jr", "intend", "commentari", "issu", "dai", "vitriol", "explos", "encount", "came", "defin", "modern", "era", "public", "discours", "media", "mark", "big", "bang", "moment", "contemporari", "media", "landscap", "spectacl", "trump", "content", "argument", "replac", "substanc", "best", "enemi", "delv", "entangl", "biographi", "two", "great", "thinker", "luxuri", "languag", "theater", "debat", "beg", "question", "what", "televis", "done", "wai", "discuss", "polit", "democraci", "todai"], "tmdb_score_value": 7.2, "tmdb_score_count": 73, "imdb_score_value": 7.6, "imdb_score_count": 4806, "meta_score_value": 77.0, "meta_score_count": 25}