{"id": "tt3735686", "cast": [{"character": "Orry-Kelly", "name": "Darren Gilshenan"}, {"character": "Herself", "name": "Angela Lansbury"}, {"character": "Herself", "name": "Jane Fonda"}, {"character": "Herself", "name": "Catherine Martin"}, {"character": "Herself", "name": "Ann Roth"}], "crew": [{"job": "Director", "name": "Gillian Armstrong"}, {"job": "Writer", "name": "Katherine Thomson"}], "title": "Women He's Undressed", "genres": ["Documentary"], "keywords": ["biography", "hollywood", "fashion", "woman director"], "original_language": "English", "rating": "NOT RATED", "release_date": "2015-06-11", "revenue": 0.0, "runtime": 100, "summary": "Women He's Undressed is a cinema length documentary that explores the life of Australia's most prolific costume designer. Until now Orry-Kelly has been unacknowledged in his country of birth and pretty well forgotten in the adopted country of his greatest success. During the boom years of Hollywood he was the costume designer on an astonishing 282 motion pictures. He designed for the stars like Marilyn Monroe, Bette Davis, Humphrey Bogart, Rosalind Russell, Errol Flynn and many more of the immortals. His films included Some Like It Hot, Casablanca, An American in Paris and Now, Voyager. Orry-Kelly (Jack to his friends) won three Academy Awards and was nominated for a fourth. Orry-Kelly was Head of Warner Brothers Costume Department during the richest period of American film, the establishment of the dream factory and its effect on mass culture. He was outrageous, witty, outspoken, a drinker and uncompromising but he survived partially protected by his friendship with Jack and Ann ...", "tokens": ["women", "he", "undress", "cinema", "length", "documentari", "explor", "life", "australia", "prolif", "costum", "design", "until", "orri", "kelli", "unacknowledg", "countri", "birth", "pretti", "well", "forgotten", "adopt", "countri", "greatest", "success", "dure", "boom", "year", "hollywood", "costum", "design", "astonish", "282", "motion", "pictur", "he", "design", "star", "like", "marilyn", "monro", "bett", "davi", "humphrei", "bogart", "rosalind", "russel", "errol", "flynn", "mani", "immort", "hi", "film", "includ", "some", "like", "it", "hot", "casablanca", "an", "american", "pari", "now", "voyag", "orri", "kelli", "jack", "friend", "three", "academi", "award", "nomin", "fourth", "orri", "kelli", "head", "warner", "brother", "costum", "depart", "richest", "period", "american", "film", "establish", "dream", "factori", "effect", "mass", "cultur", "he", "outrag", "witti", "outspoken", "drinker", "uncompromis", "surviv", "partial", "protect", "friendship", "jack", "ann"], "tmdb_score_value": 4.4, "tmdb_score_count": 12, "imdb_score_value": 7.1, "imdb_score_count": 264, "meta_score_value": 76.0, "meta_score_count": 6}