{"id": "tt3774866", "cast": [{"character": "David", "name": "Guy Kent"}, {"character": "Marie", "name": "Marta Gastini"}, {"character": "J\u00f3hann", "name": "Sveinn \u00d3lafur Gunnarsson"}, {"character": "Eva", "name": "Thora Bjorg Helga"}], "crew": [{"job": "Director", "name": "Angad Aulakh"}, {"job": "Writer", "name": "Angad Aulakh"}], "title": "Autumn Lights", "genres": ["Mystery", "Drama"], "keywords": ["iceland", "couple"], "original_language": "English", "rating": "NOT RATED", "release_date": "2016-10-21", "revenue": 0.0, "runtime": 98, "summary": "Set against Iceland's dramatic landscape, Autumn Lights is a story of morality, virtue, and relationships as seen through the eyes of a foreigner in a strange land. The story follows David, an introverted American photographer adrift in remote Iceland while on assignment. When he gets caught in a local investigation after discovering a deserted body washed ashore, David is temporarily bound to a place he doesn't call home and he acquaints himself with the few inhabitants in the area, among them Marie, an Italian woman whose shiftiness betrays not only her beautiful face but her Icelandic husband J\u00f3hann and his own unruffled demeanor. As days pass, David's fascination with the couple intensifies and he slowly begins to find himself entangled in their mysterious lives.", "tokens": ["set", "iceland", "dramat", "landscap", "autumn", "light", "stori", "moral", "virtu", "relationship", "seen", "ey", "foreign", "strang", "land", "the", "stori", "follow", "david", "introvert", "american", "photograph", "adrift", "remot", "iceland", "assign", "when", "get", "caught", "local", "investig", "discov", "desert", "bodi", "wash", "ashor", "david", "temporarili", "bound", "place", "call", "home", "acquaint", "inhabit", "area", "among", "mari", "italian", "woman", "whose", "shifti", "betrai", "beauti", "face", "iceland", "husband", "j\u00f3hann", "unruffl", "demeanor", "as", "dai", "pass", "david", "fascin", "coupl", "intensifi", "slowli", "begin", "find", "entangl", "mysteri", "live"], "tmdb_score_value": 5.4, "tmdb_score_count": 5, "imdb_score_value": 7.6, "imdb_score_count": 3186, "meta_score_value": 37.0, "meta_score_count": 5}