{"id": "tt3901826", "cast": [{"character": "Parvana (voice)", "name": "Saara Chaudry"}, {"character": "Shauzia (voice)", "name": "Soma Bhatia"}, {"character": "Fattema (voice)", "name": "Laara Sadiq"}, {"character": "Soraya (voice)", "name": "Shaista Latif"}, {"character": "Nurullah (voice)", "name": "Ali Badshah"}, {"character": "Idrees / Sulayman (voice)", "name": "Noorin Gulamgaus"}, {"character": "Razaq (voice)", "name": "Kawa Ada"}, {"character": "Darya / Fruit juice vendor / Jail warden / Various (voice)", "name": "Ali Kazmi"}, {"character": "Kiln owner (voice)", "name": "Kane Mahon"}, {"character": "Stall Seller / Fruit Seller / Guard Man on Bike / Teenage Boy #2 (voice)", "name": "Reza Sholeh"}, {"character": "Sorceress / Woman in courtyard (voice)", "name": "Kanza Feris"}], "crew": [{"job": "Director", "name": "Nora Twomey"}, {"job": "Writer", "name": "Deborah Ellis"}, {"job": "Writer", "name": "Anita Doron"}, {"job": "Producer", "name": "Anthony Leo"}, {"job": "Producer", "name": "Tomm Moore"}, {"job": "Producer", "name": "Andrew Rosen"}, {"job": "Producer", "name": "Paul Young"}, {"job": "Producer", "name": "Angelina Jolie"}], "title": "The Breadwinner", "genres": ["Animation", "Drama", "War"], "keywords": ["imprisonment", "father", "taliban", "family", "disguise", "afghan", "gender", "culture", "breadwinner"], "original_language": "English", "rating": "PG-13", "release_date": "2017-11-17", "revenue": 307871.0, "runtime": 93, "summary": "From executive producer Angelina Jolie and the creators of the Academy Award nominated The Secret of Kells and Song of the Sea, comes the highly-anticipated new feature based on Deborah Ellis' bestselling novel. Parvana is an 11-year-old girl growing up under the Taliban in Afghanistan in 2001. When her father is wrongfully arrested, Parvana cuts off her hair and dresses like a boy in order to support her family. Working alongside her friend Shauzia, Parvana discovers a new world of freedom-and danger. With undaunted courage, Parvana draws strength from the fantastical stories she invents, as she embarks on a quest to find her father and reunite her family. Equal parts thrilling and enchanting, The Breadwinner is an inspiring and luminously animated tale about the power of stories to sustain hope and carry us through dark times.", "tokens": ["from", "execut", "produc", "angelina", "joli", "creator", "academi", "award", "nomin", "the", "secret", "kell", "song", "sea", "come", "highli", "anticip", "new", "featur", "base", "deborah", "elli", "bestsel", "novel", "parvana", "11", "year", "old", "girl", "grow", "taliban", "afghanistan", "2001", "when", "father", "wrongfulli", "arrest", "parvana", "cut", "hair", "dress", "like", "boi", "order", "support", "famili", "work", "alongsid", "friend", "shauzia", "parvana", "discov", "new", "world", "freedom", "danger", "with", "undaunt", "courag", "parvana", "draw", "strength", "fantast", "stori", "invent", "embark", "quest", "find", "father", "reunit", "famili", "equal", "part", "thrill", "enchant", "the", "breadwinn", "inspir", "lumin", "anim", "tale", "power", "stori", "sustain", "hope", "carri", "us", "dark", "time"], "tmdb_score_value": 8.0, "tmdb_score_count": 50, "imdb_score_value": 7.6, "imdb_score_count": 5859, "meta_score_value": 76.0, "meta_score_count": 18}