{"id": "tt4494718", "cast": [{"character": "Alberto Giacometti", "name": "Geoffrey Rush"}, {"character": "James Lord", "name": "Armie Hammer"}, {"character": "Caroline", "name": "Cl\u00e9mence Po\u00e9sy"}, {"character": "Diego Giacometti", "name": "Tony Shalhoub"}, {"character": "Annette Arm", "name": "Sylvie Testud"}, {"character": "Pierre Matisse", "name": "James Faulkner"}], "crew": [{"job": "Director", "name": "Stanley Tucci"}, {"job": "Writer", "name": "Stanley Tucci"}, {"job": "Original Music Composer", "name": "Evan Lurie"}, {"job": "Producer", "name": "Gail Egan"}, {"job": "Producer", "name": "Ilann Girard"}, {"job": "Producer", "name": "Nik Bower"}], "title": "Final Portrait", "genres": ["History", "Drama"], "keywords": ["painter", "biography", "sculptor", "swiss"], "original_language": "English", "rating": "R", "release_date": "2017-08-03", "revenue": 1113254.0, "runtime": 90, "summary": "In 1964, while on a short trip to Paris, the American writer and art-lover James Lord (Armie Hammer) is asked by his friend, the world-renowned artist Alberto Giacometti (Geoffrey Rush), to sit for a portrait. The process, Giacometti assures Lord, will take only a few days. Flattered and intrigued, Lord agrees. So begins not only the story of an offbeat friendship, but, seen through the eyes of Lord, an insight into the beauty, frustration, profundity and, at times, downright chaos of the artistic process. FINAL PORTRAIT is a portrait of a genius, and of a friendship between two men who are utterly different, yet increasingly bonded through a single, ever-evolving act of creativity. It is a film which shines a light on the artistic process itself, by turns exhilarating, exasperating and bewildering, questioning whether the gift of a great artist is a blessing or a curse.", "tokens": ["in", "1964", "short", "trip", "pari", "american", "writer", "art", "lover", "jame", "lord", "armi", "hammer", "ask", "friend", "world", "renown", "artist", "alberto", "giacometti", "geoffrei", "rush", "sit", "portrait", "the", "process", "giacometti", "assur", "lord", "take", "dai", "flatter", "intrigu", "lord", "agre", "so", "begin", "stori", "offbeat", "friendship", "seen", "ey", "lord", "insight", "beauti", "frustrat", "profund", "time", "downright", "chao", "artist", "process", "final", "portrait", "portrait", "geniu", "friendship", "two", "men", "utterli", "differ", "yet", "increasingli", "bond", "singl", "ever", "evolv", "act", "creativ", "it", "film", "shine", "light", "artist", "process", "turn", "exhilar", "exasper", "bewild", "question", "whether", "gift", "great", "artist", "bless", "curs"], "tmdb_score_value": 6.0, "tmdb_score_count": 36, "imdb_score_value": 6.3, "imdb_score_count": 1913, "meta_score_value": 70.0, "meta_score_count": 30}