{"id": "tt4664568", "cast": [{"character": "Himself", "name": "Sidney Lumet"}], "crew": [{"job": "Director", "name": "Nancy Buirski"}, {"job": "Producer", "name": "Thane Rosenbaum"}, {"job": "Producer", "name": "Nancy Buirski"}, {"job": "Producer", "name": "Chris Donnelly"}, {"job": "Producer", "name": "Robin Yigit Smith"}, {"job": "Producer", "name": "Joshua A. Green"}, {"job": "Producer", "name": "Scott Berrie"}], "title": "By Sidney Lumet", "genres": ["Documentary"], "keywords": ["woman director"], "original_language": "English", "rating": "NOT RATED", "release_date": "2015-07-13", "revenue": 0.0, "runtime": 103, "summary": "In BY SIDNEY LUMET, film legend Sidney Lumet (1924-2011) tells his own story in a never-before-seen interview shot in 2008 produced by the late filmmaker Daniel Anker. With candor, humor and grace, Lumet reveals what matters to him as an artist and as a human being. The documentary film features clips from Lumet's films - 44 films made in 50 years - including 12 ANGRY MEN (1957), THE FUGITIVE KIND (1960), SERPICO (1973), DOG DAY AFTERNOON (1975), THE VERDICT (1982), to name only a very few. Filmmaker Nancy Buirski (Afternoon of a Faun, The Loving Story) combines these elements to create a portrait of the work and life of one of the most accomplished and influential directors in the history of cinema. BY SIDNEY LUMET illustrates the spiritual and ethical lessons at the core of his work. First and foremost a storyteller, Lumet's strongly moral tales capture the dilemmas and concerns of a society struggling with essentials: how does one behave to others and to oneself?", "tokens": ["in", "by", "sidnei", "lumet", "film", "legend", "sidnei", "lumet", "1924", "2011", "tell", "stori", "never", "seen", "interview", "shot", "2008", "produc", "late", "filmmak", "daniel", "anker", "with", "candor", "humor", "grace", "lumet", "reveal", "matter", "artist", "human", "the", "documentari", "film", "featur", "clip", "lumet", "film", "44", "film", "made", "50", "year", "includ", "12", "angri", "men", "1957", "the", "fugit", "kind", "1960", "serpico", "1973", "dog", "dai", "afternoon", "1975", "the", "verdict", "1982", "name", "filmmak", "nanci", "buirski", "afternoon", "faun", "the", "love", "stori", "combin", "element", "creat", "portrait", "work", "life", "on", "accomplish", "influenti", "director", "histori", "cinema", "by", "sidnei", "lumet", "illustr", "spiritu", "ethic", "lesson", "core", "work", "first", "foremost", "storytel", "lumet", "strongli", "moral", "tale", "captur", "dilemma", "concern", "societi", "struggl", "essenti", "on", "behav", "other", "oneself"], "tmdb_score_value": 8.0, "tmdb_score_count": 2, "imdb_score_value": 7.2, "imdb_score_count": 257, "meta_score_value": 66.0, "meta_score_count": 12}