{"id": "tt4621016", "cast": [{"character": "Ingrid Bergman (voice)", "name": "Alicia Vikander"}, {"character": "Herself", "name": "Isabella Rossellini"}, {"character": "Himself", "name": "Roberto Rossellini"}, {"character": "Herself (as Ingrid Rossellini)", "name": "Isotta Rossellini"}, {"character": "Herself", "name": "Fiorella Mariani"}, {"character": "Herself", "name": "Jeanine Basinger"}, {"character": "Herself", "name": "Liv Ullmann"}, {"character": "Herself", "name": "Sigourney Weaver"}, {"character": "Herself (archive footage)", "name": "Ingrid Bergman"}, {"character": "Herself", "name": "Pia Lindstr\u00f6m"}], "crew": [{"job": "Director", "name": "Stig Bj\u00f6rkman"}], "title": "Ingrid Bergman: In Her Own Words", "genres": ["Documentary"], "keywords": ["biography", "ingrid bergman"], "original_language": "Swedish", "rating": "NOT RATED", "release_date": "2015-05-19", "revenue": 137722.0, "runtime": 114, "summary": "In spring 2011, director Stig Bj\u00f6rkman meets Ingrid Bergman's daughter Isabella Rossellini and she suggests him to \"make a film about Mama\". Through Isabella, Stig is able to tell Ingrid's story through her own words and images. Seven time Academy Award-nominee and three time Academy Award-winner Ingrid Bergman was one of the most talented actresses of Hollywood's Golden Age with great performances in films such as CASABLANCA (1942), GASLIGHT (1944) and and AUTUMN SONATA (1978). Through never-before-seen private footage, notes, letters, diaries and interviews with her children, this documentary presents a personal portrait and captivating look behind the scenes of the remarkable life of a young Swedish girl who became one of the most celebrated actresses of American and World cinema.", "tokens": ["in", "spring", "2011", "director", "stig", "bj\u00f6rkman", "meet", "ingrid", "bergman", "daughter", "isabella", "rossellini", "suggest", "make", "film", "mama", "through", "isabella", "stig", "abl", "tell", "ingrid", "stori", "word", "imag", "seven", "time", "academi", "award", "nomine", "three", "time", "academi", "award", "winner", "ingrid", "bergman", "on", "talent", "actress", "hollywood", "golden", "ag", "great", "perform", "film", "casablanca", "1942", "gaslight", "1944", "autumn", "sonata", "1978", "through", "never", "seen", "privat", "footag", "note", "letter", "diari", "interview", "children", "documentari", "present", "person", "portrait", "captiv", "look", "behind", "scene", "remark", "life", "young", "swedish", "girl", "becam", "on", "celebr", "actress", "american", "world", "cinema"], "tmdb_score_value": 7.7, "tmdb_score_count": 18, "imdb_score_value": 7.4, "imdb_score_count": 1557, "meta_score_value": 75.0, "meta_score_count": 17}