{"id": "tt4799064", "cast": [{"character": "Richard Thorncroft", "name": "Julian Barratt"}, {"character": "Clive Parnevik", "name": "Simon Farnaby"}, {"character": "Patricia Deville", "name": "Essie Davis"}, {"character": "Peter Easterman", "name": "Steve Coogan"}, {"character": "Jeffrey Moncrief", "name": "Richard McCabe"}, {"character": "DC Elena Baines", "name": "Andrea Riseborough"}, {"character": "Paul Melly", "name": "Russell Tovey"}, {"character": "PC Green", "name": "Robin Morrissey"}, {"character": "Chief Inspector Derek Newsome", "name": "David Schofield"}, {"character": "Casting Receptionist", "name": "Alannah Olivia"}, {"character": "Richard Crowthorne", "name": "Christopher Jenner Cole"}, {"character": "Kenneth Branagh's Producer", "name": "Sean Foley"}, {"character": "Agent's Secretary", "name": "Jessye Romeo"}, {"character": "Richard's Agent", "name": "Harriet Walter"}, {"character": "Himself", "name": "Simon Callow"}, {"character": "Mayor", "name": "Nicholas Farrell"}, {"character": "Jasmine", "name": "Jessica Barden"}, {"character": "Dad with Newspaper", "name": "Tony Way"}, {"character": "Pete Easterman's PA", "name": "Lois Meleri-Jones"}, {"character": "Vincent", "name": "Jordan Long"}], "crew": [{"job": "Producer", "name": "Laura Hastings-Smith"}, {"job": "Producer", "name": "Jack Arbuthnott"}, {"job": "Director", "name": "Sean Foley"}, {"job": "Screenplay", "name": "Simon Farnaby"}, {"job": "Screenplay", "name": "Julian Barratt"}], "title": "Mindhorn", "genres": ["Comedy"], "keywords": ["amateur detective", "murderer", "aging actor", "police investigation", "isle of man", "crime spoof", "failed actor"], "original_language": "English", "rating": "TV-MA", "release_date": "2016-10-09", "revenue": 0.0, "runtime": 89, "summary": "Richard Thorncroft is a has-been British TV actor who used to be famous in the late 1980's for playing the titular and charismatic lead role in the Isle of Man detective show Mindhorn, a character with a robotic eye that can literally \"see the truth\". Unfortunately, after becoming a little too pompous and arrogant, Richard ends up insulting both the Isle of Man and his fellow cast members on the Wogan chat-show, including his on-screen and real life love interest Patricia Deville (Essie Davies), his stuntman (Simon Farnaby), and bit-part costar Peter Easterman (Steve Coogan). He decides to leave to try and make it big in Hollywood, but 25 years later he's balding in a flat in North London and has recently been replaced for an orthopaedic sock advert by John Nettles, much to his chagrin. He is even more jealous that Easterman now fronts a long running spin-off show which has far eclipsed the success of Mindhorn. Richard has an unexpected opportunity to reignite his career though when a...", "tokens": ["richard", "thorncroft", "british", "tv", "actor", "us", "famou", "late", "1980", "plai", "titular", "charismat", "lead", "role", "isl", "man", "detect", "show", "mindhorn", "charact", "robot", "ey", "liter", "see", "truth", "unfortun", "becom", "littl", "pompou", "arrog", "richard", "end", "insult", "isl", "man", "fellow", "cast", "member", "wogan", "chat", "show", "includ", "screen", "real", "life", "love", "interest", "patricia", "devil", "essi", "davi", "stuntman", "simon", "farnabi", "bit", "part", "costar", "peter", "easterman", "steve", "coogan", "he", "decid", "leav", "try", "make", "big", "hollywood", "25", "year", "later", "bald", "flat", "north", "london", "recent", "replac", "orthopaed", "sock", "advert", "john", "nettl", "much", "chagrin", "he", "even", "jealou", "easterman", "front", "long", "run", "spin", "show", "far", "eclips", "success", "mindhorn", "richard", "unexpect", "opportun", "reignit", "career", "though"], "tmdb_score_value": 6.4, "tmdb_score_count": 93, "imdb_score_value": 6.3, "imdb_score_count": 7724, "meta_score_value": 70.0, "meta_score_count": 9}