{"id": "tt5001130", "cast": [{"character": "Narrator", "name": "Oscar Isaac"}, {"character": "Herself", "name": "Jane Goodall"}, {"character": "Himself", "name": "Jerry Brown"}, {"character": "Himself", "name": "Neal Barnard"}, {"character": "Himself", "name": "Michael Pollan"}], "crew": [{"job": "Director", "name": "Charles Ferguson"}, {"job": "Writer", "name": "Chad Beck"}, {"job": "Writer", "name": "Charles Ferguson"}], "title": "Time to Choose", "genres": ["Documentary"], "keywords": ["climate change", "documentary"], "original_language": "English", "rating": "NOT RATED", "release_date": "2015-09-04", "revenue": 0.0, "runtime": 100, "summary": "Academy Award\u00ae-Winning documentary filmmaker Charles Ferguson (Inside Job, No End in Sight) turns his lens to address worldwide climate change challenges and solutions in his new film TIME TO CHOOSE. Featuring narration by award-winning actor Oscar Isaac, TIME TO CHOOSE leaves audiences understanding not only what is wrong, but what can to be done to fix this global threat. Ferguson explores the comprehensive scope of the climate change crisis and examines the power of solutions already available. Through interviews with world-renowned entrepreneurs, innovators, thought leaders and brave individuals living on the front lines of climate change, Ferguson takes an In-depth look at the remarkable people working to save our planet.", "tokens": ["academi", "award\u00ae", "win", "documentari", "filmmak", "charl", "ferguson", "insid", "job", "no", "end", "sight", "turn", "len", "address", "worldwid", "climat", "chang", "challeng", "solut", "new", "film", "time", "to", "choos", "featur", "narrat", "award", "win", "actor", "oscar", "isaac", "time", "to", "choos", "leav", "audienc", "understand", "wrong", "done", "fix", "global", "threat", "ferguson", "explor", "comprehens", "scope", "climat", "chang", "crisi", "examin", "power", "solut", "alreadi", "avail", "through", "interview", "world", "renown", "entrepreneur", "innov", "thought", "leader", "brave", "individu", "live", "front", "line", "climat", "chang", "ferguson", "take", "in", "depth", "look", "remark", "peopl", "work", "save", "planet"], "tmdb_score_value": 0.0, "tmdb_score_count": 0, "imdb_score_value": 7.3, "imdb_score_count": 150, "meta_score_value": 75.0, "meta_score_count": 15}