{"id": "tt5294198", "cast": [{"character": "Veronica", "name": "Sandra Oh"}, {"character": "Ashley", "name": "Anne Heche"}, {"character": "Lisa", "name": "Alicia Silverstone"}, {"character": "Doctor Jones", "name": "Dylan Baker"}, {"character": "John The Physical Therapist", "name": "Tituss Burgess"}, {"character": "Aunt Charlie", "name": "Amy Hill"}, {"character": "Sally", "name": "Ariel Kavoussi"}, {"character": "Donna", "name": "Myra Lucretia Taylor"}, {"character": "Stanley", "name": "Damian Young"}, {"character": "Tom Ferguson The Art Collector", "name": "Stephen Gevedon"}, {"character": "Kip", "name": "Giullian Yao Gioiello"}, {"character": "Howie the Deaf Guy", "name": "Jordan Carlos"}, {"character": "Henry", "name": "Justiin A. Davis"}, {"character": "The Talk Show Host", "name": "Craig Bierko"}, {"character": "The Fart Machine", "name": "Randy Gambill"}], "crew": [{"job": "Director", "name": "Onur Tukel"}, {"job": "Writer", "name": "Onur Tukel"}], "title": "Catfight", "genres": ["Comedy", "Drama"], "keywords": ["fight", "rivalry", "girl fight", "event"], "original_language": "English", "rating": "NOT RATED", "release_date": "2017-03-03", "revenue": 0.0, "runtime": 96, "summary": "In this dark, gritty, mean-spirited, but well-made comedy-drama, Veronica (Sandra Oh) is an superficial, entitled housewife dealing with her home life. Ashley (Anne Heche) is a self-obsessed, misanthropic, artist dealing with her career and her life partner Lisa (Alicia Silverstone) who wants to raise a baby. Veronica and Ashely's paths cross at a party hosted by Veronica's husband, which the two cynical woman's long-buried rivalry comes to the surface which leads to a brutal cat-fight where Veronica ends up in the hospital in a coma. After two years, Veronica emerges from her coma to learn that both her husband and teenage son are dead, and she is broke with no friends or family. On the other hand, Ashley has become a successful and wealthy artist now married to Lisa. Veronica blames Ashley for her downfall, and after another confrontation which leads to another savage cat-fight in a vacant lot, Ashley is the one to end up in a coma and is revived after two years to find her own ...", "tokens": ["in", "dark", "gritti", "mean", "spirit", "well", "made", "comedi", "drama", "veronica", "sandra", "oh", "superfici", "entitl", "housewif", "deal", "home", "life", "ashlei", "ann", "hech", "self", "obsess", "misanthrop", "artist", "deal", "career", "life", "partner", "lisa", "alicia", "silverston", "want", "rais", "babi", "veronica", "ash", "path", "cross", "parti", "host", "veronica", "husband", "two", "cynic", "woman", "long", "buri", "rivalri", "come", "surfac", "lead", "brutal", "cat", "fight", "veronica", "end", "hospit", "coma", "after", "two", "year", "veronica", "emerg", "coma", "learn", "husband", "teenag", "son", "dead", "broke", "friend", "famili", "on", "hand", "ashlei", "becom", "success", "wealthi", "artist", "marri", "lisa", "veronica", "blame", "ashlei", "downfal", "anoth", "confront", "lead", "anoth", "savag", "cat", "fight", "vacant", "lot", "ashlei", "on", "end", "coma", "reviv", "two", "year", "find"], "tmdb_score_value": 5.8, "tmdb_score_count": 62, "imdb_score_value": 5.8, "imdb_score_count": 3408, "meta_score_value": 66.0, "meta_score_count": 17}