{"id": "tt5332280", "cast": [{"character": "Mother", "name": "Tiina M\u00e4lberg"}, {"character": "Father", "name": "Andres Tabun"}, {"character": "Aarne", "name": "Andres Noormets"}, {"character": "Lauri", "name": "Siim Maaten"}, {"character": "Policeman", "name": "Jaan Pehk"}, {"character": "Andres", "name": "Jaak Prints"}, {"character": "Riin", "name": "Rea Lest"}], "crew": [{"job": "Director", "name": "Kadri K\u00f5usaar"}, {"job": "Producer", "name": "Aet Laigu"}, {"job": "Screenplay", "name": "Al Wallcat"}, {"job": "Screenplay", "name": "Leana Jalukse"}], "title": "Mother", "genres": ["Drama", "Thriller"], "keywords": ["coma", "shooting", "woman director"], "original_language": "Estonian", "rating": "NOT RATED", "release_date": "2016-01-07", "revenue": 0.0, "runtime": 89, "summary": "This darkly comic crime mystery set in small-town Estonia centers on Elsa, the mother and full time caretaker of Lauri, a teacher who has been in a coma since being shot under shadowy circumstances. Attentive in her duties but at the end of her tether, Elsa receives Lauri's visitors-friends, students, his girlfriend, his boss, and others-who come to update the unconscious Lauri on their lives and unburden themselves of their troubles. But as the police inquiry into the crime progresses, some of his closest ties are called into question. Director Kadri K\u00f5usaar cunningly navigates a script that slowly pieces together the truth behind Lauri's shooting through his visitors' confessionals to the comatose protagonist, cleverly building a web of motives among the tight-knit community. Bathed in the pastel tones of post-Soviet life, Mother is a smartly-crafted whodunit set in a small town where just about everyone is dreaming of something bigger and some are willing to do whatever it takes to...", "tokens": ["thi", "darkli", "comic", "crime", "mysteri", "set", "small", "town", "estonia", "center", "elsa", "mother", "full", "time", "caretak", "lauri", "teacher", "coma", "sinc", "shot", "shadowi", "circumst", "attent", "duti", "end", "tether", "elsa", "receiv", "lauri", "visitor", "friend", "student", "girlfriend", "boss", "other", "come", "updat", "unconsci", "lauri", "live", "unburden", "troubl", "but", "polic", "inquiri", "crime", "progress", "closest", "ti", "call", "question", "director", "kadri", "k\u00f5usaar", "cunningli", "navig", "script", "slowli", "piec", "togeth", "truth", "behind", "lauri", "shoot", "visitor", "confession", "comatos", "protagonist", "cleverli", "build", "web", "motiv", "among", "tight", "knit", "commun", "bath", "pastel", "tone", "post", "soviet", "life", "mother", "smartli", "craft", "whodunit", "set", "small", "town", "everyon", "dream", "someth", "bigger", "will", "whatev", "take"], "tmdb_score_value": 0.0, "tmdb_score_count": 0, "imdb_score_value": 6.3, "imdb_score_count": 218, "meta_score_value": 56.0, "meta_score_count": 4}