{"id": "tt5434972", "cast": [{"character": "Narrator", "name": "Kevin Costner"}, {"character": "Himself", "name": "Hank Aaron"}, {"character": "Himself", "name": "Nolan Ryan"}, {"character": "Himself", "name": "Derek Jeter"}, {"character": "Himself", "name": "Denard Span"}, {"character": "Himself", "name": "Craig Kimbrel"}, {"character": "Himself", "name": "Justin Verlander"}, {"character": "Himself", "name": "Bryce Harper"}, {"character": "Clifford Blankenship (voice)", "name": "Chris Cooper"}, {"character": "Himself", "name": "George Brett"}, {"character": "Himself", "name": "Joe Morgan"}, {"character": "Himself", "name": "Johnny Bench"}, {"character": "Himself", "name": "Tony Gwynn"}, {"character": "Himself", "name": "Ernie Banks"}, {"character": "Himself", "name": "Rich Gossage"}, {"character": "Himself", "name": "Mike Schmidt"}, {"character": "Himself", "name": "Arnoldis Chapman"}, {"character": "Himself", "name": "Al Kaline"}, {"character": "Himself", "name": "David Price"}, {"character": "Himself", "name": "Bob Gibson"}], "crew": [{"job": "Director", "name": "Jonathan Hock"}, {"job": "Producer", "name": "Thomas Tull"}, {"job": "Producer", "name": "Philip Aromando"}, {"job": "Producer", "name": "Mike Trollin"}, {"job": "Screenplay", "name": "Jonathan Hock"}], "title": "Fastball", "genres": ["Documentary"], "keywords": ["sports car", "baseball"], "original_language": "English", "rating": "NOT RATED", "release_date": "2016-03-25", "revenue": 0.0, "runtime": 87, "summary": "The essence of baseball is the primal battle between the pitcher and batter, but the magic of the game arises from that confrontation, only 396 milliseconds in the making. The mysteries and memories of Baseball's greatest heroes are revealed in FASTBALL, featuring interviews with dozens of former players, from legendary Hall of Famers to up-and-coming All-Stars, including HANK AARON, NOLAN RYAN, &amp; DEREK JETER, and narrated by KEVIN COSTNER. Based on the original idea by the film's producer, Thomas Tull (\"Dark Knight\") who also produced the Jackie Robinson biopic \"42,\" FASTBALL is peppered with archival footage of baseball's greatest moments plus original high-speed 4K footage and motion graphics that unlock the secrets hidden within a ball traveling over 100 mph. While players, historians, and scientists might disagree on who was actually the fastest pitcher in history - and yes, the film does the physics and concludes with a clear verdict - FASTBALL tells the story of the game itself.", "tokens": ["the", "essenc", "basebal", "primal", "battl", "pitcher", "batter", "magic", "game", "aris", "confront", "396", "millisecond", "make", "the", "mysteri", "memori", "basebal", "greatest", "hero", "reveal", "fastbal", "featur", "interview", "dozen", "former", "player", "legendari", "hall", "famer", "come", "all", "star", "includ", "hank", "aaron", "nolan", "ryan", "&amp", "derek", "jeter", "narrat", "kevin", "costner", "base", "origin", "idea", "film", "produc", "thoma", "tull", "dark", "knight", "also", "produc", "jacki", "robinson", "biopic", "42", "fastbal", "pepper", "archiv", "footag", "basebal", "greatest", "moment", "plu", "origin", "high", "speed", "4k", "footag", "motion", "graphic", "unlock", "secret", "hidden", "within", "ball", "travel", "100", "mph", "while", "player", "historian", "scientist", "might", "disagre", "actual", "fastest", "pitcher", "histori", "ye", "film", "physic", "conclud", "clear", "verdict", "fastbal", "tell", "stori", "game"], "tmdb_score_value": 7.0, "tmdb_score_count": 22, "imdb_score_value": 7.4, "imdb_score_count": 1260, "meta_score_value": 74.0, "meta_score_count": 11}