{"id": "tt5557976", "cast": [{"character": "Himself (archive footage)", "name": "Rand Paul"}], "crew": [{"job": "Director", "name": "Craig Atkinson"}, {"job": "Producer", "name": "Laura Hartrick"}, {"job": "Original Music Composer", "name": "Grayson Sanders"}, {"job": "Original Music Composer", "name": "Michael Stearns"}], "title": "Do Not Resist", "genres": ["Documentary"], "keywords": [], "original_language": "English", "rating": "NOT RATED", "release_date": "2016-04-30", "revenue": 0.0, "runtime": 70, "summary": "An urgent and powerful exploration of the rapid militarization of the police in the United States. Starting on the streets of Ferguson, Missouri, as the community grapples with the death of Michael Brown, DO NOT RESIST - the directorial debut of Detropia cinematographer Craig Atkinson - offers a stunning look at the current state of policing in America and a glimpse into the future. The Tribeca Film Festival winner for Best Documentary puts viewers in the center of the action - from a ride-along with a South Carolina SWAT team and inside a police training seminar that teaches the importance of \"righteous violence\" to the floor of a congressional hearing on the proliferation of military equipment in small-town police departments - before exploring where controversial new technologies including predictive policing algorithms could lead the field next.", "tokens": ["an", "urgent", "power", "explor", "rapid", "militar", "polic", "unit", "state", "start", "street", "ferguson", "missouri", "commun", "grappl", "death", "michael", "brown", "do", "not", "resist", "directori", "debut", "detropia", "cinematograph", "craig", "atkinson", "offer", "stun", "look", "current", "state", "polic", "america", "glimps", "futur", "the", "tribeca", "film", "festiv", "winner", "best", "documentari", "put", "viewer", "center", "action", "ride", "along", "south", "carolina", "swat", "team", "insid", "polic", "train", "seminar", "teach", "import", "righteou", "violenc", "floor", "congression", "hear", "prolifer", "militari", "equip", "small", "town", "polic", "depart", "explor", "controversi", "new", "technolog", "includ", "predict", "polic", "algorithm", "could", "lead", "field", "next"], "tmdb_score_value": 6.8, "tmdb_score_count": 16, "imdb_score_value": 7.0, "imdb_score_count": 904, "meta_score_value": 69.0, "meta_score_count": 14}