{"id": "tt5580536", "cast": [{"character": "Eddie King", "name": "Nicolas Cage"}, {"character": "Rob", "name": "Christopher Rob Bowen"}, {"character": "JP", "name": "Adrian Grenier"}, {"character": "Sal", "name": "John Cusack"}, {"character": "Lizzie", "name": "Lydia Hull"}, {"character": "Mikey", "name": "Johnathon Schaech"}, {"character": "Hoya", "name": "C.J. LeBlanc"}, {"character": "Alexis", "name": "Abbie Gayle"}, {"character": "Young JP", "name": "Kelton DuMont"}, {"character": "Kristy", "name": "Heather Johansen"}], "crew": [{"job": "Director", "name": "Steven C. Miller"}, {"job": "Writer", "name": "Jason Mosberg"}, {"job": "Producer", "name": "George Furla"}, {"job": "Producer", "name": "Randall Emmett"}], "title": "Arsenal", "genres": ["Action", "Crime", "Thriller"], "keywords": ["sibling relationship", "kidnapping", "mobster"], "original_language": "English", "rating": "R", "release_date": "2017-01-06", "revenue": 0.0, "runtime": 92, "summary": "A powerful action thriller, ARSENAL tells the intertwining stories of the Lindel brothers, Mikey (Johnathon Schaech) and JP (Adrian Grenier), who had only each other to rely on growing up. As adults, JP found success as the owner of a construction company, while Mikey became a small-time mobster, mired in a life of petty crime. When Mikey is kidnapped and held for a ransom by ruthless crime boss Eddie King (Nicolas Cage), JP turns to the brothers' old pal Sal (John Cusack), a plain clothes detective for help. In order to rescue his brother, JP must risk everything and unleash his vengeance against King's relentless army of gangsters.", "tokens": ["a", "power", "action", "thriller", "arsen", "tell", "intertwin", "stori", "lindel", "brother", "mikei", "johnathon", "schaech", "jp", "adrian", "grenier", "reli", "grow", "as", "adult", "jp", "found", "success", "owner", "construct", "compani", "mikei", "becam", "small", "time", "mobster", "mire", "life", "petti", "crime", "when", "mikei", "kidnap", "held", "ransom", "ruthless", "crime", "boss", "eddi", "king", "nicola", "cage", "jp", "turn", "brother", "old", "pal", "sal", "john", "cusack", "plain", "cloth", "detect", "help", "in", "order", "rescu", "brother", "jp", "must", "risk", "everyth", "unleash", "vengeanc", "king", "relentless", "armi", "gangster"], "tmdb_score_value": 4.6, "tmdb_score_count": 42, "imdb_score_value": 4.0, "imdb_score_count": 2765, "meta_score_value": 25.0, "meta_score_count": 10}