{"id": "tt5752360", "cast": [{"character": "Julia", "name": "Whitney Cummings"}, {"character": "Lisa", "name": "Sof\u00eda Vergara"}, {"character": "Kevin", "name": "Toby Kebbell"}, {"character": "Adam", "name": "James Marsden"}, {"character": "Lexi", "name": "Lucy Punch"}, {"character": "Abby", "name": "Beanie Feldstein"}, {"character": "Zoe", "name": "Cecily Strong"}, {"character": "Greg", "name": "Blake Griffin"}, {"character": "Steven", "name": "Deon Cole"}, {"character": "Bashir", "name": "Vinoj Zacharia"}, {"character": "Hank", "name": "Adam Shapiro"}, {"character": "Bill", "name": "Phil Hendrie"}, {"character": "Maggie", "name": "Xosha Roquemore"}, {"character": "Therapist", "name": "Will Sasso"}, {"character": "Charlie", "name": "Chris D'Elia"}, {"character": "Lola", "name": "Rebeka Montoya"}, {"character": "Rebecca", "name": "Gwen Hollander"}, {"character": "Erin", "name": "Alysia Reiner"}, {"character": "Emily", "name": "Lisa Linke"}], "crew": [{"job": "Director", "name": "Whitney Cummings"}, {"job": "Screenplay", "name": "Neal Brennan"}, {"job": "Screenplay", "name": "Whitney Cummings"}, {"job": "Producer", "name": "Erika Olde"}, {"job": "Producer", "name": "Michael Roiff"}, {"job": "Original Music Composer", "name": "Jeff Cardoni"}], "title": "The Female Brain", "genres": ["Comedy"], "keywords": ["woman director"], "original_language": "English", "rating": "NOT RATED", "release_date": "2017-06-17", "revenue": 0.0, "runtime": 98, "summary": "What makes a woman swipe right for Mr. Wrong and left for Mr. Right? This is a look at the real-life science behind our (often regrettable) romantic impulses. Writer-director Whitney Cummings (2 Broke Girls) stars as no-nonsense neuroscientist Julia, whose research into the biochemistry of the female brain is illustrated by three couples: newlyweds Zoe (Cecily Strong) and Greg (Blake Griffin), whose career troubles seep into their relationship; Lisa (Sofia Vergara) and Steven (Deon Cole), who are looking to spice up their stuck-in-a-rut marriage; and Lexi (Lucy Punch) who can't help trying to change her boyfriend Adam (James Marsden). Meanwhile, the straight-laced Julia's own synapses start to fire when a handsome new subject (Toby Kebbell) joins her study.", "tokens": ["what", "make", "woman", "swipe", "right", "mr", "wrong", "left", "mr", "right", "thi", "look", "real", "life", "scienc", "behind", "often", "regrett", "romant", "impuls", "writer", "director", "whitnei", "cum", "2", "broke", "girl", "star", "nonsens", "neuroscientist", "julia", "whose", "research", "biochemistri", "femal", "brain", "illustr", "three", "coupl", "newlyw", "zoe", "cecili", "strong", "greg", "blake", "griffin", "whose", "career", "troubl", "seep", "relationship", "lisa", "sofia", "vergara", "steven", "deon", "cole", "look", "spice", "stuck", "rut", "marriag", "lexi", "luci", "punch", "help", "try", "chang", "boyfriend", "adam", "jame", "marsden", "meanwhil", "straight", "lace", "julia", "synaps", "start", "fire", "handsom", "new", "subject", "tobi", "kebbel", "join", "studi"], "tmdb_score_value": 5.9, "tmdb_score_count": 14, "imdb_score_value": 5.5, "imdb_score_count": 703, "meta_score_value": 41.0, "meta_score_count": 9}