{"id": "tt5843574", "cast": [{"character": "Himself, Playwright", "name": "Ayad Akhtar"}, {"character": "Himself, Novelist", "name": "Michael Chabon"}, {"character": "Himself, Musician", "name": "David Crosby"}, {"character": "Himself", "name": "John Lithgow"}, {"character": "Herself", "name": "Helen Mirren"}, {"character": "Himself", "name": "Martin Scorsese"}, {"character": "Herself", "name": "Natalie Portman"}, {"character": "Himself", "name": "Liev Schreiber"}], "crew": [{"job": "Director", "name": "Kirk Simon"}], "title": "The Pulitzer At 100", "genres": ["Documentary"], "keywords": ["pulitzer prize"], "original_language": "English", "rating": "NOT RATED", "release_date": "2017-07-21", "revenue": 0.0, "runtime": 90, "summary": "The Pulitzer at 100, by Oscar and Emmy winning director Kirk Simon, is a ninety-minute independent documentary released in the Pulitzer's 100th year. The film is told through the riveting stories of the artists that have won the prestigious prize, with Pulitzer work read by Helen Mirren, Natalie Portman, Liev Schreiber, John Lithgow and Yara Shahidi. Journalists Carl Bernstein, Nick Kristof, Thomas Friedman, David Remnick, writers Toni Morrison, Michael Chabon, Junot D\u00edaz, Tony Kushner, Ayad Akhtar, musicians Wynton Marsalis, David Crosby, John Adams, and many others recount the stories behind America's most beloved works in arts and letters.", "tokens": ["the", "pulitz", "100", "oscar", "emmi", "win", "director", "kirk", "simon", "nineti", "minut", "independ", "documentari", "releas", "pulitz", "100th", "year", "the", "film", "told", "rivet", "stori", "artist", "prestigi", "prize", "pulitz", "work", "read", "helen", "mirren", "natali", "portman", "liev", "schreiber", "john", "lithgow", "yara", "shahidi", "journalist", "carl", "bernstein", "nick", "kristof", "thoma", "friedman", "david", "remnick", "writer", "toni", "morrison", "michael", "chabon", "junot", "d\u00edaz", "toni", "kushner", "ayad", "akhtar", "musician", "wynton", "marsali", "david", "crosbi", "john", "adam", "mani", "other", "recount", "stori", "behind", "america", "belov", "work", "art", "letter"], "tmdb_score_value": 0.0, "tmdb_score_count": 0, "imdb_score_value": 6.7, "imdb_score_count": 19, "meta_score_value": 43.0, "meta_score_count": 4}