{"id": "tt6107412", "cast": [{"character": "Alva", "name": "Neneh Cherry"}], "crew": [{"job": "Director", "name": "Mark Cousins"}, {"job": "Screenplay", "name": "Mark Cousins"}, {"job": "Producer", "name": "Anita Oxburgh"}, {"job": "Producer", "name": "Mary Bell"}, {"job": "Producer", "name": "Adam Dawtrey"}, {"job": "Writer", "name": "Mark Cousins"}, {"job": "Writer", "name": "Anita Oxburgh"}], "title": "Stockholm, My Love", "genres": ["Documentary", "Drama", "Music"], "keywords": ["stockholm"], "original_language": "English", "rating": "NOT RATED", "release_date": "2016-11-16", "revenue": 0.0, "runtime": 88, "summary": "Stockholm My Love is a city symphony, a love letter to Stockholm, the fiction debut of director Mark Cousins and the acting debut of musician Neneh Cherry. It follows one woman's footsteps through the streets of her native city, on a journey of recovery from a bad thing that happened to her exactly one year before. It's an exploration of grief, identity and the power of architecture and urbanism to shape lives, and a celebration of the power of walking and looking to make us all feel just a little bit better. With new music by Neneh Cherry, old music by Benny Andersson (of ABBA) and Franz Berwald, and images by Christopher Doyle and Mark Cousins.", "tokens": ["stockholm", "my", "love", "citi", "symphoni", "love", "letter", "stockholm", "fiction", "debut", "director", "mark", "cousin", "act", "debut", "musician", "neneh", "cherri", "it", "follow", "on", "woman", "footstep", "street", "nativ", "citi", "journei", "recoveri", "bad", "thing", "happen", "exactli", "on", "year", "it", "explor", "grief", "ident", "power", "architectur", "urban", "shape", "live", "celebr", "power", "walk", "look", "make", "us", "feel", "littl", "bit", "better", "with", "new", "music", "neneh", "cherri", "old", "music", "benni", "andersson", "abba", "franz", "berwald", "imag", "christoph", "doyl", "mark", "cousin"], "tmdb_score_value": 6.3, "tmdb_score_count": 4, "imdb_score_value": 4.6, "imdb_score_count": 125, "meta_score_value": 61.0, "meta_score_count": 5}