{"id": "tt6164502", "cast": [{"character": "Liina", "name": "Rea Lest"}, {"character": "Hans", "name": "J\u00f6rgen Liik"}, {"character": "Rein", "name": "Arvo Kukum\u00e4gi"}, {"character": "Luise", "name": "Katariina Unt"}, {"character": "Ints", "name": "Taavi Eelmaa"}], "crew": [{"job": "Director", "name": "Rainer Sarnet"}, {"job": "Writer", "name": "Rainer Sarnet"}, {"job": "Producer", "name": "Katrin Kissa"}], "title": "November", "genres": ["Romance", "Drama", "Fantasy"], "keywords": ["black and white", "pagan", "estonia"], "original_language": "Estonian", "rating": "NOT RATED", "release_date": "2017-02-03", "revenue": 0.0, "runtime": 115, "summary": "\"November\" is based on Estonian novel \"Rehepapp\" by Andrus Kivir\u00e4hk, a bestseller of the last twenty years. The film is a mixture of magic, black humor and romantic love. The story is set in a pagan Estonian village where werewolves, the plague, and spirits roam. The villagers' main problem is how to survive the cold, dark winter. And, to that aim, nothing is taboo. People steal from each other, from their German manor lords, and from spirits, the devil, and Christ. To guard their souls, they'll give them away to thieving creatures made of wood and metal called kratts, who help their masters by stealing more. They steal even if their barns are already overflowing. Stealing is an obsession that makes the villagers more and more like the soulless creatures they command, the kratts. The main character of the film is a young farm girl named Liina who is hopelessly and forlornly in love with a village boy named Hans. Her longing makes the girl become a werewolf and jump into an ice-cold ...", "tokens": ["novemb", "base", "estonian", "novel", "rehepapp", "andru", "kivir\u00e4hk", "bestsel", "last", "twenti", "year", "the", "film", "mixtur", "magic", "black", "humor", "romant", "love", "the", "stori", "set", "pagan", "estonian", "villag", "werewolv", "plagu", "spirit", "roam", "the", "villag", "main", "problem", "surviv", "cold", "dark", "winter", "and", "aim", "noth", "taboo", "peopl", "steal", "german", "manor", "lord", "spirit", "devil", "christ", "to", "guard", "soul", "give", "awai", "thiev", "creatur", "made", "wood", "metal", "call", "kratt", "help", "master", "steal", "thei", "steal", "even", "barn", "alreadi", "overflow", "steal", "obsess", "make", "villag", "like", "soulless", "creatur", "command", "kratt", "the", "main", "charact", "film", "young", "farm", "girl", "name", "liina", "hopelessli", "forlornli", "love", "villag", "boi", "name", "han", "her", "long", "make", "girl", "becom", "werewolf", "jump", "ic", "cold"], "tmdb_score_value": 8.3, "tmdb_score_count": 4, "imdb_score_value": 7.2, "imdb_score_count": 721, "meta_score_value": 79.0, "meta_score_count": 10}