{"id": "tt6175710", "cast": [{"character": "Herself", "name": "Nichole Alred"}, {"character": "Herself", "name": "Jas Boothe"}, {"character": "Herself", "name": "Rachel Engler"}, {"character": "Herself", "name": "Hope Garcia"}, {"character": "Herself", "name": "Denyse Gordon"}, {"character": "Herself", "name": "Marissa Strock"}, {"character": "Herself", "name": "Andrea Waterbury"}], "crew": [{"job": "Director", "name": "Lysa Hayland Heslov"}, {"job": "Writer", "name": "Tchavdar Georgiev"}, {"job": "Writer", "name": "Lysa Hayland Heslov"}, {"job": "Producer", "name": "Seth Gordon"}, {"job": "Producer", "name": "Lysa Hayland Heslov"}, {"job": "Producer", "name": "Linda Perry"}], "title": "Served Like a Girl", "genres": ["Documentary"], "keywords": ["politics", "military", "woman director", "beauty pageant", "equal treatment", "women's rights"], "original_language": "English", "rating": "NOT RATED", "release_date": "2017-11-08", "revenue": 8290.0, "runtime": 103, "summary": "Director Lysa Heslov's documentary, \"Served Like a Girl, provides a candid look at several American women as they transition from active duty to civilian life after serving tours of duty in Iraq and Afghanistan. Our wounded U.S. female service personnel often return to a stark reality, one that is rarely discussed or considered. Struggling with PTSD, homelessness, broken families, serious illness, physical injuries, and the aftermath of military sexual abuse, these amazing women find ways to adapt and overcome debilitating challenges through participation in the \"Ms. Veteran America\" competition. Guided by event founder and veteran, Jas Boothe, the women leverage their experiences gained through competition to recover the parts of themselves and their personal identities they had lost on the battlefield. Called \"Engaging, Honest and Powerful,\" this film is a beautiful tapestry interlaced with poignant moments, social commentary, and humor.", "tokens": ["director", "lysa", "heslov", "documentari", "serv", "like", "girl", "provid", "candid", "look", "sever", "american", "women", "transit", "activ", "duti", "civilian", "life", "serv", "tour", "duti", "iraq", "afghanistan", "our", "wound", "u", "s", "femal", "servic", "personnel", "often", "return", "stark", "realiti", "on", "rare", "discuss", "consid", "struggl", "ptsd", "homeless", "broken", "famili", "seriou", "ill", "physic", "injuri", "aftermath", "militari", "sexual", "abus", "amaz", "women", "find", "wai", "adapt", "overcom", "debilit", "challeng", "particip", "ms", "veteran", "america", "competit", "guid", "event", "founder", "veteran", "ja", "booth", "women", "leverag", "experi", "gain", "competit", "recov", "part", "person", "ident", "lost", "battlefield", "call", "engag", "honest", "power", "film", "beauti", "tapestri", "interlac", "poignant", "moment", "social", "commentari", "humor"], "tmdb_score_value": 0.0, "tmdb_score_count": 0, "imdb_score_value": 6.0, "imdb_score_count": 79, "meta_score_value": 85.0, "meta_score_count": 5}