{"id": "tt6319654", "cast": [{"character": "Himself", "name": "Hadi Al Abdullah"}, {"character": "Himself", "name": "Raed Al Saleh"}, {"character": "Narrator", "name": "Helen Mirren"}], "crew": [{"job": "Director", "name": "Evgeny Afineevsky"}, {"job": "Producer", "name": "Evgeny Afineevsky"}, {"job": "Producer", "name": "Den Tolmor"}, {"job": "Producer", "name": "Aaron I. Butler"}, {"job": "Original Music Composer", "name": "Martin Tillman"}], "title": "Cries from Syria", "genres": ["Documentary"], "keywords": ["syria"], "original_language": "English", "rating": "TV-MA", "release_date": "2017-01-22", "revenue": 0.0, "runtime": 112, "summary": "CRIES FROM SYRIA is a searing, comprehensive account of a brutal five-year conflict from the inside out, drawing on hundreds of hours of war footage from Syrian activists and citizen journalists, as well as testimony from child protesters, leaders of the revolution, human rights defenders, ordinary citizens, and high-ranking army generals who defected from the government. Their collective stories are a cry for attention and help from a world that little understands their reality or agrees on what to do about it. A documentary by Evgeny Afineevsky, director of the Oscar-nominated film WINTER ON FIRE, CRIES FROM SYRIA premiered at the 2017 Sundance Film Festival.", "tokens": ["cri", "from", "syria", "sear", "comprehens", "account", "brutal", "five", "year", "conflict", "insid", "draw", "hundr", "hour", "war", "footag", "syrian", "activist", "citizen", "journalist", "well", "testimoni", "child", "protest", "leader", "revolut", "human", "right", "defend", "ordinari", "citizen", "high", "rank", "armi", "gener", "defect", "govern", "their", "collect", "stori", "cry", "attent", "help", "world", "littl", "understand", "realiti", "agre", "a", "documentari", "evgeni", "afineevski", "director", "oscar", "nomin", "film", "winter", "on", "fire", "cri", "from", "syria", "premier", "2017", "sundanc", "film", "festiv"], "tmdb_score_value": 8.0, "tmdb_score_count": 3, "imdb_score_value": 7.9, "imdb_score_count": 622, "meta_score_value": 76.0, "meta_score_count": 6}