{"id": "tt6573444", "cast": [{"character": "Himself", "name": "Boris Cheshirkov"}, {"character": "Herself", "name": "Marin Din Kajdomcaj"}, {"character": "Herself", "name": "Princess Dana Firas of Jordan"}], "crew": [{"job": "Director", "name": "Ai Weiwei"}, {"job": "Writer", "name": "Chin-Chin Yap"}, {"job": "Writer", "name": "Tim Finch"}, {"job": "Writer", "name": "Boris Cheshirkov"}], "title": "Human Flow", "genres": ["Documentary"], "keywords": ["refugee"], "original_language": "English", "rating": "PG-13", "release_date": "2017-10-02", "revenue": 0.0, "runtime": 140, "summary": "Over 65 million people around the world have been forced from their homes to escape famine, climate change and war in the greatest human displacement since World War II. Human Flow, an epic film journey led by the internationally renowned artist Ai Weiwei, gives a powerful visual expression to this massive human migration. The documentary elucidates both the staggering scale of the refugee crisis and its profoundly personal human impact. Captured over the course of an eventful year in 23 countries, the film follows a chain of urgent human stories that stretches across the globe in countries including Afghanistan, Bangladesh, France, Greece, Germany, Iraq, Israel, Italy, Kenya, Mexico, and Turkey. Human Flow is a witness to its subjects and their desperate search for safety, shelter and justice: from teeming refugee camps to perilous ocean crossings to barbed-wire borders; from dislocation and disillusionment to courage, endurance and adaptation; from the haunting lure of lives left ...", "tokens": ["over", "65", "million", "peopl", "around", "world", "forc", "home", "escap", "famin", "climat", "chang", "war", "greatest", "human", "displac", "sinc", "world", "war", "ii", "human", "flow", "epic", "film", "journei", "led", "internation", "renown", "artist", "ai", "weiwei", "give", "power", "visual", "express", "massiv", "human", "migrat", "the", "documentari", "elucid", "stagger", "scale", "refuge", "crisi", "profoundli", "person", "human", "impact", "captur", "cours", "event", "year", "23", "countri", "film", "follow", "chain", "urgent", "human", "stori", "stretch", "across", "globe", "countri", "includ", "afghanistan", "bangladesh", "franc", "greec", "germani", "iraq", "israel", "itali", "kenya", "mexico", "turkei", "human", "flow", "wit", "subject", "desper", "search", "safeti", "shelter", "justic", "teem", "refuge", "camp", "peril", "ocean", "cross", "barb", "wire", "border", "disloc", "disillusion", "courag", "endur", "adapt", "haunt", "lure", "live", "left"], "tmdb_score_value": 6.7, "tmdb_score_count": 22, "imdb_score_value": 6.8, "imdb_score_count": 1172, "meta_score_value": 77.0, "meta_score_count": 22}