{"id": "tt6903636", "cast": [{"character": "Herself", "name": "Grace Jones"}, {"character": "Himself", "name": "Jean-Paul Goude"}, {"character": "Himself", "name": "Lowell \"Sly\" Dunbar"}, {"character": "Himself", "name": "Robbie Shakespeare"}], "crew": [{"job": "Director", "name": "Sophie Fiennes"}, {"job": "Producer", "name": "Sophie Fiennes"}], "title": "Grace Jones: Bloodlight and Bami", "genres": ["Music", "Documentary"], "keywords": ["disco"], "original_language": "English", "rating": "NOT RATED", "release_date": "2017-10-25", "revenue": 0.0, "runtime": 115, "summary": "Larger than life, wild, scary and androgynous - Grace Jones plays all these parts. Yet here we also discover her as a lover, daughter, mother, sister and even grandmother, as she submits herself to our gaze and allows us to understand what constitutes her mask. The stage is where her most extreme embodiments are realised and her theatrical imagination lets loose: this is where the musical of her life is played out. The film includes Grace's unique performances singing iconic hits such as Slave To The Rhythm, Pull Up To The Bumper, as well as the more recent autobiographical tracks Williams' Bloods and Hurricane. These personal songs also link to Grace's family life, as the film takes us on a holiday road trip across Jamaica, where her family roots and the story of her traumatic childhood are uncovered. In Jamaican patois, 'Bloodlight' is the red light that illuminates when an artist is recording and 'Bami' means bread, the substance of daily life. Grace Jones: Bloodlight and Bami ...", "tokens": ["larger", "life", "wild", "scari", "androgyn", "grace", "jone", "plai", "part", "yet", "also", "discov", "lover", "daughter", "mother", "sister", "even", "grandmoth", "submit", "gaze", "allow", "us", "understand", "constitut", "mask", "the", "stage", "extrem", "embodi", "realis", "theatric", "imagin", "let", "loos", "music", "life", "plai", "the", "film", "includ", "grace", "uniqu", "perform", "sing", "icon", "hit", "slave", "to", "the", "rhythm", "pull", "up", "to", "the", "bumper", "well", "recent", "autobiograph", "track", "william", "blood", "hurrican", "these", "person", "song", "also", "link", "grace", "famili", "life", "film", "take", "us", "holidai", "road", "trip", "across", "jamaica", "famili", "root", "stori", "traumat", "childhood", "uncov", "in", "jamaican", "patoi", "bloodlight", "red", "light", "illumin", "artist", "record", "bami", "mean", "bread", "substanc", "daili", "life", "grace", "jone", "bloodlight", "bami"], "tmdb_score_value": 7.0, "tmdb_score_count": 2, "imdb_score_value": 6.1, "imdb_score_count": 230, "meta_score_value": 75.0, "meta_score_count": 13}