{"id": "tt7435110", "cast": [{"character": "Himself", "name": "Eddie Vedder"}, {"character": "Himself", "name": "Mike McCready"}, {"character": "Himself", "name": "Stone Gossard"}, {"character": "Himself", "name": "Matt Cameron"}, {"character": "Himself", "name": "Jeff Ament"}, {"character": "himself", "name": "Theo Epstein"}], "crew": [{"job": "Director", "name": "Danny Clinch"}, {"job": "Producer", "name": "Christian Fresco"}, {"job": "Producer", "name": "Marc Cimino"}, {"job": "Producer", "name": "Monte Lipman"}, {"job": "Producer", "name": "Michele Anthony"}, {"job": "Producer", "name": "Lindha Narvaez"}], "title": "Pearl Jam: Let's Play Two", "genres": ["Music", "Documentary"], "keywords": ["concert", "pearl jam"], "original_language": "English", "rating": "NOT RATED", "release_date": "2017-09-29", "revenue": 0.0, "runtime": 120, "summary": "Let's Play Two is a documentary film that chronicles Pearl Jam's legendary performances at Wrigley Field during the Chicago Cubs historic 2016 season. With Chicago being a hometown to Eddie Vedder, Pearl Jam has forged a relationship with the city, the Chicago Cubs and Wrigley Field that is unparalleled in the world of sports and music. From Ten to Lightning Bolt, the documentary film shuffles through Pearl Jam's ever-growing catalog of originals and covers - spanning the band's 25-year career. Through the eyes of renowned director/photographer Danny Clinch and the voice of Pearl Jam, the film showcases the journey of this special relationship.", "tokens": ["let", "plai", "two", "documentari", "film", "chronicl", "pearl", "jam", "legendari", "perform", "wriglei", "field", "chicago", "cub", "histor", "2016", "season", "with", "chicago", "hometown", "eddi", "vedder", "pearl", "jam", "forg", "relationship", "citi", "chicago", "cub", "wriglei", "field", "unparallel", "world", "sport", "music", "from", "ten", "lightn", "bolt", "documentari", "film", "shuffl", "pearl", "jam", "ever", "grow", "catalog", "origin", "cover", "span", "band", "25", "year", "career", "through", "ey", "renown", "director/photograph", "danni", "clinch", "voic", "pearl", "jam", "film", "showcas", "journei", "special", "relationship"], "tmdb_score_value": 9.0, "tmdb_score_count": 4, "imdb_score_value": 8.5, "imdb_score_count": 347, "meta_score_value": 75.0, "meta_score_count": 6}